results/cutlass/cutlass_f16tc.gemm.csv
Problem,Provider,OperationKind,Operation,Disposition,Status,gemm_kind,m,n,k,A,B,C,D,alpha,beta,split_k_mode,split_k_slices,batch_count,raster_order,runtime_input_datatype_a,runtime_input_datatype_b,use_pdl,enable_sm90_mixed_dtype_shuffle_test,swizzle_size,op_class,accum,cta_m,cta_n,cta_k,cluster_m,cluster_n,cluster_k,cluster_m_fallback,cluster_n_fallback,cluster_k_fallback,stages,warps_m,warps_n,warps_k,inst_m,inst_n,inst_k,min_cc,max_cc,Bytes,Flops,Flops/Byte,Runtime,GB/s,GFLOPs
1,CUTLASS,gemm,cutlass_tensorop_s884gemm_f16_256x128_32x2_nn_align8,passed,success,universal,128,128,128,f16:column,f16:column,f32:column,f32:column,1,0,serial,1,1,heuristic,invalid,invalid,false,false,1,tensorop,f32,256,128,32,1,1,1,0,0,0,2,4,2,1,16,16,4,70,75,131072,4227072,32,0.0182726,6.6805,231.333
1,CUTLASS,gemm,cutlass_tensorop_s884gemm_f16_256x128_32x2_nt_align8,passed,success,universal,128,128,128,f16:column,f16:row,f32:column,f32:column,1,0,serial,1,1,heuristic,invalid,invalid,false,false,1,tensorop,f32,256,128,32,1,1,1,0,0,0,2,4,2,1,16,16,4,70,75,131072,4227072,32,0.0202531,6.02724,208.712
1,CUTLASS,gemm,cutlass_tensorop_s884gemm_f16_256x128_32x2_tn_align8,passed,success,universal,128,128,128,f16:row,f16:column,f32:column,f32:column,1,0,serial,1,1,heuristic,invalid,invalid,false,false,1,tensorop,f32,256,128,32,1,1,1,0,0,0,2,4,2,1,16,16,4,70,75,131072,4227072,32,0.0182544,6.68717,231.565
1,CUTLASS,gemm,cutlass_tensorop_s884gemm_f16_256x128_32x2_tt_align8,passed,success,universal,128,128,128,f16:row,f16:row,f32:column,f32:column,1,0,serial,1,1,heuristic,invalid,invalid,false,false,1,tensorop,f32,256,128,32,1,1,1,0,0,0,2,4,2,1,16,16,4,70,75,131072,4227072,32,0.0181952,6.70893,232.318
1,CUTLASS,gemm,cutlass_tensorop_f16_s884gemm_f16_256x128_32x2_nn_align8,passed,success,universal,128,128,128,f16:column,f16:column,f16:column,f16:column,1,0,serial,1,1,heuristic,invalid,invalid,false,false,1,tensorop,f32,256,128,32,1,1,1,0,0,0,2,4,2,1,16,16,4,70,75,98304,4227072,43,0.0192301,4.76091,219.816
1,CUTLASS,gemm,cutlass_tensorop_f16_s884gemm_f16_256x128_32x2_nt_align8,passed,success,universal,128,128,128,f16:column,f16:row,f16:column,f16:column,1,0,serial,1,1,heuristic,invalid,invalid,false,false,1,tensorop,f32,256,128,32,1,1,1,0,0,0,2,4,2,1,16,16,4,70,75,98304,4227072,43,0.0211722,4.3242,199.652
1,CUTLASS,gemm,cutlass_tensorop_f16_s884gemm_f16_256x128_32x2_tn_align8,passed,success,universal,128,128,128,f16:row,f16:column,f16:column,f16:column,1,0,serial,1,1,heuristic,invalid,invalid,false,false,1,tensorop,f32,256,128,32,1,1,1,0,0,0,2,4,2,1,16,16,4,70,75,98304,4227072,43,0.0192541,4.75498,219.542
1,CUTLASS,gemm,cutlass_tensorop_f16_s884gemm_f16_256x128_32x2_tt_align8,passed,success,universal,128,128,128,f16:row,f16:row,f16:column,f16:column,1,0,serial,1,1,heuristic,invalid,invalid,false,false,1,tensorop,f32,256,128,32,1,1,1,0,0,0,2,4,2,1,16,16,4,70,75,98304,4227072,43,0.0191834,4.77251,220.351
1,CUTLASS,gemm,cutlass_tensorop_s1688gemm_f16_256x128_32x2_nn_align8,passed,success,universal,128,128,128,f16:column,f16:column,f32:column,f32:column,1,0,serial,1,1,heuristic,invalid,invalid,false,false,1,tensorop,f32,256,128,32,1,1,1,0,0,0,2,4,2,1,16,8,8,75,1024,131072,4227072,32,0.0106282,11.4856,397.724
1,CUTLASS,gemm,cutlass_tensorop_s1688gemm_f16_256x128_32x2_nt_align8,passed,success,universal,128,128,128,f16:column,f16:row,f32:column,f32:column,1,0,serial,1,1,heuristic,invalid,invalid,false,false,1,tensorop,f32,256,128,32,1,1,1,0,0,0,2,4,2,1,16,8,8,75,1024,131072,4227072,32,0.0105174,11.6065,401.911
1,CUTLASS,gemm,cutlass_tensorop_s1688gemm_f16_256x128_32x2_tn_align8,passed,success,universal,128,128,128,f16:row,f16:column,f32:column,f32:column,1,0,serial,1,1,heuristic,invalid,invalid,false,false,1,tensorop,f32,256,128,32,1,1,1,0,0,0,2,4,2,1,16,8,8,75,1024,131072,4227072,32,0.010719,11.3882,394.352
1,CUTLASS,gemm,cutlass_tensorop_s1688gemm_f16_256x128_32x2_tt_align8,passed,success,universal,128,128,128,f16:row,f16:row,f32:column,f32:column,1,0,serial,1,1,heuristic,invalid,invalid,false,false,1,tensorop,f32,256,128,32,1,1,1,0,0,0,2,4,2,1,16,8,8,75,1024,131072,4227072,32,0.0106058,11.5098,398.564
1,CUTLASS,gemm,cutlass_tensorop_f16_s1688gemm_f16_256x128_32x2_nn_align8,passed,success,universal,128,128,128,f16:column,f16:column,f16:column,f16:column,1,0,serial,1,1,heuristic,invalid,invalid,false,false,1,tensorop,f32,256,128,32,1,1,1,0,0,0,2,4,2,1,16,8,8,75,1024,98304,4227072,43,0.0112547,8.13461,375.582
1,CUTLASS,gemm,cutlass_tensorop_f16_s1688gemm_f16_256x128_32x2_nt_align8,passed,success,universal,128,128,128,f16:column,f16:row,f16:column,f16:column,1,0,serial,1,1,heuristic,invalid,invalid,false,false,1,tensorop,f32,256,128,32,1,1,1,0,0,0,2,4,2,1,16,8,8,75,1024,98304,4227072,43,0.0112938,8.10649,374.284
1,CUTLASS,gemm,cutlass_tensorop_f16_s1688gemm_f16_256x128_32x2_tn_align8,passed,success,universal,128,128,128,f16:row,f16:column,f16:column,f16:column,1,0,serial,1,1,heuristic,invalid,invalid,false,false,1,tensorop,f32,256,128,32,1,1,1,0,0,0,2,4,2,1,16,8,8,75,1024,98304,4227072,43,0.0113885,8.03907,371.171
1,CUTLASS,gemm,cutlass_tensorop_f16_s1688gemm_f16_256x128_32x2_tt_align8,passed,success,universal,128,128,128,f16:row,f16:row,f16:column,f16:column,1,0,serial,1,1,heuristic,invalid,invalid,false,false,1,tensorop,f32,256,128,32,1,1,1,0,0,0,2,4,2,1,16,8,8,75,1024,98304,4227072,43,0.0112323,8.15083,376.331
2,CUTLASS,gemm,cutlass_tensorop_s884gemm_f16_256x128_32x2_nn_align8,passed,success,universal,256,128,128,f16:column,f16:column,f32:column,f32:column,1,0,serial,1,1,heuristic,invalid,invalid,false,false,1,tensorop,f32,256,128,32,1,1,1,0,0,0,2,4,2,1,16,16,4,70,75,229376,8454144,36,0.0182432,11.7097,463.413
2,CUTLASS,gemm,cutlass_tensorop_s884gemm_f16_256x128_32x2_nt_align8,passed,success,universal,256,128,128,f16:column,f16:row,f32:column,f32:column,1,0,serial,1,1,heuristic,invalid,invalid,false,false,1,tensorop,f32,256,128,32,1,1,1,0,0,0,2,4,2,1,16,16,4,70,75,229376,8454144,36,0.0202365,10.5563,417.768
2,CUTLASS,gemm,cutlass_tensorop_s884gemm_f16_256x128_32x2_tn_align8,passed,success,universal,256,128,128,f16:row,f16:column,f32:column,f32:column,1,0,serial,1,1,heuristic,invalid,invalid,false,false,1,tensorop,f32,256,128,32,1,1,1,0,0,0,2,4,2,1,16,16,4,70,75,229376,8454144,36,0.0182675,11.6941,462.796
2,CUTLASS,gemm,cutlass_tensorop_s884gemm_f16_256x128_32x2_tt_align8,passed,success,universal,256,128,128,f16:row,f16:row,f32:column,f32:column,1,0,serial,1,1,heuristic,invalid,invalid,false,false,1,tensorop,f32,256,128,32,1,1,1,0,0,0,2,4,2,1,16,16,4,70,75,229376,8454144,36,0.0181907,11.7435,464.75
2,CUTLASS,gemm,cutlass_tensorop_f16_s884gemm_f16_256x128_32x2_nn_align8,passed,success,universal,256,128,128,f16:column,f16:column,f16:column,f16:column,1,0,serial,1,1,heuristic,invalid,invalid,false,false,1,tensorop,f32,256,128,32,1,1,1,0,0,0,2,4,2,1,16,16,4,70,75,163840,8454144,51,0.0192531,7.92536,439.105
2,CUTLASS,gemm,cutlass_tensorop_f16_s884gemm_f16_256x128_32x2_nt_align8,passed,success,universal,256,128,128,f16:column,f16:row,f16:column,f16:column,1,0,serial,1,1,heuristic,invalid,invalid,false,false,1,tensorop,f32,256,128,32,1,1,1,0,0,0,2,4,2,1,16,16,4,70,75,163840,8454144,51,0.0212125,7.19331,398.546
2,CUTLASS,gemm,cutlass_tensorop_f16_s884gemm_f16_256x128_32x2_tn_align8,passed,success,universal,256,128,128,f16:row,f16:column,f16:column,f16:column,1,0,serial,1,1,heuristic,invalid,invalid,false,false,1,tensorop,f32,256,128,32,1,1,1,0,0,0,2,4,2,1,16,16,4,70,75,163840,8454144,51,0.0193552,7.88356,436.789
2,CUTLASS,gemm,cutlass_tensorop_f16_s884gemm_f16_256x128_32x2_tt_align8,passed,success,universal,256,128,128,f16:row,f16:row,f16:column,f16:column,1,0,serial,1,1,heuristic,invalid,invalid,false,false,1,tensorop,f32,256,128,32,1,1,1,0,0,0,2,4,2,1,16,16,4,70,75,163840,8454144,51,0.019223,7.93776,439.792
2,CUTLASS,gemm,cutlass_tensorop_s1688gemm_f16_256x128_32x2_nn_align8,passed,success,universal,256,128,128,f16:column,f16:column,f32:column,f32:column,1,0,serial,1,1,heuristic,invalid,invalid,false,false,1,tensorop,f32,256,128,32,1,1,1,0,0,0,2,4,2,1,16,8,8,75,1024,229376,8454144,36,0.0105443,20.2595,801.772
2,CUTLASS,gemm,cutlass_tensorop_s1688gemm_f16_256x128_32x2_nt_align8,passed,success,universal,256,128,128,f16:column,f16:row,f32:column,f32:column,1,0,serial,1,1,heuristic,invalid,invalid,false,false,1,tensorop,f32,256,128,32,1,1,1,0,0,0,2,4,2,1,16,8,8,75,1024,229376,8454144,36,0.0138035,15.476,612.463
2,CUTLASS,gemm,cutlass_tensorop_s1688gemm_f16_256x128_32x2_tn_align8,passed,success,universal,256,128,128,f16:row,f16:column,f32:column,f32:column,1,0,serial,1,1,heuristic,invalid,invalid,false,false,1,tensorop,f32,256,128,32,1,1,1,0,0,0,2,4,2,1,16,8,8,75,1024,229376,8454144,36,0.014032,15.224,602.49
2,CUTLASS,gemm,cutlass_tensorop_s1688gemm_f16_256x128_32x2_tt_align8,passed,success,universal,256,128,128,f16:row,f16:row,f32:column,f32:column,1,0,serial,1,1,heuristic,invalid,invalid,false,false,1,tensorop,f32,256,128,32,1,1,1,0,0,0,2,4,2,1,16,8,8,75,1024,229376,8454144,36,0.0137728,15.5105,613.829
2,CUTLASS,gemm,cutlass_tensorop_f16_s1688gemm_f16_256x128_32x2_nn_align8,passed,success,universal,256,128,128,f16:column,f16:column,f16:column,f16:column,1,0,serial,1,1,heuristic,invalid,invalid,false,false,1,tensorop,f32,256,128,32,1,1,1,0,0,0,2,4,2,1,16,8,8,75,1024,163840,8454144,51,0.0147587,10.3388,572.824
2,CUTLASS,gemm,cutlass_tensorop_f16_s1688gemm_f16_256x128_32x2_nt_align8,passed,success,universal,256,128,128,f16:column,f16:row,f16:column,f16:column,1,0,serial,1,1,heuristic,invalid,invalid,false,false,1,tensorop,f32,256,128,32,1,1,1,0,0,0,2,4,2,1,16,8,8,75,1024,163840,8454144,51,0.0147648,10.3346,572.588
2,CUTLASS,gemm,cutlass_tensorop_f16_s1688gemm_f16_256x128_32x2_tn_align8,passed,success,universal,256,128,128,f16:row,f16:column,f16:column,f16:column,1,0,serial,1,1,heuristic,invalid,invalid,false,false,1,tensorop,f32,256,128,32,1,1,1,0,0,0,2,4,2,1,16,8,8,75,1024,163840,8454144,51,0.0150438,10.1429,561.967
2,CUTLASS,gemm,cutlass_tensorop_f16_s1688gemm_f16_256x128_32x2_tt_align8,passed,success,universal,256,128,128,f16:row,f16:row,f16:column,f16:column,1,0,serial,1,1,heuristic,invalid,invalid,false,false,1,tensorop,f32,256,128,32,1,1,1,0,0,0,2,4,2,1,16,8,8,75,1024,163840,8454144,51,0.014729,10.3597,573.981
3,CUTLASS,gemm,cutlass_tensorop_s884gemm_f16_256x128_32x2_nn_align8,passed,success,universal,512,128,128,f16:column,f16:column,f32:column,f32:column,1,0,serial,1,1,heuristic,invalid,invalid,false,false,1,tensorop,f32,256,128,32,1,1,1,0,0,0,2,4,2,1,16,16,4,70,75,425984,16908288,39,0.023897,16.6016,707.55
3,CUTLASS,gemm,cutlass_tensorop_s884gemm_f16_256x128_32x2_nt_align8,passed,success,universal,512,128,128,f16:column,f16:row,f32:column,f32:column,1,0,serial,1,1,heuristic,invalid,invalid,false,false,1,tensorop,f32,256,128,32,1,1,1,0,0,0,2,4,2,1,16,16,4,70,75,425984,16908288,39,0.026257,15.1095,643.955
3,CUTLASS,gemm,cutlass_tensorop_s884gemm_f16_256x128_32x2_tn_align8,passed,success,universal,512,128,128,f16:row,f16:column,f32:column,f32:column,1,0,serial,1,1,heuristic,invalid,invalid,false,false,1,tensorop,f32,256,128,32,1,1,1,0,0,0,2,4,2,1,16,16,4,70,75,425984,16908288,39,0.0238819,16.6121,707.995
3,CUTLASS,gemm,cutlass_tensorop_s884gemm_f16_256x128_32x2_tt_align8,passed,success,universal,512,128,128,f16:row,f16:row,f32:column,f32:column,1,0,serial,1,1,heuristic,invalid,invalid,false,false,1,tensorop,f32,256,128,32,1,1,1,0,0,0,2,4,2,1,16,16,4,70,75,425984,16908288,39,0.0237933,16.674,710.633
3,CUTLASS,gemm,cutlass_tensorop_f16_s884gemm_f16_256x128_32x2_nn_align8,passed,success,universal,512,128,128,f16:column,f16:column,f16:column,f16:column,1,0,serial,1,1,heuristic,invalid,invalid,false,false,1,tensorop,f32,256,128,32,1,1,1,0,0,0,2,4,2,1,16,16,4,70,75,294912,16908288,57,0.0252224,10.8895,670.368
3,CUTLASS,gemm,cutlass_tensorop_f16_s884gemm_f16_256x128_32x2_nt_align8,passed,success,universal,512,128,128,f16:column,f16:row,f16:column,f16:column,1,0,serial,1,1,heuristic,invalid,invalid,false,false,1,tensorop,f32,256,128,32,1,1,1,0,0,0,2,4,2,1,16,16,4,70,75,294912,16908288,57,0.0275498,9.96953,613.736
3,CUTLASS,gemm,cutlass_tensorop_f16_s884gemm_f16_256x128_32x2_tn_align8,passed,success,universal,512,128,128,f16:row,f16:column,f16:column,f16:column,1,0,serial,1,1,heuristic,invalid,invalid,false,false,1,tensorop,f32,256,128,32,1,1,1,0,0,0,2,4,2,1,16,16,4,70,75,294912,16908288,57,0.0253082,10.8526,668.096
3,CUTLASS,gemm,cutlass_tensorop_f16_s884gemm_f16_256x128_32x2_tt_align8,passed,success,universal,512,128,128,f16:row,f16:row,f16:column,f16:column,1,0,serial,1,1,heuristic,invalid,invalid,false,false,1,tensorop,f32,256,128,32,1,1,1,0,0,0,2,4,2,1,16,16,4,70,75,294912,16908288,57,0.025112,10.9373,673.315
3,CUTLASS,gemm,cutlass_tensorop_s1688gemm_f16_256x128_32x2_nn_align8,passed,success,universal,512,128,128,f16:column,f16:column,f32:column,f32:column,1,0,serial,1,1,heuristic,invalid,invalid,false,false,1,tensorop,f32,256,128,32,1,1,1,0,0,0,2,4,2,1,16,8,8,75,1024,425984,16908288,39,0.0138925,28.5571,1217.08
3,CUTLASS,gemm,cutlass_tensorop_s1688gemm_f16_256x128_32x2_nt_align8,passed,success,universal,512,128,128,f16:column,f16:row,f32:column,f32:column,1,0,serial,1,1,heuristic,invalid,invalid,false,false,1,tensorop,f32,256,128,32,1,1,1,0,0,0,2,4,2,1,16,8,8,75,1024,425984,16908288,39,0.0137757,28.7992,1227.4
3,CUTLASS,gemm,cutlass_tensorop_s1688gemm_f16_256x128_32x2_tn_align8,passed,success,universal,512,128,128,f16:row,f16:column,f32:column,f32:column,1,0,serial,1,1,heuristic,invalid,invalid,false,false,1,tensorop,f32,256,128,32,1,1,1,0,0,0,2,4,2,1,16,8,8,75,1024,425984,16908288,39,0.0140896,28.1575,1200.05
3,CUTLASS,gemm,cutlass_tensorop_s1688gemm_f16_256x128_32x2_tt_align8,passed,success,universal,512,128,128,f16:row,f16:row,f32:column,f32:column,1,0,serial,1,1,heuristic,invalid,invalid,false,false,1,tensorop,f32,256,128,32,1,1,1,0,0,0,2,4,2,1,16,8,8,75,1024,425984,16908288,39,0.0139187,28.5032,1214.79
3,CUTLASS,gemm,cutlass_tensorop_f16_s1688gemm_f16_256x128_32x2_nn_align8,passed,success,universal,512,128,128,f16:column,f16:column,f16:column,f16:column,1,0,serial,1,1,heuristic,invalid,invalid,false,false,1,tensorop,f32,256,128,32,1,1,1,0,0,0,2,4,2,1,16,8,8,75,1024,294912,16908288,57,0.0147763,18.5877,1144.28
3,CUTLASS,gemm,cutlass_tensorop_f16_s1688gemm_f16_256x128_32x2_nt_align8,passed,success,universal,512,128,128,f16:column,f16:row,f16:column,f16:column,1,0,serial,1,1,heuristic,invalid,invalid,false,false,1,tensorop,f32,256,128,32,1,1,1,0,0,0,2,4,2,1,16,8,8,75,1024,294912,16908288,57,0.0148122,18.5428,1141.51
3,CUTLASS,gemm,cutlass_tensorop_f16_s1688gemm_f16_256x128_32x2_tn_align8,passed,success,universal,512,128,128,f16:row,f16:column,f16:column,f16:column,1,0,serial,1,1,heuristic,invalid,invalid,false,false,1,tensorop,f32,256,128,32,1,1,1,0,0,0,2,4,2,1,16,8,8,75,1024,294912,16908288,57,0.0148928,18.4423,1135.33
3,CUTLASS,gemm,cutlass_tensorop_f16_s1688gemm_f16_256x128_32x2_tt_align8,passed,success,universal,512,128,128,f16:row,f16:row,f16:column,f16:column,1,0,serial,1,1,heuristic,invalid,invalid,false,false,1,tensorop,f32,256,128,32,1,1,1,0,0,0,2,4,2,1,16,8,8,75,1024,294912,16908288,57,0.0149661,18.352,1129.77
4,CUTLASS,gemm,cutlass_tensorop_s884gemm_f16_256x128_32x2_nn_align8,passed,success,universal,1024,128,128,f16:column,f16:column,f32:column,f32:column,1,0,serial,1,1,heuristic,invalid,invalid,false,false,1,tensorop,f32,256,128,32,1,1,1,0,0,0,2,4,2,1,16,16,4,70,75,819200,33816576,41,0.0255306,29.8834,1324.55
4,CUTLASS,gemm,cutlass_tensorop_s884gemm_f16_256x128_32x2_nt_align8,passed,success,universal,1024,128,128,f16:column,f16:row,f32:column,f32:column,1,0,serial,1,1,heuristic,invalid,invalid,false,false,1,tensorop,f32,256,128,32,1,1,1,0,0,0,2,4,2,1,16,16,4,70,75,819200,33816576,41,0.0266314,28.6482,1269.8
4,CUTLASS,gemm,cutlass_tensorop_s884gemm_f16_256x128_32x2_tn_align8,passed,success,universal,1024,128,128,f16:row,f16:column,f32:column,f32:column,1,0,serial,1,1,heuristic,invalid,invalid,false,false,1,tensorop,f32,256,128,32,1,1,1,0,0,0,2,4,2,1,16,16,4,70,75,819200,33816576,41,0.0243459,31.3375,1389
4,CUTLASS,gemm,cutlass_tensorop_s884gemm_f16_256x128_32x2_tt_align8,passed,success,universal,1024,128,128,f16:row,f16:row,f32:column,f32:column,1,0,serial,1,1,heuristic,invalid,invalid,false,false,1,tensorop,f32,256,128,32,1,1,1,0,0,0,2,4,2,1,16,16,4,70,75,819200,33816576,41,0.0242557,31.4541,1394.17
4,CUTLASS,gemm,cutlass_tensorop_f16_s884gemm_f16_256x128_32x2_nn_align8,passed,success,universal,1024,128,128,f16:column,f16:column,f16:column,f16:column,1,0,serial,1,1,heuristic,invalid,invalid,false,false,1,tensorop,f32,256,128,32,1,1,1,0,0,0,2,4,2,1,16,16,4,70,75,557056,33816576,60,0.0256045,20.262,1320.73
4,CUTLASS,gemm,cutlass_tensorop_f16_s884gemm_f16_256x128_32x2_nt_align8,passed,success,universal,1024,128,128,f16:column,f16:row,f16:column,f16:column,1,0,serial,1,1,heuristic,invalid,invalid,false,false,1,tensorop,f32,256,128,32,1,1,1,0,0,0,2,4,2,1,16,16,4,70,75,557056,33816576,60,0.027905,18.5916,1211.85
4,CUTLASS,gemm,cutlass_tensorop_f16_s884gemm_f16_256x128_32x2_tn_align8,passed,success,universal,1024,128,128,f16:row,f16:column,f16:column,f16:column,1,0,serial,1,1,heuristic,invalid,invalid,false,false,1,tensorop,f32,256,128,32,1,1,1,0,0,0,2,4,2,1,16,16,4,70,75,557056,33816576,60,0.0257578,20.1415,1312.87
4,CUTLASS,gemm,cutlass_tensorop_f16_s884gemm_f16_256x128_32x2_tt_align8,passed,success,universal,1024,128,128,f16:row,f16:row,f16:column,f16:column,1,0,serial,1,1,heuristic,invalid,invalid,false,false,1,tensorop,f32,256,128,32,1,1,1,0,0,0,2,4,2,1,16,16,4,70,75,557056,33816576,60,0.0255277,20.323,1324.7
4,CUTLASS,gemm,cutlass_tensorop_s1688gemm_f16_256x128_32x2_nn_align8,passed,success,universal,1024,128,128,f16:column,f16:column,f32:column,f32:column,1,0,serial,1,1,heuristic,invalid,invalid,false,false,1,tensorop,f32,256,128,32,1,1,1,0,0,0,2,4,2,1,16,8,8,75,1024,819200,33816576,41,0.01396,54.6518,2422.39
4,CUTLASS,gemm,cutlass_tensorop_s1688gemm_f16_256x128_32x2_nt_align8,passed,success,universal,1024,128,128,f16:column,f16:row,f32:column,f32:column,1,0,serial,1,1,heuristic,invalid,invalid,false,false,1,tensorop,f32,256,128,32,1,1,1,0,0,0,2,4,2,1,16,8,8,75,1024,819200,33816576,41,0.0138496,55.0875,2441.7
4,CUTLASS,gemm,cutlass_tensorop_s1688gemm_f16_256x128_32x2_tn_align8,passed,success,universal,1024,128,128,f16:row,f16:column,f32:column,f32:column,1,0,serial,1,1,heuristic,invalid,invalid,false,false,1,tensorop,f32,256,128,32,1,1,1,0,0,0,2,4,2,1,16,8,8,75,1024,819200,33816576,41,0.014361,53.1259,2354.76
4,CUTLASS,gemm,cutlass_tensorop_s1688gemm_f16_256x128_32x2_tt_align8,passed,success,universal,1024,128,128,f16:row,f16:row,f32:column,f32:column,1,0,serial,1,1,heuristic,invalid,invalid,false,false,1,tensorop,f32,256,128,32,1,1,1,0,0,0,2,4,2,1,16,8,8,75,1024,819200,33816576,41,0.0139942,54.5181,2416.46
4,CUTLASS,gemm,cutlass_tensorop_f16_s1688gemm_f16_256x128_32x2_nn_align8,passed,success,universal,1024,128,128,f16:column,f16:column,f16:column,f16:column,1,0,serial,1,1,heuristic,invalid,invalid,false,false,1,tensorop,f32,256,128,32,1,1,1,0,0,0,2,4,2,1,16,8,8,75,1024,557056,33816576,60,0.0149606,34.6776,2260.37
4,CUTLASS,gemm,cutlass_tensorop_f16_s1688gemm_f16_256x128_32x2_nt_align8,passed,success,universal,1024,128,128,f16:column,f16:row,f16:column,f16:column,1,0,serial,1,1,heuristic,invalid,invalid,false,false,1,tensorop,f32,256,128,32,1,1,1,0,0,0,2,4,2,1,16,8,8,75,1024,557056,33816576,60,0.0149747,34.645,2258.24
4,CUTLASS,gemm,cutlass_tensorop_f16_s1688gemm_f16_256x128_32x2_tn_align8,passed,success,universal,1024,128,128,f16:row,f16:column,f16:column,f16:column,1,0,serial,1,1,heuristic,invalid,invalid,false,false,1,tensorop,f32,256,128,32,1,1,1,0,0,0,2,4,2,1,16,8,8,75,1024,557056,33816576,60,0.0152486,34.0226,2217.68
4,CUTLASS,gemm,cutlass_tensorop_f16_s1688gemm_f16_256x128_32x2_tt_align8,passed,success,universal,1024,128,128,f16:row,f16:row,f16:column,f16:column,1,0,serial,1,1,heuristic,invalid,invalid,false,false,1,tensorop,f32,256,128,32,1,1,1,0,0,0,2,4,2,1,16,8,8,75,1024,557056,33816576,60,0.0149546,34.6917,2261.29
5,CUTLASS,gemm,cutlass_tensorop_s884gemm_f16_256x128_32x2_nn_align8,passed,success,universal,2048,128,128,f16:column,f16:column,f32:column,f32:column,1,0,serial,1,1,heuristic,invalid,invalid,false,false,1,tensorop,f32,256,128,32,1,1,1,0,0,0,2,4,2,1,16,16,4,70,75,1605632,67633152,42,0.024415,61.2475,2770.14
5,CUTLASS,gemm,cutlass_tensorop_s884gemm_f16_256x128_32x2_nt_align8,passed,success,universal,2048,128,128,f16:column,f16:row,f32:column,f32:column,1,0,serial,1,1,heuristic,invalid,invalid,false,false,1,tensorop,f32,256,128,32,1,1,1,0,0,0,2,4,2,1,16,16,4,70,75,1605632,67633152,42,0.0267725,55.8544,2526.22
5,CUTLASS,gemm,cutlass_tensorop_s884gemm_f16_256x128_32x2_tn_align8,passed,success,universal,2048,128,128,f16:row,f16:column,f32:column,f32:column,1,0,serial,1,1,heuristic,invalid,invalid,false,false,1,tensorop,f32,256,128,32,1,1,1,0,0,0,2,4,2,1,16,16,4,70,75,1605632,67633152,42,0.0248179,60.2533,2725.17
5,CUTLASS,gemm,cutlass_tensorop_s884gemm_f16_256x128_32x2_tt_align8,passed,success,universal,2048,128,128,f16:row,f16:row,f32:column,f32:column,1,0,serial,1,1,heuristic,invalid,invalid,false,false,1,tensorop,f32,256,128,32,1,1,1,0,0,0,2,4,2,1,16,16,4,70,75,1605632,67633152,42,0.0246534,60.6553,2743.36
5,CUTLASS,gemm,cutlass_tensorop_f16_s884gemm_f16_256x128_32x2_nn_align8,passed,success,universal,2048,128,128,f16:column,f16:column,f16:column,f16:column,1,0,serial,1,1,heuristic,invalid,invalid,false,false,1,tensorop,f32,256,128,32,1,1,1,0,0,0,2,4,2,1,16,16,4,70,75,1081344,67633152,62,0.0256784,39.219,2633.85
5,CUTLASS,gemm,cutlass_tensorop_f16_s884gemm_f16_256x128_32x2_nt_align8,passed,success,universal,2048,128,128,f16:column,f16:row,f16:column,f16:column,1,0,serial,1,1,heuristic,invalid,invalid,false,false,1,tensorop,f32,256,128,32,1,1,1,0,0,0,2,4,2,1,16,16,4,70,75,1081344,67633152,62,0.0281046,35.8332,2406.48
5,CUTLASS,gemm,cutlass_tensorop_f16_s884gemm_f16_256x128_32x2_tn_align8,passed,success,universal,2048,128,128,f16:row,f16:column,f16:column,f16:column,1,0,serial,1,1,heuristic,invalid,invalid,false,false,1,tensorop,f32,256,128,32,1,1,1,0,0,0,2,4,2,1,16,16,4,70,75,1081344,67633152,62,0.0262058,38.4297,2580.85
5,CUTLASS,gemm,cutlass_tensorop_f16_s884gemm_f16_256x128_32x2_tt_align8,passed,success,universal,2048,128,128,f16:row,f16:row,f16:column,f16:column,1,0,serial,1,1,heuristic,invalid,invalid,false,false,1,tensorop,f32,256,128,32,1,1,1,0,0,0,2,4,2,1,16,16,4,70,75,1081344,67633152,62,0.0259846,38.7567,2602.81
5,CUTLASS,gemm,cutlass_tensorop_s1688gemm_f16_256x128_32x2_nn_align8,passed,success,universal,2048,128,128,f16:column,f16:column,f32:column,f32:column,1,0,serial,1,1,heuristic,invalid,invalid,false,false,1,tensorop,f32,256,128,32,1,1,1,0,0,0,2,4,2,1,16,8,8,75,1024,1605632,67633152,42,0.0142371,105.033,4750.48
5,CUTLASS,gemm,cutlass_tensorop_s1688gemm_f16_256x128_32x2_nt_align8,passed,success,universal,2048,128,128,f16:column,f16:row,f32:column,f32:column,1,0,serial,1,1,heuristic,invalid,invalid,false,false,1,tensorop,f32,256,128,32,1,1,1,0,0,0,2,4,2,1,16,8,8,75,1024,1605632,67633152,42,0.014065,106.318,4808.63
5,CUTLASS,gemm,cutlass_tensorop_s1688gemm_f16_256x128_32x2_tn_align8,passed,success,universal,2048,128,128,f16:row,f16:column,f32:column,f32:column,1,0,serial,1,1,heuristic,invalid,invalid,false,false,1,tensorop,f32,256,128,32,1,1,1,0,0,0,2,4,2,1,16,8,8,75,1024,1605632,67633152,42,0.015071,99.2208,4487.62
5,CUTLASS,gemm,cutlass_tensorop_s1688gemm_f16_256x128_32x2_tt_align8,passed,success,universal,2048,128,128,f16:row,f16:row,f32:column,f32:column,1,0,serial,1,1,heuristic,invalid,invalid,false,false,1,tensorop,f32,256,128,32,1,1,1,0,0,0,2,4,2,1,16,8,8,75,1024,1605632,67633152,42,0.0146243,102.252,4624.7
5,CUTLASS,gemm,cutlass_tensorop_f16_s1688gemm_f16_256x128_32x2_nn_align8,passed,success,universal,2048,128,128,f16:column,f16:column,f16:column,f16:column,1,0,serial,1,1,heuristic,invalid,invalid,false,false,1,tensorop,f32,256,128,32,1,1,1,0,0,0,2,4,2,1,16,8,8,75,1024,1081344,67633152,62,0.0152144,66.1926,4445.34
5,CUTLASS,gemm,cutlass_tensorop_f16_s1688gemm_f16_256x128_32x2_nt_align8,passed,success,universal,2048,128,128,f16:column,f16:row,f16:column,f16:column,1,0,serial,1,1,heuristic,invalid,invalid,false,false,1,tensorop,f32,256,128,32,1,1,1,0,0,0,2,4,2,1,16,8,8,75,1024,1081344,67633152,62,0.015121,66.6016,4472.81
5,CUTLASS,gemm,cutlass_tensorop_f16_s1688gemm_f16_256x128_32x2_tn_align8,passed,success,universal,2048,128,128,f16:row,f16:column,f16:column,f16:column,1,0,serial,1,1,heuristic,invalid,invalid,false,false,1,tensorop,f32,256,128,32,1,1,1,0,0,0,2,4,2,1,16,8,8,75,1024,1081344,67633152,62,0.0158598,63.4988,4264.43
5,CUTLASS,gemm,cutlass_tensorop_f16_s1688gemm_f16_256x128_32x2_tt_align8,passed,success,universal,2048,128,128,f16:row,f16:row,f16:column,f16:column,1,0,serial,1,1,heuristic,invalid,invalid,false,false,1,tensorop,f32,256,128,32,1,1,1,0,0,0,2,4,2,1,16,8,8,75,1024,1081344,67633152,62,0.0154675,65.1093,4372.59
6,CUTLASS,gemm,cutlass_tensorop_s884gemm_f16_256x128_32x2_nn_align8,passed,success,universal,4096,128,128,f16:column,f16:column,f32:column,f32:column,1,0,serial,1,1,heuristic,invalid,invalid,false,false,1,tensorop,f32,256,128,32,1,1,1,0,0,0,2,4,2,1,16,16,4,70,75,3178496,135266304,42,0.0247882,119.42,5456.89
6,CUTLASS,gemm,cutlass_tensorop_s884gemm_f16_256x128_32x2_nt_align8,passed,success,universal,4096,128,128,f16:column,f16:row,f32:column,f32:column,1,0,serial,1,1,heuristic,invalid,invalid,false,false,1,tensorop,f32,256,128,32,1,1,1,0,0,0,2,4,2,1,16,16,4,70,75,3178496,135266304,42,0.0270458,109.452,5001.39
6,CUTLASS,gemm,cutlass_tensorop_s884gemm_f16_256x128_32x2_tn_align8,passed,success,universal,4096,128,128,f16:row,f16:column,f32:column,f32:column,1,0,serial,1,1,heuristic,invalid,invalid,false,false,1,tensorop,f32,256,128,32,1,1,1,0,0,0,2,4,2,1,16,16,4,70,75,3178496,135266304,42,0.0256726,115.306,5268.89
6,CUTLASS,gemm,cutlass_tensorop_s884gemm_f16_256x128_32x2_tt_align8,passed,success,universal,4096,128,128,f16:row,f16:row,f32:column,f32:column,1,0,serial,1,1,heuristic,invalid,invalid,false,false,1,tensorop,f32,256,128,32,1,1,1,0,0,0,2,4,2,1,16,16,4,70,75,3178496,135266304,42,0.0255622,115.804,5291.64
6,CUTLASS,gemm,cutlass_tensorop_f16_s884gemm_f16_256x128_32x2_nn_align8,passed,success,universal,4096,128,128,f16:column,f16:column,f16:column,f16:column,1,0,serial,1,1,heuristic,invalid,invalid,false,false,1,tensorop,f32,256,128,32,1,1,1,0,0,0,2,4,2,1,16,16,4,70,75,2129920,135266304,63,0.0261702,75.7976,5168.71
6,CUTLASS,gemm,cutlass_tensorop_f16_s884gemm_f16_256x128_32x2_nt_align8,passed,success,universal,4096,128,128,f16:column,f16:row,f16:column,f16:column,1,0,serial,1,1,heuristic,invalid,invalid,false,false,1,tensorop,f32,256,128,32,1,1,1,0,0,0,2,4,2,1,16,16,4,70,75,2129920,135266304,63,0.0284214,69.7939,4759.31
6,CUTLASS,gemm,cutlass_tensorop_f16_s884gemm_f16_256x128_32x2_tn_align8,passed,success,universal,4096,128,128,f16:row,f16:column,f16:column,f16:column,1,0,serial,1,1,heuristic,invalid,invalid,false,false,1,tensorop,f32,256,128,32,1,1,1,0,0,0,2,4,2,1,16,16,4,70,75,2129920,135266304,63,0.0269818,73.5179,5013.25
6,CUTLASS,gemm,cutlass_tensorop_f16_s884gemm_f16_256x128_32x2_tt_align8,passed,success,universal,4096,128,128,f16:row,f16:row,f16:column,f16:column,1,0,serial,1,1,heuristic,invalid,invalid,false,false,1,tensorop,f32,256,128,32,1,1,1,0,0,0,2,4,2,1,16,16,4,70,75,2129920,135266304,63,0.0268701,73.8235,5034.09
6,CUTLASS,gemm,cutlass_tensorop_s1688gemm_f16_256x128_32x2_nn_align8,passed,success,universal,4096,128,128,f16:column,f16:column,f32:column,f32:column,1,0,serial,1,1,heuristic,invalid,invalid,false,false,1,tensorop,f32,256,128,32,1,1,1,0,0,0,2,4,2,1,16,8,8,75,1024,3178496,135266304,42,0.0145533,203.405,9294.56
6,CUTLASS,gemm,cutlass_tensorop_s1688gemm_f16_256x128_32x2_nt_align8,passed,success,universal,4096,128,128,f16:column,f16:row,f32:column,f32:column,1,0,serial,1,1,heuristic,invalid,invalid,false,false,1,tensorop,f32,256,128,32,1,1,1,0,0,0,2,4,2,1,16,8,8,75,1024,3178496,135266304,42,0.0143917,205.689,9398.92
6,CUTLASS,gemm,cutlass_tensorop_s1688gemm_f16_256x128_32x2_tn_align8,passed,success,universal,4096,128,128,f16:row,f16:column,f32:column,f32:column,1,0,serial,1,1,heuristic,invalid,invalid,false,false,1,tensorop,f32,256,128,32,1,1,1,0,0,0,2,4,2,1,16,8,8,75,1024,3178496,135266304,42,0.0158707,186.52,8523.01
6,CUTLASS,gemm,cutlass_tensorop_s1688gemm_f16_256x128_32x2_tt_align8,passed,success,universal,4096,128,128,f16:row,f16:row,f32:column,f32:column,1,0,serial,1,1,heuristic,invalid,invalid,false,false,1,tensorop,f32,256,128,32,1,1,1,0,0,0,2,4,2,1,16,8,8,75,1024,3178496,135266304,42,0.0154794,191.236,8738.49
6,CUTLASS,gemm,cutlass_tensorop_f16_s1688gemm_f16_256x128_32x2_nn_align8,passed,success,universal,4096,128,128,f16:column,f16:column,f16:column,f16:column,1,0,serial,1,1,heuristic,invalid,invalid,false,false,1,tensorop,f32,256,128,32,1,1,1,0,0,0,2,4,2,1,16,8,8,75,1024,2129920,135266304,63,0.0155571,127.507,8694.82
6,CUTLASS,gemm,cutlass_tensorop_f16_s1688gemm_f16_256x128_32x2_nt_align8,passed,success,universal,4096,128,128,f16:column,f16:row,f16:column,f16:column,1,0,serial,1,1,heuristic,invalid,invalid,false,false,1,tensorop,f32,256,128,32,1,1,1,0,0,0,2,4,2,1,16,8,8,75,1024,2129920,135266304,63,0.0155168,127.838,8717.41
6,CUTLASS,gemm,cutlass_tensorop_f16_s1688gemm_f16_256x128_32x2_tn_align8,passed,success,universal,4096,128,128,f16:row,f16:column,f16:column,f16:column,1,0,serial,1,1,heuristic,invalid,invalid,false,false,1,tensorop,f32,256,128,32,1,1,1,0,0,0,2,4,2,1,16,8,8,75,1024,2129920,135266304,63,0.0167235,118.614,8088.39
6,CUTLASS,gemm,cutlass_tensorop_f16_s1688gemm_f16_256x128_32x2_tt_align8,passed,success,universal,4096,128,128,f16:row,f16:row,f16:column,f16:column,1,0,serial,1,1,heuristic,invalid,invalid,false,false,1,tensorop,f32,256,128,32,1,1,1,0,0,0,2,4,2,1,16,8,8,75,1024,2129920,135266304,63,0.0162656,121.953,8316.1
7,CUTLASS,gemm,cutlass_tensorop_s884gemm_f16_256x128_32x2_nn_align8,passed,success,universal,8192,128,128,f16:column,f16:column,f32:column,f32:column,1,0,serial,1,1,heuristic,invalid,invalid,false,false,1,tensorop,f32,256,128,32,1,1,1,0,0,0,2,4,2,1,16,16,4,70,75,6324224,270532608,42,0.0320858,183.567,8431.55
7,CUTLASS,gemm,cutlass_tensorop_s884gemm_f16_256x128_32x2_nt_align8,passed,success,universal,8192,128,128,f16:column,f16:row,f32:column,f32:column,1,0,serial,1,1,heuristic,invalid,invalid,false,false,1,tensorop,f32,256,128,32,1,1,1,0,0,0,2,4,2,1,16,16,4,70,75,6324224,270532608,42,0.0344554,170.943,7851.68
7,CUTLASS,gemm,cutlass_tensorop_s884gemm_f16_256x128_32x2_tn_align8,passed,success,universal,8192,128,128,f16:row,f16:column,f32:column,f32:column,1,0,serial,1,1,heuristic,invalid,invalid,false,false,1,tensorop,f32,256,128,32,1,1,1,0,0,0,2,4,2,1,16,16,4,70,75,6324224,270532608,42,0.0337469,174.531,8016.52
7,CUTLASS,gemm,cutlass_tensorop_s884gemm_f16_256x128_32x2_tt_align8,passed,success,universal,8192,128,128,f16:row,f16:row,f32:column,f32:column,1,0,serial,1,1,heuristic,invalid,invalid,false,false,1,tensorop,f32,256,128,32,1,1,1,0,0,0,2,4,2,1,16,16,4,70,75,6324224,270532608,42,0.0332605,177.084,8133.76
7,CUTLASS,gemm,cutlass_tensorop_f16_s884gemm_f16_256x128_32x2_nn_align8,passed,success,universal,8192,128,128,f16:column,f16:column,f16:column,f16:column,1,0,serial,1,1,heuristic,invalid,invalid,false,false,1,tensorop,f32,256,128,32,1,1,1,0,0,0,2,4,2,1,16,16,4,70,75,4227072,270532608,64,0.0337594,116.613,8013.56
7,CUTLASS,gemm,cutlass_tensorop_f16_s884gemm_f16_256x128_32x2_nt_align8,passed,success,universal,8192,128,128,f16:column,f16:row,f16:column,f16:column,1,0,serial,1,1,heuristic,invalid,invalid,false,false,1,tensorop,f32,256,128,32,1,1,1,0,0,0,2,4,2,1,16,16,4,70,75,4227072,270532608,64,0.036209,108.724,7471.43
7,CUTLASS,gemm,cutlass_tensorop_f16_s884gemm_f16_256x128_32x2_tn_align8,passed,success,universal,8192,128,128,f16:row,f16:column,f16:column,f16:column,1,0,serial,1,1,heuristic,invalid,invalid,false,false,1,tensorop,f32,256,128,32,1,1,1,0,0,0,2,4,2,1,16,16,4,70,75,4227072,270532608,64,0.0359347,109.553,7528.45
7,CUTLASS,gemm,cutlass_tensorop_f16_s884gemm_f16_256x128_32x2_tt_align8,passed,success,universal,8192,128,128,f16:row,f16:row,f16:column,f16:column,1,0,serial,1,1,heuristic,invalid,invalid,false,false,1,tensorop,f32,256,128,32,1,1,1,0,0,0,2,4,2,1,16,16,4,70,75,4227072,270532608,64,0.0353235,111.449,7658.71
7,CUTLASS,gemm,cutlass_tensorop_s1688gemm_f16_256x128_32x2_nn_align8,passed,success,universal,8192,128,128,f16:column,f16:column,f32:column,f32:column,1,0,serial,1,1,heuristic,invalid,invalid,false,false,1,tensorop,f32,256,128,32,1,1,1,0,0,0,2,4,2,1,16,8,8,75,1024,6324224,270532608,42,0.0197142,298.763,13722.7
7,CUTLASS,gemm,cutlass_tensorop_s1688gemm_f16_256x128_32x2_nt_align8,passed,success,universal,8192,128,128,f16:column,f16:row,f32:column,f32:column,1,0,serial,1,1,heuristic,invalid,invalid,false,false,1,tensorop,f32,256,128,32,1,1,1,0,0,0,2,4,2,1,16,8,8,75,1024,6324224,270532608,42,0.0196557,299.653,13763.6
7,CUTLASS,gemm,cutlass_tensorop_s1688gemm_f16_256x128_32x2_tn_align8,passed,success,universal,8192,128,128,f16:row,f16:column,f32:column,f32:column,1,0,serial,1,1,heuristic,invalid,invalid,false,false,1,tensorop,f32,256,128,32,1,1,1,0,0,0,2,4,2,1,16,8,8,75,1024,6324224,270532608,42,0.0219901,267.843,12302.5
7,CUTLASS,gemm,cutlass_tensorop_s1688gemm_f16_256x128_32x2_tt_align8,passed,success,universal,8192,128,128,f16:row,f16:row,f32:column,f32:column,1,0,serial,1,1,heuristic,invalid,invalid,false,false,1,tensorop,f32,256,128,32,1,1,1,0,0,0,2,4,2,1,16,8,8,75,1024,6324224,270532608,42,0.0214874,274.11,12590.3
7,CUTLASS,gemm,cutlass_tensorop_f16_s1688gemm_f16_256x128_32x2_nn_align8,passed,success,universal,8192,128,128,f16:column,f16:column,f16:column,f16:column,1,0,serial,1,1,heuristic,invalid,invalid,false,false,1,tensorop,f32,256,128,32,1,1,1,0,0,0,2,4,2,1,16,8,8,75,1024,4227072,270532608,64,0.0179469,219.357,15074.1
7,CUTLASS,gemm,cutlass_tensorop_f16_s1688gemm_f16_256x128_32x2_nt_align8,passed,success,universal,8192,128,128,f16:column,f16:row,f16:column,f16:column,1,0,serial,1,1,heuristic,invalid,invalid,false,false,1,tensorop,f32,256,128,32,1,1,1,0,0,0,2,4,2,1,16,8,8,75,1024,4227072,270532608,64,0.0174234,225.948,15527
7,CUTLASS,gemm,cutlass_tensorop_f16_s1688gemm_f16_256x128_32x2_tn_align8,passed,success,universal,8192,128,128,f16:row,f16:column,f16:column,f16:column,1,0,serial,1,1,heuristic,invalid,invalid,false,false,1,tensorop,f32,256,128,32,1,1,1,0,0,0,2,4,2,1,16,8,8,75,1024,4227072,270532608,64,0.0200544,196.304,13489.9
7,CUTLASS,gemm,cutlass_tensorop_f16_s1688gemm_f16_256x128_32x2_tt_align8,passed,success,universal,8192,128,128,f16:row,f16:row,f16:column,f16:column,1,0,serial,1,1,heuristic,invalid,invalid,false,false,1,tensorop,f32,256,128,32,1,1,1,0,0,0,2,4,2,1,16,8,8,75,1024,4227072,270532608,64,0.0197034,199.802,13730.3
8,CUTLASS,gemm,cutlass_tensorop_s884gemm_f16_256x128_32x2_nn_align8,passed,success,universal,128,256,128,f16:column,f16:column,f32:column,f32:column,1,0,serial,1,1,heuristic,invalid,invalid,false,false,1,tensorop,f32,256,128,32,1,1,1,0,0,0,2,4,2,1,16,16,4,70,75,229376,8454144,36,0.025672,8.32125,329.314
8,CUTLASS,gemm,cutlass_tensorop_s884gemm_f16_256x128_32x2_nt_align8,passed,success,universal,128,256,128,f16:column,f16:row,f32:column,f32:column,1,0,serial,1,1,heuristic,invalid,invalid,false,false,1,tensorop,f32,256,128,32,1,1,1,0,0,0,2,4,2,1,16,16,4,70,75,229376,8454144,36,0.0283424,7.53723,298.286
8,CUTLASS,gemm,cutlass_tensorop_s884gemm_f16_256x128_32x2_tn_align8,passed,success,universal,128,256,128,f16:row,f16:column,f32:column,f32:column,1,0,serial,1,1,heuristic,invalid,invalid,false,false,1,tensorop,f32,256,128,32,1,1,1,0,0,0,2,4,2,1,16,16,4,70,75,229376,8454144,36,0.0258208,8.27329,327.416
8,CUTLASS,gemm,cutlass_tensorop_s884gemm_f16_256x128_32x2_tt_align8,passed,success,universal,128,256,128,f16:row,f16:row,f32:column,f32:column,1,0,serial,1,1,heuristic,invalid,invalid,false,false,1,tensorop,f32,256,128,32,1,1,1,0,0,0,2,4,2,1,16,16,4,70,75,229376,8454144,36,0.0255645,8.35624,330.699
8,CUTLASS,gemm,cutlass_tensorop_f16_s884gemm_f16_256x128_32x2_nn_align8,passed,success,universal,128,256,128,f16:column,f16:column,f16:column,f16:column,1,0,serial,1,1,heuristic,invalid,invalid,false,false,1,tensorop,f32,256,128,32,1,1,1,0,0,0,2,4,2,1,16,16,4,70,75,163840,8454144,51,0.0257245,5.93162,328.642
8,CUTLASS,gemm,cutlass_tensorop_f16_s884gemm_f16_256x128_32x2_nt_align8,passed,success,universal,128,256,128,f16:column,f16:row,f16:column,f16:column,1,0,serial,1,1,heuristic,invalid,invalid,false,false,1,tensorop,f32,256,128,32,1,1,1,0,0,0,2,4,2,1,16,16,4,70,75,163840,8454144,51,0.0283866,5.37536,297.822
8,CUTLASS,gemm,cutlass_tensorop_f16_s884gemm_f16_256x128_32x2_tn_align8,passed,success,universal,128,256,128,f16:row,f16:column,f16:column,f16:column,1,0,serial,1,1,heuristic,invalid,invalid,false,false,1,tensorop,f32,256,128,32,1,1,1,0,0,0,2,4,2,1,16,16,4,70,75,163840,8454144,51,0.0259827,5.87267,325.376
8,CUTLASS,gemm,cutlass_tensorop_f16_s884gemm_f16_256x128_32x2_tt_align8,passed,success,universal,128,256,128,f16:row,f16:row,f16:column,f16:column,1,0,serial,1,1,heuristic,invalid,invalid,false,false,1,tensorop,f32,256,128,32,1,1,1,0,0,0,2,4,2,1,16,16,4,70,75,163840,8454144,51,0.0256262,5.95436,329.902
8,CUTLASS,gemm,cutlass_tensorop_s1688gemm_f16_256x128_32x2_nn_align8,passed,success,universal,128,256,128,f16:column,f16:column,f32:column,f32:column,1,0,serial,1,1,heuristic,invalid,invalid,false,false,1,tensorop,f32,256,128,32,1,1,1,0,0,0,2,4,2,1,16,8,8,75,1024,229376,8454144,36,0.015993,13.3573,528.617
8,CUTLASS,gemm,cutlass_tensorop_s1688gemm_f16_256x128_32x2_nt_align8,passed,success,universal,128,256,128,f16:column,f16:row,f32:column,f32:column,1,0,serial,1,1,heuristic,invalid,invalid,false,false,1,tensorop,f32,256,128,32,1,1,1,0,0,0,2,4,2,1,16,8,8,75,1024,229376,8454144,36,0.0156086,13.6862,541.632
8,CUTLASS,gemm,cutlass_tensorop_s1688gemm_f16_256x128_32x2_tn_align8,passed,success,universal,128,256,128,f16:row,f16:column,f32:column,f32:column,1,0,serial,1,1,heuristic,invalid,invalid,false,false,1,tensorop,f32,256,128,32,1,1,1,0,0,0,2,4,2,1,16,8,8,75,1024,229376,8454144,36,0.0161997,13.1869,521.871
8,CUTLASS,gemm,cutlass_tensorop_s1688gemm_f16_256x128_32x2_tt_align8,passed,success,universal,128,256,128,f16:row,f16:row,f32:column,f32:column,1,0,serial,1,1,heuristic,invalid,invalid,false,false,1,tensorop,f32,256,128,32,1,1,1,0,0,0,2,4,2,1,16,8,8,75,1024,229376,8454144,36,0.0156896,13.6156,538.837
8,CUTLASS,gemm,cutlass_tensorop_f16_s1688gemm_f16_256x128_32x2_nn_align8,passed,success,universal,128,256,128,f16:column,f16:column,f16:column,f16:column,1,0,serial,1,1,heuristic,invalid,invalid,false,false,1,tensorop,f32,256,128,32,1,1,1,0,0,0,2,4,2,1,16,8,8,75,1024,163840,8454144,51,0.0153901,9.91469,549.324
8,CUTLASS,gemm,cutlass_tensorop_f16_s1688gemm_f16_256x128_32x2_nt_align8,passed,success,universal,128,256,128,f16:column,f16:row,f16:column,f16:column,1,0,serial,1,1,heuristic,invalid,invalid,false,false,1,tensorop,f32,256,128,32,1,1,1,0,0,0,2,4,2,1,16,8,8,75,1024,163840,8454144,51,0.0150163,10.1615,562.997
8,CUTLASS,gemm,cutlass_tensorop_f16_s1688gemm_f16_256x128_32x2_tn_align8,passed,success,universal,128,256,128,f16:row,f16:column,f16:column,f16:column,1,0,serial,1,1,heuristic,invalid,invalid,false,false,1,tensorop,f32,256,128,32,1,1,1,0,0,0,2,4,2,1,16,8,8,75,1024,163840,8454144,51,0.0155245,9.82886,544.569
8,CUTLASS,gemm,cutlass_tensorop_f16_s1688gemm_f16_256x128_32x2_tt_align8,passed,success,universal,128,256,128,f16:row,f16:row,f16:column,f16:column,1,0,serial,1,1,heuristic,invalid,invalid,false,false,1,tensorop,f32,256,128,32,1,1,1,0,0,0,2,4,2,1,16,8,8,75,1024,163840,8454144,51,0.0150602,10.1319,561.358
9,CUTLASS,gemm,cutlass_tensorop_s884gemm_f16_256x128_32x2_nn_align8,passed,success,universal,256,256,128,f16:column,f16:column,f32:column,f32:column,1,0,serial,1,1,heuristic,invalid,invalid,false,false,1,tensorop,f32,256,128,32,1,1,1,0,0,0,2,4,2,1,16,16,4,70,75,393216,16908288,43,0.0256653,14.2687,658.8
9,CUTLASS,gemm,cutlass_tensorop_s884gemm_f16_256x128_32x2_nt_align8,passed,success,universal,256,256,128,f16:column,f16:row,f32:column,f32:column,1,0,serial,1,1,heuristic,invalid,invalid,false,false,1,tensorop,f32,256,128,32,1,1,1,0,0,0,2,4,2,1,16,16,4,70,75,393216,16908288,43,0.0282918,12.944,597.638
9,CUTLASS,gemm,cutlass_tensorop_s884gemm_f16_256x128_32x2_tn_align8,passed,success,universal,256,256,128,f16:row,f16:column,f32:column,f32:column,1,0,serial,1,1,heuristic,invalid,invalid,false,false,1,tensorop,f32,256,128,32,1,1,1,0,0,0,2,4,2,1,16,16,4,70,75,393216,16908288,43,0.0258406,14.1719,654.329
9,CUTLASS,gemm,cutlass_tensorop_s884gemm_f16_256x128_32x2_tt_align8,passed,success,universal,256,256,128,f16:row,f16:row,f32:column,f32:column,1,0,serial,1,1,heuristic,invalid,invalid,false,false,1,tensorop,f32,256,128,32,1,1,1,0,0,0,2,4,2,1,16,16,4,70,75,393216,16908288,43,0.0255181,14.351,662.6
9,CUTLASS,gemm,cutlass_tensorop_f16_s884gemm_f16_256x128_32x2_nn_align8,passed,success,universal,256,256,128,f16:column,f16:column,f16:column,f16:column,1,0,serial,1,1,heuristic,invalid,invalid,false,false,1,tensorop,f32,256,128,32,1,1,1,0,0,0,2,4,2,1,16,16,4,70,75,262144,16908288,64,0.0257587,9.47798,656.41
9,CUTLASS,gemm,cutlass_tensorop_f16_s884gemm_f16_256x128_32x2_nt_align8,passed,success,universal,256,256,128,f16:column,f16:row,f16:column,f16:column,1,0,serial,1,1,heuristic,invalid,invalid,false,false,1,tensorop,f32,256,128,32,1,1,1,0,0,0,2,4,2,1,16,16,4,70,75,262144,16908288,64,0.0284058,8.59476,595.242
9,CUTLASS,gemm,cutlass_tensorop_f16_s884gemm_f16_256x128_32x2_tn_align8,passed,success,universal,256,256,128,f16:row,f16:column,f16:column,f16:column,1,0,serial,1,1,heuristic,invalid,invalid,false,false,1,tensorop,f32,256,128,32,1,1,1,0,0,0,2,4,2,1,16,16,4,70,75,262144,16908288,64,0.0260221,9.38206,649.767
9,CUTLASS,gemm,cutlass_tensorop_f16_s884gemm_f16_256x128_32x2_tt_align8,passed,success,universal,256,256,128,f16:row,f16:row,f16:column,f16:column,1,0,serial,1,1,heuristic,invalid,invalid,false,false,1,tensorop,f32,256,128,32,1,1,1,0,0,0,2,4,2,1,16,16,4,70,75,262144,16908288,64,0.0256675,9.51166,658.743
9,CUTLASS,gemm,cutlass_tensorop_s1688gemm_f16_256x128_32x2_nn_align8,passed,success,universal,256,256,128,f16:column,f16:column,f32:column,f32:column,1,0,serial,1,1,heuristic,invalid,invalid,false,false,1,tensorop,f32,256,128,32,1,1,1,0,0,0,2,4,2,1,16,8,8,75,1024,393216,16908288,43,0.0159434,22.9695,1060.52
9,CUTLASS,gemm,cutlass_tensorop_s1688gemm_f16_256x128_32x2_nt_align8,passed,success,universal,256,256,128,f16:column,f16:row,f32:column,f32:column,1,0,serial,1,1,heuristic,invalid,invalid,false,false,1,tensorop,f32,256,128,32,1,1,1,0,0,0,2,4,2,1,16,8,8,75,1024,393216,16908288,43,0.0153933,23.7903,1098.42
9,CUTLASS,gemm,cutlass_tensorop_s1688gemm_f16_256x128_32x2_tn_align8,passed,success,universal,256,256,128,f16:row,f16:column,f32:column,f32:column,1,0,serial,1,1,heuristic,invalid,invalid,false,false,1,tensorop,f32,256,128,32,1,1,1,0,0,0,2,4,2,1,16,8,8,75,1024,393216,16908288,43,0.0161542,22.6696,1046.68
9,CUTLASS,gemm,cutlass_tensorop_s1688gemm_f16_256x128_32x2_tt_align8,passed,success,universal,256,256,128,f16:row,f16:row,f32:column,f32:column,1,0,serial,1,1,heuristic,invalid,invalid,false,false,1,tensorop,f32,256,128,32,1,1,1,0,0,0,2,4,2,1,16,8,8,75,1024,393216,16908288,43,0.0155155,23.6029,1089.77
9,CUTLASS,gemm,cutlass_tensorop_f16_s1688gemm_f16_256x128_32x2_nn_align8,passed,success,universal,256,256,128,f16:column,f16:column,f16:column,f16:column,1,0,serial,1,1,heuristic,invalid,invalid,false,false,1,tensorop,f32,256,128,32,1,1,1,0,0,0,2,4,2,1,16,8,8,75,1024,262144,16908288,64,0.0156461,15.6039,1080.67
9,CUTLASS,gemm,cutlass_tensorop_f16_s1688gemm_f16_256x128_32x2_nt_align8,passed,success,universal,256,256,128,f16:column,f16:row,f16:column,f16:column,1,0,serial,1,1,heuristic,invalid,invalid,false,false,1,tensorop,f32,256,128,32,1,1,1,0,0,0,2,4,2,1,16,8,8,75,1024,262144,16908288,64,0.0151312,16.1349,1117.45
9,CUTLASS,gemm,cutlass_tensorop_f16_s1688gemm_f16_256x128_32x2_tn_align8,passed,success,universal,256,256,128,f16:row,f16:column,f16:column,f16:column,1,0,serial,1,1,heuristic,invalid,invalid,false,false,1,tensorop,f32,256,128,32,1,1,1,0,0,0,2,4,2,1,16,8,8,75,1024,262144,16908288,64,0.0157568,15.4943,1073.08
9,CUTLASS,gemm,cutlass_tensorop_f16_s1688gemm_f16_256x128_32x2_tt_align8,passed,success,universal,256,256,128,f16:row,f16:row,f16:column,f16:column,1,0,serial,1,1,heuristic,invalid,invalid,false,false,1,tensorop,f32,256,128,32,1,1,1,0,0,0,2,4,2,1,16,8,8,75,1024,262144,16908288,64,0.0151824,16.0805,1113.68
10,CUTLASS,gemm,cutlass_tensorop_s884gemm_f16_256x128_32x2_nn_align8,passed,success,universal,512,256,128,f16:column,f16:column,f32:column,f32:column,1,0,serial,1,1,heuristic,invalid,invalid,false,false,1,tensorop,f32,256,128,32,1,1,1,0,0,0,2,4,2,1,16,16,4,70,75,720896,33816576,46,0.0257184,26.1053,1314.88
10,CUTLASS,gemm,cutlass_tensorop_s884gemm_f16_256x128_32x2_nt_align8,passed,success,universal,512,256,128,f16:column,f16:row,f32:column,f32:column,1,0,serial,1,1,heuristic,invalid,invalid,false,false,1,tensorop,f32,256,128,32,1,1,1,0,0,0,2,4,2,1,16,16,4,70,75,720896,33816576,46,0.0283392,23.6911,1193.28
10,CUTLASS,gemm,cutlass_tensorop_s884gemm_f16_256x128_32x2_tn_align8,passed,success,universal,512,256,128,f16:row,f16:column,f32:column,f32:column,1,0,serial,1,1,heuristic,invalid,invalid,false,false,1,tensorop,f32,256,128,32,1,1,1,0,0,0,2,4,2,1,16,16,4,70,75,720896,33816576,46,0.025905,25.9173,1305.41
10,CUTLASS,gemm,cutlass_tensorop_s884gemm_f16_256x128_32x2_tt_align8,passed,success,universal,512,256,128,f16:row,f16:row,f32:column,f32:column,1,0,serial,1,1,heuristic,invalid,invalid,false,false,1,tensorop,f32,256,128,32,1,1,1,0,0,0,2,4,2,1,16,16,4,70,75,720896,33816576,46,0.025584,26.2424,1321.79
10,CUTLASS,gemm,cutlass_tensorop_f16_s884gemm_f16_256x128_32x2_nn_align8,passed,success,universal,512,256,128,f16:column,f16:column,f16:column,f16:column,1,0,serial,1,1,heuristic,invalid,invalid,false,false,1,tensorop,f32,256,128,32,1,1,1,0,0,0,2,4,2,1,16,16,4,70,75,458752,33816576,73,0.0257923,16.5649,1311.11
10,CUTLASS,gemm,cutlass_tensorop_f16_s884gemm_f16_256x128_32x2_nt_align8,passed,success,universal,512,256,128,f16:column,f16:row,f16:column,f16:column,1,0,serial,1,1,heuristic,invalid,invalid,false,false,1,tensorop,f32,256,128,32,1,1,1,0,0,0,2,4,2,1,16,16,4,70,75,458752,33816576,73,0.028407,15.0401,1190.43
10,CUTLASS,gemm,cutlass_tensorop_f16_s884gemm_f16_256x128_32x2_tn_align8,passed,success,universal,512,256,128,f16:row,f16:column,f16:column,f16:column,1,0,serial,1,1,heuristic,invalid,invalid,false,false,1,tensorop,f32,256,128,32,1,1,1,0,0,0,2,4,2,1,16,16,4,70,75,458752,33816576,73,0.026064,16.3922,1297.44
10,CUTLASS,gemm,cutlass_tensorop_f16_s884gemm_f16_256x128_32x2_tt_align8,passed,success,universal,512,256,128,f16:row,f16:row,f16:column,f16:column,1,0,serial,1,1,heuristic,invalid,invalid,false,false,1,tensorop,f32,256,128,32,1,1,1,0,0,0,2,4,2,1,16,16,4,70,75,458752,33816576,73,0.0256397,16.6635,1318.92
10,CUTLASS,gemm,cutlass_tensorop_s1688gemm_f16_256x128_32x2_nn_align8,passed,success,universal,512,256,128,f16:column,f16:column,f32:column,f32:column,1,0,serial,1,1,heuristic,invalid,invalid,false,false,1,tensorop,f32,256,128,32,1,1,1,0,0,0,2,4,2,1,16,8,8,75,1024,720896,33816576,46,0.0163376,41.0946,2069.86
10,CUTLASS,gemm,cutlass_tensorop_s1688gemm_f16_256x128_32x2_nt_align8,passed,success,universal,512,256,128,f16:column,f16:row,f32:column,f32:column,1,0,serial,1,1,heuristic,invalid,invalid,false,false,1,tensorop,f32,256,128,32,1,1,1,0,0,0,2,4,2,1,16,8,8,75,1024,720896,33816576,46,0.0156291,42.9574,2163.69
10,CUTLASS,gemm,cutlass_tensorop_s1688gemm_f16_256x128_32x2_tn_align8,passed,success,universal,512,256,128,f16:row,f16:column,f32:column,f32:column,1,0,serial,1,1,heuristic,invalid,invalid,false,false,1,tensorop,f32,256,128,32,1,1,1,0,0,0,2,4,2,1,16,8,8,75,1024,720896,33816576,46,0.0164538,40.8045,2055.25
10,CUTLASS,gemm,cutlass_tensorop_s1688gemm_f16_256x128_32x2_tt_align8,passed,success,universal,512,256,128,f16:row,f16:row,f32:column,f32:column,1,0,serial,1,1,heuristic,invalid,invalid,false,false,1,tensorop,f32,256,128,32,1,1,1,0,0,0,2,4,2,1,16,8,8,75,1024,720896,33816576,46,0.0158784,42.283,2129.72
10,CUTLASS,gemm,cutlass_tensorop_f16_s1688gemm_f16_256x128_32x2_nn_align8,passed,success,universal,512,256,128,f16:column,f16:column,f16:column,f16:column,1,0,serial,1,1,heuristic,invalid,invalid,false,false,1,tensorop,f32,256,128,32,1,1,1,0,0,0,2,4,2,1,16,8,8,75,1024,458752,33816576,73,0.0156723,27.2612,2157.73
10,CUTLASS,gemm,cutlass_tensorop_f16_s1688gemm_f16_256x128_32x2_nt_align8,passed,success,universal,512,256,128,f16:column,f16:row,f16:column,f16:column,1,0,serial,1,1,heuristic,invalid,invalid,false,false,1,tensorop,f32,256,128,32,1,1,1,0,0,0,2,4,2,1,16,8,8,75,1024,458752,33816576,73,0.0150698,28.3512,2244
10,CUTLASS,gemm,cutlass_tensorop_f16_s1688gemm_f16_256x128_32x2_tn_align8,passed,success,universal,512,256,128,f16:row,f16:column,f16:column,f16:column,1,0,serial,1,1,heuristic,invalid,invalid,false,false,1,tensorop,f32,256,128,32,1,1,1,0,0,0,2,4,2,1,16,8,8,75,1024,458752,33816576,73,0.0158288,26.9917,2136.4
10,CUTLASS,gemm,cutlass_tensorop_f16_s1688gemm_f16_256x128_32x2_tt_align8,passed,success,universal,512,256,128,f16:row,f16:row,f16:column,f16:column,1,0,serial,1,1,heuristic,invalid,invalid,false,false,1,tensorop,f32,256,128,32,1,1,1,0,0,0,2,4,2,1,16,8,8,75,1024,458752,33816576,73,0.0151574,28.1872,2231.02
11,CUTLASS,gemm,cutlass_tensorop_s884gemm_f16_256x128_32x2_nn_align8,passed,success,universal,1024,256,128,f16:column,f16:column,f32:column,f32:column,1,0,serial,1,1,heuristic,invalid,invalid,false,false,1,tensorop,f32,256,128,32,1,1,1,0,0,0,2,4,2,1,16,16,4,70,75,1376256,67633152,49,0.0260704,49.1645,2594.25
11,CUTLASS,gemm,cutlass_tensorop_s884gemm_f16_256x128_32x2_nt_align8,passed,success,universal,1024,256,128,f16:column,f16:row,f32:column,f32:column,1,0,serial,1,1,heuristic,invalid,invalid,false,false,1,tensorop,f32,256,128,32,1,1,1,0,0,0,2,4,2,1,16,16,4,70,75,1376256,67633152,49,0.0283718,45.1764,2383.81
11,CUTLASS,gemm,cutlass_tensorop_s884gemm_f16_256x128_32x2_tn_align8,passed,success,universal,1024,256,128,f16:row,f16:column,f32:column,f32:column,1,0,serial,1,1,heuristic,invalid,invalid,false,false,1,tensorop,f32,256,128,32,1,1,1,0,0,0,2,4,2,1,16,16,4,70,75,1376256,67633152,49,0.0263146,48.7083,2570.18
11,CUTLASS,gemm,cutlass_tensorop_s884gemm_f16_256x128_32x2_tt_align8,passed,success,universal,1024,256,128,f16:row,f16:row,f32:column,f32:column,1,0,serial,1,1,heuristic,invalid,invalid,false,false,1,tensorop,f32,256,128,32,1,1,1,0,0,0,2,4,2,1,16,16,4,70,75,1376256,67633152,49,0.0258538,49.5765,2615.99
11,CUTLASS,gemm,cutlass_tensorop_f16_s884gemm_f16_256x128_32x2_nn_align8,passed,success,universal,1024,256,128,f16:column,f16:column,f16:column,f16:column,1,0,serial,1,1,heuristic,invalid,invalid,false,false,1,tensorop,f32,256,128,32,1,1,1,0,0,0,2,4,2,1,16,16,4,70,75,851968,67633152,79,0.0261859,30.3009,2582.81
11,CUTLASS,gemm,cutlass_tensorop_f16_s884gemm_f16_256x128_32x2_nt_align8,passed,success,universal,1024,256,128,f16:column,f16:row,f16:column,f16:column,1,0,serial,1,1,heuristic,invalid,invalid,false,false,1,tensorop,f32,256,128,32,1,1,1,0,0,0,2,4,2,1,16,16,4,70,75,851968,67633152,79,0.0285338,27.8077,2370.29
11,CUTLASS,gemm,cutlass_tensorop_f16_s884gemm_f16_256x128_32x2_tn_align8,passed,success,universal,1024,256,128,f16:row,f16:column,f16:column,f16:column,1,0,serial,1,1,heuristic,invalid,invalid,false,false,1,tensorop,f32,256,128,32,1,1,1,0,0,0,2,4,2,1,16,16,4,70,75,851968,67633152,79,0.0265376,29.8994,2548.58
11,CUTLASS,gemm,cutlass_tensorop_f16_s884gemm_f16_256x128_32x2_tt_align8,passed,success,universal,1024,256,128,f16:row,f16:row,f16:column,f16:column,1,0,serial,1,1,heuristic,invalid,invalid,false,false,1,tensorop,f32,256,128,32,1,1,1,0,0,0,2,4,2,1,16,16,4,70,75,851968,67633152,79,0.0259891,30.5304,2602.36
11,CUTLASS,gemm,cutlass_tensorop_s1688gemm_f16_256x128_32x2_nn_align8,passed,success,universal,1024,256,128,f16:column,f16:column,f32:column,f32:column,1,0,serial,1,1,heuristic,invalid,invalid,false,false,1,tensorop,f32,256,128,32,1,1,1,0,0,0,2,4,2,1,16,8,8,75,1024,1376256,67633152,49,0.0162934,78.6659,4150.94
11,CUTLASS,gemm,cutlass_tensorop_s1688gemm_f16_256x128_32x2_nt_align8,passed,success,universal,1024,256,128,f16:column,f16:row,f32:column,f32:column,1,0,serial,1,1,heuristic,invalid,invalid,false,false,1,tensorop,f32,256,128,32,1,1,1,0,0,0,2,4,2,1,16,8,8,75,1024,1376256,67633152,49,0.0155411,82.474,4351.88
11,CUTLASS,gemm,cutlass_tensorop_s1688gemm_f16_256x128_32x2_tn_align8,passed,success,universal,1024,256,128,f16:row,f16:column,f32:column,f32:column,1,0,serial,1,1,heuristic,invalid,invalid,false,false,1,tensorop,f32,256,128,32,1,1,1,0,0,0,2,4,2,1,16,8,8,75,1024,1376256,67633152,49,0.0164819,77.7663,4103.48
11,CUTLASS,gemm,cutlass_tensorop_s1688gemm_f16_256x128_32x2_tt_align8,passed,success,universal,1024,256,128,f16:row,f16:row,f32:column,f32:column,1,0,serial,1,1,heuristic,invalid,invalid,false,false,1,tensorop,f32,256,128,32,1,1,1,0,0,0,2,4,2,1,16,8,8,75,1024,1376256,67633152,49,0.015809,81.0767,4278.15
11,CUTLASS,gemm,cutlass_tensorop_f16_s1688gemm_f16_256x128_32x2_nn_align8,passed,success,universal,1024,256,128,f16:column,f16:column,f16:column,f16:column,1,0,serial,1,1,heuristic,invalid,invalid,false,false,1,tensorop,f32,256,128,32,1,1,1,0,0,0,2,4,2,1,16,8,8,75,1024,851968,67633152,79,0.0159395,49.7792,4243.11
11,CUTLASS,gemm,cutlass_tensorop_f16_s1688gemm_f16_256x128_32x2_nt_align8,passed,success,universal,1024,256,128,f16:column,f16:row,f16:column,f16:column,1,0,serial,1,1,heuristic,invalid,invalid,false,false,1,tensorop,f32,256,128,32,1,1,1,0,0,0,2,4,2,1,16,8,8,75,1024,851968,67633152,79,0.0152413,52.0597,4437.5
11,CUTLASS,gemm,cutlass_tensorop_f16_s1688gemm_f16_256x128_32x2_tn_align8,passed,success,universal,1024,256,128,f16:row,f16:column,f16:column,f16:column,1,0,serial,1,1,heuristic,invalid,invalid,false,false,1,tensorop,f32,256,128,32,1,1,1,0,0,0,2,4,2,1,16,8,8,75,1024,851968,67633152,79,0.0161568,49.1098,4186.05
11,CUTLASS,gemm,cutlass_tensorop_f16_s1688gemm_f16_256x128_32x2_tt_align8,passed,success,universal,1024,256,128,f16:row,f16:row,f16:column,f16:column,1,0,serial,1,1,heuristic,invalid,invalid,false,false,1,tensorop,f32,256,128,32,1,1,1,0,0,0,2,4,2,1,16,8,8,75,1024,851968,67633152,79,0.0154979,51.1976,4364.01
12,CUTLASS,gemm,cutlass_tensorop_s884gemm_f16_256x128_32x2_nn_align8,passed,success,universal,2048,256,128,f16:column,f16:column,f32:column,f32:column,1,0,serial,1,1,heuristic,invalid,invalid,false,false,1,tensorop,f32,256,128,32,1,1,1,0,0,0,2,4,2,1,16,16,4,70,75,2686976,135266304,50,0.0262093,95.4792,5161.01
12,CUTLASS,gemm,cutlass_tensorop_s884gemm_f16_256x128_32x2_nt_align8,passed,success,universal,2048,256,128,f16:column,f16:row,f32:column,f32:column,1,0,serial,1,1,heuristic,invalid,invalid,false,false,1,tensorop,f32,256,128,32,1,1,1,0,0,0,2,4,2,1,16,16,4,70,75,2686976,135266304,50,0.028583,87.5499,4732.4
12,CUTLASS,gemm,cutlass_tensorop_s884gemm_f16_256x128_32x2_tn_align8,passed,success,universal,2048,256,128,f16:row,f16:column,f32:column,f32:column,1,0,serial,1,1,heuristic,invalid,invalid,false,false,1,tensorop,f32,256,128,32,1,1,1,0,0,0,2,4,2,1,16,16,4,70,75,2686976,135266304,50,0.0268288,93.2744,5041.83
12,CUTLASS,gemm,cutlass_tensorop_s884gemm_f16_256x128_32x2_tt_align8,passed,success,universal,2048,256,128,f16:row,f16:row,f32:column,f32:column,1,0,serial,1,1,heuristic,invalid,invalid,false,false,1,tensorop,f32,256,128,32,1,1,1,0,0,0,2,4,2,1,16,16,4,70,75,2686976,135266304,50,0.026271,95.2548,5148.88
12,CUTLASS,gemm,cutlass_tensorop_f16_s884gemm_f16_256x128_32x2_nn_align8,passed,success,universal,2048,256,128,f16:column,f16:column,f16:column,f16:column,1,0,serial,1,1,heuristic,invalid,invalid,false,false,1,tensorop,f32,256,128,32,1,1,1,0,0,0,2,4,2,1,16,16,4,70,75,1638400,135266304,82,0.0262579,58.1112,5151.45
12,CUTLASS,gemm,cutlass_tensorop_f16_s884gemm_f16_256x128_32x2_nt_align8,passed,success,universal,2048,256,128,f16:column,f16:row,f16:column,f16:column,1,0,serial,1,1,heuristic,invalid,invalid,false,false,1,tensorop,f32,256,128,32,1,1,1,0,0,0,2,4,2,1,16,16,4,70,75,1638400,135266304,82,0.0286278,53.3005,4724.99
12,CUTLASS,gemm,cutlass_tensorop_f16_s884gemm_f16_256x128_32x2_tn_align8,passed,success,universal,2048,256,128,f16:row,f16:column,f16:column,f16:column,1,0,serial,1,1,heuristic,invalid,invalid,false,false,1,tensorop,f32,256,128,32,1,1,1,0,0,0,2,4,2,1,16,16,4,70,75,1638400,135266304,82,0.0269139,56.6948,5025.89
12,CUTLASS,gemm,cutlass_tensorop_f16_s884gemm_f16_256x128_32x2_tt_align8,passed,success,universal,2048,256,128,f16:row,f16:row,f16:column,f16:column,1,0,serial,1,1,heuristic,invalid,invalid,false,false,1,tensorop,f32,256,128,32,1,1,1,0,0,0,2,4,2,1,16,16,4,70,75,1638400,135266304,82,0.0263565,57.8939,5132.18
12,CUTLASS,gemm,cutlass_tensorop_s1688gemm_f16_256x128_32x2_nn_align8,passed,success,universal,2048,256,128,f16:column,f16:column,f32:column,f32:column,1,0,serial,1,1,heuristic,invalid,invalid,false,false,1,tensorop,f32,256,128,32,1,1,1,0,0,0,2,4,2,1,16,8,8,75,1024,2686976,135266304,50,0.0168595,148.429,8023.14
12,CUTLASS,gemm,cutlass_tensorop_s1688gemm_f16_256x128_32x2_nt_align8,passed,success,universal,2048,256,128,f16:column,f16:row,f32:column,f32:column,1,0,serial,1,1,heuristic,invalid,invalid,false,false,1,tensorop,f32,256,128,32,1,1,1,0,0,0,2,4,2,1,16,8,8,75,1024,2686976,135266304,50,0.0158438,157.944,8537.47
12,CUTLASS,gemm,cutlass_tensorop_s1688gemm_f16_256x128_32x2_tn_align8,passed,success,universal,2048,256,128,f16:row,f16:column,f32:column,f32:column,1,0,serial,1,1,heuristic,invalid,invalid,false,false,1,tensorop,f32,256,128,32,1,1,1,0,0,0,2,4,2,1,16,8,8,75,1024,2686976,135266304,50,0.0172973,144.673,7820.09
12,CUTLASS,gemm,cutlass_tensorop_s1688gemm_f16_256x128_32x2_tt_align8,passed,success,universal,2048,256,128,f16:row,f16:row,f32:column,f32:column,1,0,serial,1,1,heuristic,invalid,invalid,false,false,1,tensorop,f32,256,128,32,1,1,1,0,0,0,2,4,2,1,16,8,8,75,1024,2686976,135266304,50,0.0165616,151.099,8167.47
12,CUTLASS,gemm,cutlass_tensorop_f16_s1688gemm_f16_256x128_32x2_nn_align8,passed,success,universal,2048,256,128,f16:column,f16:column,f16:column,f16:column,1,0,serial,1,1,heuristic,invalid,invalid,false,false,1,tensorop,f32,256,128,32,1,1,1,0,0,0,2,4,2,1,16,8,8,75,1024,1638400,135266304,82,0.0162426,93.9433,8327.89
12,CUTLASS,gemm,cutlass_tensorop_f16_s1688gemm_f16_256x128_32x2_nt_align8,passed,success,universal,2048,256,128,f16:column,f16:row,f16:column,f16:column,1,0,serial,1,1,heuristic,invalid,invalid,false,false,1,tensorop,f32,256,128,32,1,1,1,0,0,0,2,4,2,1,16,8,8,75,1024,1638400,135266304,82,0.0152941,99.7693,8844.36
12,CUTLASS,gemm,cutlass_tensorop_f16_s1688gemm_f16_256x128_32x2_tn_align8,passed,success,universal,2048,256,128,f16:row,f16:column,f16:column,f16:column,1,0,serial,1,1,heuristic,invalid,invalid,false,false,1,tensorop,f32,256,128,32,1,1,1,0,0,0,2,4,2,1,16,8,8,75,1024,1638400,135266304,82,0.0166362,91.7206,8130.86
12,CUTLASS,gemm,cutlass_tensorop_f16_s1688gemm_f16_256x128_32x2_tt_align8,passed,success,universal,2048,256,128,f16:row,f16:row,f16:column,f16:column,1,0,serial,1,1,heuristic,invalid,invalid,false,false,1,tensorop,f32,256,128,32,1,1,1,0,0,0,2,4,2,1,16,8,8,75,1024,1638400,135266304,82,0.0159187,95.8544,8497.31
13,CUTLASS,gemm,cutlass_tensorop_s884gemm_f16_256x128_32x2_nn_align8,passed,success,universal,4096,256,128,f16:column,f16:column,f32:column,f32:column,1,0,serial,1,1,heuristic,invalid,invalid,false,false,1,tensorop,f32,256,128,32,1,1,1,0,0,0,2,4,2,1,16,16,4,70,75,5308416,270532608,50,0.0267763,184.635,10103.4
13,CUTLASS,gemm,cutlass_tensorop_s884gemm_f16_256x128_32x2_nt_align8,passed,success,universal,4096,256,128,f16:column,f16:row,f32:column,f32:column,1,0,serial,1,1,heuristic,invalid,invalid,false,false,1,tensorop,f32,256,128,32,1,1,1,0,0,0,2,4,2,1,16,16,4,70,75,5308416,270532608,50,0.029024,170.337,9321
13,CUTLASS,gemm,cutlass_tensorop_s884gemm_f16_256x128_32x2_tn_align8,passed,success,universal,4096,256,128,f16:row,f16:column,f32:column,f32:column,1,0,serial,1,1,heuristic,invalid,invalid,false,false,1,tensorop,f32,256,128,32,1,1,1,0,0,0,2,4,2,1,16,16,4,70,75,5308416,270532608,50,0.0276602,178.735,9780.59
13,CUTLASS,gemm,cutlass_tensorop_s884gemm_f16_256x128_32x2_tt_align8,passed,success,universal,4096,256,128,f16:row,f16:row,f32:column,f32:column,1,0,serial,1,1,heuristic,invalid,invalid,false,false,1,tensorop,f32,256,128,32,1,1,1,0,0,0,2,4,2,1,16,16,4,70,75,5308416,270532608,50,0.0273926,180.481,9876.11
13,CUTLASS,gemm,cutlass_tensorop_f16_s884gemm_f16_256x128_32x2_nn_align8,passed,success,universal,4096,256,128,f16:column,f16:column,f16:column,f16:column,1,0,serial,1,1,heuristic,invalid,invalid,false,false,1,tensorop,f32,256,128,32,1,1,1,0,0,0,2,4,2,1,16,16,4,70,75,3211264,270532608,84,0.026665,112.159,10145.6
13,CUTLASS,gemm,cutlass_tensorop_f16_s884gemm_f16_256x128_32x2_nt_align8,passed,success,universal,4096,256,128,f16:column,f16:row,f16:column,f16:column,1,0,serial,1,1,heuristic,invalid,invalid,false,false,1,tensorop,f32,256,128,32,1,1,1,0,0,0,2,4,2,1,16,16,4,70,75,3211264,270532608,84,0.0289965,103.141,9329.84
13,CUTLASS,gemm,cutlass_tensorop_f16_s884gemm_f16_256x128_32x2_tn_align8,passed,success,universal,4096,256,128,f16:row,f16:column,f16:column,f16:column,1,0,serial,1,1,heuristic,invalid,invalid,false,false,1,tensorop,f32,256,128,32,1,1,1,0,0,0,2,4,2,1,16,16,4,70,75,3211264,270532608,84,0.0276634,108.111,9779.46
13,CUTLASS,gemm,cutlass_tensorop_f16_s884gemm_f16_256x128_32x2_tt_align8,passed,success,universal,4096,256,128,f16:row,f16:row,f16:column,f16:column,1,0,serial,1,1,heuristic,invalid,invalid,false,false,1,tensorop,f32,256,128,32,1,1,1,0,0,0,2,4,2,1,16,16,4,70,75,3211264,270532608,84,0.0272918,109.583,9912.58
13,CUTLASS,gemm,cutlass_tensorop_s1688gemm_f16_256x128_32x2_nn_align8,passed,success,universal,4096,256,128,f16:column,f16:column,f32:column,f32:column,1,0,serial,1,1,heuristic,invalid,invalid,false,false,1,tensorop,f32,256,128,32,1,1,1,0,0,0,2,4,2,1,16,8,8,75,1024,5308416,270532608,50,0.0196928,251.048,13737.6
13,CUTLASS,gemm,cutlass_tensorop_s1688gemm_f16_256x128_32x2_nt_align8,passed,success,universal,4096,256,128,f16:column,f16:row,f32:column,f32:column,1,0,serial,1,1,heuristic,invalid,invalid,false,false,1,tensorop,f32,256,128,32,1,1,1,0,0,0,2,4,2,1,16,8,8,75,1024,5308416,270532608,50,0.0189114,261.422,14305.3
13,CUTLASS,gemm,cutlass_tensorop_s1688gemm_f16_256x128_32x2_tn_align8,passed,success,universal,4096,256,128,f16:row,f16:column,f32:column,f32:column,1,0,serial,1,1,heuristic,invalid,invalid,false,false,1,tensorop,f32,256,128,32,1,1,1,0,0,0,2,4,2,1,16,8,8,75,1024,5308416,270532608,50,0.0202048,244.687,13389.5
13,CUTLASS,gemm,cutlass_tensorop_s1688gemm_f16_256x128_32x2_tt_align8,passed,success,universal,4096,256,128,f16:row,f16:row,f32:column,f32:column,1,0,serial,1,1,heuristic,invalid,invalid,false,false,1,tensorop,f32,256,128,32,1,1,1,0,0,0,2,4,2,1,16,8,8,75,1024,5308416,270532608,50,0.0197088,250.845,13726.5
13,CUTLASS,gemm,cutlass_tensorop_f16_s1688gemm_f16_256x128_32x2_nn_align8,passed,success,universal,4096,256,128,f16:column,f16:column,f16:column,f16:column,1,0,serial,1,1,heuristic,invalid,invalid,false,false,1,tensorop,f32,256,128,32,1,1,1,0,0,0,2,4,2,1,16,8,8,75,1024,3211264,270532608,84,0.0166598,179.517,16238.6
13,CUTLASS,gemm,cutlass_tensorop_f16_s1688gemm_f16_256x128_32x2_nt_align8,passed,success,universal,4096,256,128,f16:column,f16:row,f16:column,f16:column,1,0,serial,1,1,heuristic,invalid,invalid,false,false,1,tensorop,f32,256,128,32,1,1,1,0,0,0,2,4,2,1,16,8,8,75,1024,3211264,270532608,84,0.0159334,187.701,16978.9
