results/cutlass/cutlass_f16tc.gemm.csv
Problem,Provider,OperationKind,Operation,Disposition,Status,gemm_kind,m,n,k,A,B,C,D,alpha,beta,split_k_mode,split_k_slices,batch_count,raster_order,runtime_input_datatype_a,runtime_input_datatype_b,use_pdl,enable_sm90_mixed_dtype_shuffle_test,swizzle_size,op_class,accum,cta_m,cta_n,cta_k,cluster_m,cluster_n,cluster_k,cluster_m_fallback,cluster_n_fallback,cluster_k_fallback,stages,warps_m,warps_n,warps_k,inst_m,inst_n,inst_k,min_cc,max_cc,Bytes,Flops,Flops/Byte,Runtime,GB/s,GFLOPs
1,CUTLASS,gemm,cutlass_tensorop_s884gemm_f16_256x128_32x2_nn_align8,passed,success,universal,128,128,128,f16:column,f16:column,f32:column,f32:column,1,0,serial,1,1,heuristic,invalid,invalid,false,false,1,tensorop,f32,256,128,32,1,1,1,0,0,0,2,4,2,1,16,16,4,70,75,131072,4227072,32,0.0155459,7.85224,271.909
1,CUTLASS,gemm,cutlass_tensorop_s884gemm_f16_256x128_32x2_nt_align8,passed,success,universal,128,128,128,f16:column,f16:row,f32:column,f32:column,1,0,serial,1,1,heuristic,invalid,invalid,false,false,1,tensorop,f32,256,128,32,1,1,1,0,0,0,2,4,2,1,16,16,4,70,75,131072,4227072,32,0.0155443,7.85305,271.937
1,CUTLASS,gemm,cutlass_tensorop_s884gemm_f16_256x128_32x2_tn_align8,passed,success,universal,128,128,128,f16:row,f16:column,f32:column,f32:column,1,0,serial,1,1,heuristic,invalid,invalid,false,false,1,tensorop,f32,256,128,32,1,1,1,0,0,0,2,4,2,1,16,16,4,70,75,131072,4227072,32,0.0156579,7.79607,269.964
1,CUTLASS,gemm,cutlass_tensorop_s884gemm_f16_256x128_32x2_tt_align8,passed,success,universal,128,128,128,f16:row,f16:row,f32:column,f32:column,1,0,serial,1,1,heuristic,invalid,invalid,false,false,1,tensorop,f32,256,128,32,1,1,1,0,0,0,2,4,2,1,16,16,4,70,75,131072,4227072,32,0.0156259,7.81204,270.517
1,CUTLASS,gemm,cutlass_tensorop_f16_s884gemm_f16_256x128_32x2_nn_align8,passed,success,universal,128,128,128,f16:column,f16:column,f16:column,f16:column,1,0,serial,1,1,heuristic,invalid,invalid,false,false,1,tensorop,f32,256,128,32,1,1,1,0,0,0,2,4,2,1,16,16,4,70,75,98304,4227072,43,0.016521,5.54161,255.861
1,CUTLASS,gemm,cutlass_tensorop_f16_s884gemm_f16_256x128_32x2_nt_align8,passed,success,universal,128,128,128,f16:column,f16:row,f16:column,f16:column,1,0,serial,1,1,heuristic,invalid,invalid,false,false,1,tensorop,f32,256,128,32,1,1,1,0,0,0,2,4,2,1,16,16,4,70,75,98304,4227072,43,0.0165459,5.53325,255.475
1,CUTLASS,gemm,cutlass_tensorop_f16_s884gemm_f16_256x128_32x2_tn_align8,passed,success,universal,128,128,128,f16:row,f16:column,f16:column,f16:column,1,0,serial,1,1,heuristic,invalid,invalid,false,false,1,tensorop,f32,256,128,32,1,1,1,0,0,0,2,4,2,1,16,16,4,70,75,98304,4227072,43,0.0165626,5.52769,255.219
1,CUTLASS,gemm,cutlass_tensorop_f16_s884gemm_f16_256x128_32x2_tt_align8,passed,success,universal,128,128,128,f16:row,f16:row,f16:column,f16:column,1,0,serial,1,1,heuristic,invalid,invalid,false,false,1,tensorop,f32,256,128,32,1,1,1,0,0,0,2,4,2,1,16,16,4,70,75,98304,4227072,43,0.0166906,5.4853,253.261
2,CUTLASS,gemm,cutlass_tensorop_s884gemm_f16_256x128_32x2_nn_align8,passed,success,universal,256,128,128,f16:column,f16:column,f32:column,f32:column,1,0,serial,1,1,heuristic,invalid,invalid,false,false,1,tensorop,f32,256,128,32,1,1,1,0,0,0,2,4,2,1,16,16,4,70,75,229376,8454144,36,0.0155334,13.7525,544.254
2,CUTLASS,gemm,cutlass_tensorop_s884gemm_f16_256x128_32x2_nt_align8,passed,success,universal,256,128,128,f16:column,f16:row,f32:column,f32:column,1,0,serial,1,1,heuristic,invalid,invalid,false,false,1,tensorop,f32,256,128,32,1,1,1,0,0,0,2,4,2,1,16,16,4,70,75,229376,8454144,36,0.015607,13.6876,541.688
2,CUTLASS,gemm,cutlass_tensorop_s884gemm_f16_256x128_32x2_tn_align8,passed,success,universal,256,128,128,f16:row,f16:column,f32:column,f32:column,1,0,serial,1,1,heuristic,invalid,invalid,false,false,1,tensorop,f32,256,128,32,1,1,1,0,0,0,2,4,2,1,16,16,4,70,75,229376,8454144,36,0.0155965,13.6969,542.055
2,CUTLASS,gemm,cutlass_tensorop_s884gemm_f16_256x128_32x2_tt_align8,passed,success,universal,256,128,128,f16:row,f16:row,f32:column,f32:column,1,0,serial,1,1,heuristic,invalid,invalid,false,false,1,tensorop,f32,256,128,32,1,1,1,0,0,0,2,4,2,1,16,16,4,70,75,229376,8454144,36,0.0156666,13.6356,539.63
2,CUTLASS,gemm,cutlass_tensorop_f16_s884gemm_f16_256x128_32x2_nn_align8,passed,success,universal,256,128,128,f16:column,f16:column,f16:column,f16:column,1,0,serial,1,1,heuristic,invalid,invalid,false,false,1,tensorop,f32,256,128,32,1,1,1,0,0,0,2,4,2,1,16,16,4,70,75,163840,8454144,51,0.016592,9.19647,509.531
2,CUTLASS,gemm,cutlass_tensorop_f16_s884gemm_f16_256x128_32x2_nt_align8,passed,success,universal,256,128,128,f16:column,f16:row,f16:column,f16:column,1,0,serial,1,1,heuristic,invalid,invalid,false,false,1,tensorop,f32,256,128,32,1,1,1,0,0,0,2,4,2,1,16,16,4,70,75,163840,8454144,51,0.0166538,9.16237,507.642
2,CUTLASS,gemm,cutlass_tensorop_f16_s884gemm_f16_256x128_32x2_tn_align8,passed,success,universal,256,128,128,f16:row,f16:column,f16:column,f16:column,1,0,serial,1,1,heuristic,invalid,invalid,false,false,1,tensorop,f32,256,128,32,1,1,1,0,0,0,2,4,2,1,16,16,4,70,75,163840,8454144,51,0.0166979,9.13814,506.299
2,CUTLASS,gemm,cutlass_tensorop_f16_s884gemm_f16_256x128_32x2_tt_align8,passed,success,universal,256,128,128,f16:row,f16:row,f16:column,f16:column,1,0,serial,1,1,heuristic,invalid,invalid,false,false,1,tensorop,f32,256,128,32,1,1,1,0,0,0,2,4,2,1,16,16,4,70,75,163840,8454144,51,0.0167315,9.11979,505.282
3,CUTLASS,gemm,cutlass_tensorop_s884gemm_f16_256x128_32x2_nn_align8,passed,success,universal,512,128,128,f16:column,f16:column,f32:column,f32:column,1,0,serial,1,1,heuristic,invalid,invalid,false,false,1,tensorop,f32,256,128,32,1,1,1,0,0,0,2,4,2,1,16,16,4,70,75,425984,16908288,39,0.015655,25.3419,1080.05
3,CUTLASS,gemm,cutlass_tensorop_s884gemm_f16_256x128_32x2_nt_align8,passed,success,universal,512,128,128,f16:column,f16:row,f32:column,f32:column,1,0,serial,1,1,heuristic,invalid,invalid,false,false,1,tensorop,f32,256,128,32,1,1,1,0,0,0,2,4,2,1,16,16,4,70,75,425984,16908288,39,0.0157062,25.2593,1076.53
3,CUTLASS,gemm,cutlass_tensorop_s884gemm_f16_256x128_32x2_tn_align8,passed,success,universal,512,128,128,f16:row,f16:column,f32:column,f32:column,1,0,serial,1,1,heuristic,invalid,invalid,false,false,1,tensorop,f32,256,128,32,1,1,1,0,0,0,2,4,2,1,16,16,4,70,75,425984,16908288,39,0.0157642,25.1665,1072.58
3,CUTLASS,gemm,cutlass_tensorop_s884gemm_f16_256x128_32x2_tt_align8,passed,success,universal,512,128,128,f16:row,f16:row,f32:column,f32:column,1,0,serial,1,1,heuristic,invalid,invalid,false,false,1,tensorop,f32,256,128,32,1,1,1,0,0,0,2,4,2,1,16,16,4,70,75,425984,16908288,39,0.0158234,25.0723,1068.56
3,CUTLASS,gemm,cutlass_tensorop_f16_s884gemm_f16_256x128_32x2_nn_align8,passed,success,universal,512,128,128,f16:column,f16:column,f16:column,f16:column,1,0,serial,1,1,heuristic,invalid,invalid,false,false,1,tensorop,f32,256,128,32,1,1,1,0,0,0,2,4,2,1,16,16,4,70,75,294912,16908288,57,0.0166646,16.4815,1014.62
3,CUTLASS,gemm,cutlass_tensorop_f16_s884gemm_f16_256x128_32x2_nt_align8,passed,success,universal,512,128,128,f16:column,f16:row,f16:column,f16:column,1,0,serial,1,1,heuristic,invalid,invalid,false,false,1,tensorop,f32,256,128,32,1,1,1,0,0,0,2,4,2,1,16,16,4,70,75,294912,16908288,57,0.0166672,16.479,1014.46
3,CUTLASS,gemm,cutlass_tensorop_f16_s884gemm_f16_256x128_32x2_tn_align8,passed,success,universal,512,128,128,f16:row,f16:column,f16:column,f16:column,1,0,serial,1,1,heuristic,invalid,invalid,false,false,1,tensorop,f32,256,128,32,1,1,1,0,0,0,2,4,2,1,16,16,4,70,75,294912,16908288,57,0.0167334,16.4137,1010.45
3,CUTLASS,gemm,cutlass_tensorop_f16_s884gemm_f16_256x128_32x2_tt_align8,passed,success,universal,512,128,128,f16:row,f16:row,f16:column,f16:column,1,0,serial,1,1,heuristic,invalid,invalid,false,false,1,tensorop,f32,256,128,32,1,1,1,0,0,0,2,4,2,1,16,16,4,70,75,294912,16908288,57,0.0167485,16.399,1009.54
4,CUTLASS,gemm,cutlass_tensorop_s884gemm_f16_256x128_32x2_nn_align8,passed,success,universal,1024,128,128,f16:column,f16:column,f32:column,f32:column,1,0,serial,1,1,heuristic,invalid,invalid,false,false,1,tensorop,f32,256,128,32,1,1,1,0,0,0,2,4,2,1,16,16,4,70,75,819200,33816576,41,0.0157568,48.4197,2146.16
4,CUTLASS,gemm,cutlass_tensorop_s884gemm_f16_256x128_32x2_nt_align8,passed,success,universal,1024,128,128,f16:column,f16:row,f32:column,f32:column,1,0,serial,1,1,heuristic,invalid,invalid,false,false,1,tensorop,f32,256,128,32,1,1,1,0,0,0,2,4,2,1,16,16,4,70,75,819200,33816576,41,0.0157462,48.4522,2147.6
4,CUTLASS,gemm,cutlass_tensorop_s884gemm_f16_256x128_32x2_tn_align8,passed,success,universal,1024,128,128,f16:row,f16:column,f32:column,f32:column,1,0,serial,1,1,heuristic,invalid,invalid,false,false,1,tensorop,f32,256,128,32,1,1,1,0,0,0,2,4,2,1,16,16,4,70,75,819200,33816576,41,0.0158454,48.1488,2134.15
4,CUTLASS,gemm,cutlass_tensorop_s884gemm_f16_256x128_32x2_tt_align8,passed,success,universal,1024,128,128,f16:row,f16:row,f32:column,f32:column,1,0,serial,1,1,heuristic,invalid,invalid,false,false,1,tensorop,f32,256,128,32,1,1,1,0,0,0,2,4,2,1,16,16,4,70,75,819200,33816576,41,0.0158829,48.0353,2129.12
4,CUTLASS,gemm,cutlass_tensorop_f16_s884gemm_f16_256x128_32x2_nn_align8,passed,success,universal,1024,128,128,f16:column,f16:column,f16:column,f16:column,1,0,serial,1,1,heuristic,invalid,invalid,false,false,1,tensorop,f32,256,128,32,1,1,1,0,0,0,2,4,2,1,16,16,4,70,75,557056,33816576,60,0.0167594,30.9558,2017.77
4,CUTLASS,gemm,cutlass_tensorop_f16_s884gemm_f16_256x128_32x2_nt_align8,passed,success,universal,1024,128,128,f16:column,f16:row,f16:column,f16:column,1,0,serial,1,1,heuristic,invalid,invalid,false,false,1,tensorop,f32,256,128,32,1,1,1,0,0,0,2,4,2,1,16,16,4,70,75,557056,33816576,60,0.0167037,31.059,2024.5
4,CUTLASS,gemm,cutlass_tensorop_f16_s884gemm_f16_256x128_32x2_tn_align8,passed,success,universal,1024,128,128,f16:row,f16:column,f16:column,f16:column,1,0,serial,1,1,heuristic,invalid,invalid,false,false,1,tensorop,f32,256,128,32,1,1,1,0,0,0,2,4,2,1,16,16,4,70,75,557056,33816576,60,0.016864,30.7637,2005.25
4,CUTLASS,gemm,cutlass_tensorop_f16_s884gemm_f16_256x128_32x2_tt_align8,passed,success,universal,1024,128,128,f16:row,f16:row,f16:column,f16:column,1,0,serial,1,1,heuristic,invalid,invalid,false,false,1,tensorop,f32,256,128,32,1,1,1,0,0,0,2,4,2,1,16,16,4,70,75,557056,33816576,60,0.0168944,30.7083,2001.64
5,CUTLASS,gemm,cutlass_tensorop_s884gemm_f16_256x128_32x2_nn_align8,passed,success,universal,2048,128,128,f16:column,f16:column,f32:column,f32:column,1,0,serial,1,1,heuristic,invalid,invalid,false,false,1,tensorop,f32,256,128,32,1,1,1,0,0,0,2,4,2,1,16,16,4,70,75,1605632,67633152,42,0.0157971,94.6604,4281.36
5,CUTLASS,gemm,cutlass_tensorop_s884gemm_f16_256x128_32x2_nt_align8,passed,success,universal,2048,128,128,f16:column,f16:row,f32:column,f32:column,1,0,serial,1,1,heuristic,invalid,invalid,false,false,1,tensorop,f32,256,128,32,1,1,1,0,0,0,2,4,2,1,16,16,4,70,75,1605632,67633152,42,0.0157792,94.7679,4286.22
5,CUTLASS,gemm,cutlass_tensorop_s884gemm_f16_256x128_32x2_tn_align8,passed,success,universal,2048,128,128,f16:row,f16:column,f32:column,f32:column,1,0,serial,1,1,heuristic,invalid,invalid,false,false,1,tensorop,f32,256,128,32,1,1,1,0,0,0,2,4,2,1,16,16,4,70,75,1605632,67633152,42,0.016016,93.3667,4222.85
5,CUTLASS,gemm,cutlass_tensorop_s884gemm_f16_256x128_32x2_tt_align8,passed,success,universal,2048,128,128,f16:row,f16:row,f32:column,f32:column,1,0,serial,1,1,heuristic,invalid,invalid,false,false,1,tensorop,f32,256,128,32,1,1,1,0,0,0,2,4,2,1,16,16,4,70,75,1605632,67633152,42,0.0161142,92.7975,4197.1
5,CUTLASS,gemm,cutlass_tensorop_f16_s884gemm_f16_256x128_32x2_nn_align8,passed,success,universal,2048,128,128,f16:column,f16:column,f16:column,f16:column,1,0,serial,1,1,heuristic,invalid,invalid,false,false,1,tensorop,f32,256,128,32,1,1,1,0,0,0,2,4,2,1,16,16,4,70,75,1081344,67633152,62,0.0168051,59.927,4024.56
5,CUTLASS,gemm,cutlass_tensorop_f16_s884gemm_f16_256x128_32x2_nt_align8,passed,success,universal,2048,128,128,f16:column,f16:row,f16:column,f16:column,1,0,serial,1,1,heuristic,invalid,invalid,false,false,1,tensorop,f32,256,128,32,1,1,1,0,0,0,2,4,2,1,16,16,4,70,75,1081344,67633152,62,0.0168592,59.7347,4011.65
5,CUTLASS,gemm,cutlass_tensorop_f16_s884gemm_f16_256x128_32x2_tn_align8,passed,success,universal,2048,128,128,f16:row,f16:column,f16:column,f16:column,1,0,serial,1,1,heuristic,invalid,invalid,false,false,1,tensorop,f32,256,128,32,1,1,1,0,0,0,2,4,2,1,16,16,4,70,75,1081344,67633152,62,0.0171594,58.6898,3941.47
5,CUTLASS,gemm,cutlass_tensorop_f16_s884gemm_f16_256x128_32x2_tt_align8,passed,success,universal,2048,128,128,f16:row,f16:row,f16:column,f16:column,1,0,serial,1,1,heuristic,invalid,invalid,false,false,1,tensorop,f32,256,128,32,1,1,1,0,0,0,2,4,2,1,16,16,4,70,75,1081344,67633152,62,0.017105,58.8765,3954.01
6,CUTLASS,gemm,cutlass_tensorop_s884gemm_f16_256x128_32x2_nn_align8,passed,success,universal,4096,128,128,f16:column,f16:column,f32:column,f32:column,1,0,serial,1,1,heuristic,invalid,invalid,false,false,1,tensorop,f32,256,128,32,1,1,1,0,0,0,2,4,2,1,16,16,4,70,75,3178496,135266304,42,0.0160102,184.894,8448.74
6,CUTLASS,gemm,cutlass_tensorop_s884gemm_f16_256x128_32x2_nt_align8,passed,success,universal,4096,128,128,f16:column,f16:row,f32:column,f32:column,1,0,serial,1,1,heuristic,invalid,invalid,false,false,1,tensorop,f32,256,128,32,1,1,1,0,0,0,2,4,2,1,16,16,4,70,75,3178496,135266304,42,0.0161757,183.003,8362.33
6,CUTLASS,gemm,cutlass_tensorop_s884gemm_f16_256x128_32x2_tn_align8,passed,success,universal,4096,128,128,f16:row,f16:column,f32:column,f32:column,1,0,serial,1,1,heuristic,invalid,invalid,false,false,1,tensorop,f32,256,128,32,1,1,1,0,0,0,2,4,2,1,16,16,4,70,75,3178496,135266304,42,0.0163376,181.19,8279.45
6,CUTLASS,gemm,cutlass_tensorop_s884gemm_f16_256x128_32x2_tt_align8,passed,success,universal,4096,128,128,f16:row,f16:row,f32:column,f32:column,1,0,serial,1,1,heuristic,invalid,invalid,false,false,1,tensorop,f32,256,128,32,1,1,1,0,0,0,2,4,2,1,16,16,4,70,75,3178496,135266304,42,0.0182954,161.801,7393.48
6,CUTLASS,gemm,cutlass_tensorop_f16_s884gemm_f16_256x128_32x2_nn_align8,passed,success,universal,4096,128,128,f16:column,f16:column,f16:column,f16:column,1,0,serial,1,1,heuristic,invalid,invalid,false,false,1,tensorop,f32,256,128,32,1,1,1,0,0,0,2,4,2,1,16,16,4,70,75,2129920,135266304,63,0.0192125,103.248,7040.54
6,CUTLASS,gemm,cutlass_tensorop_f16_s884gemm_f16_256x128_32x2_nt_align8,passed,success,universal,4096,128,128,f16:column,f16:row,f16:column,f16:column,1,0,serial,1,1,heuristic,invalid,invalid,false,false,1,tensorop,f32,256,128,32,1,1,1,0,0,0,2,4,2,1,16,16,4,70,75,2129920,135266304,63,0.0193229,102.658,7000.32
6,CUTLASS,gemm,cutlass_tensorop_f16_s884gemm_f16_256x128_32x2_tn_align8,passed,success,universal,4096,128,128,f16:row,f16:column,f16:column,f16:column,1,0,serial,1,1,heuristic,invalid,invalid,false,false,1,tensorop,f32,256,128,32,1,1,1,0,0,0,2,4,2,1,16,16,4,70,75,2129920,135266304,63,0.0194467,102.004,6955.74
6,CUTLASS,gemm,cutlass_tensorop_f16_s884gemm_f16_256x128_32x2_tt_align8,passed,success,universal,4096,128,128,f16:row,f16:row,f16:column,f16:column,1,0,serial,1,1,heuristic,invalid,invalid,false,false,1,tensorop,f32,256,128,32,1,1,1,0,0,0,2,4,2,1,16,16,4,70,75,2129920,135266304,63,0.019424,102.123,6963.87
7,CUTLASS,gemm,cutlass_tensorop_s884gemm_f16_256x128_32x2_nn_align8,passed,success,universal,8192,128,128,f16:column,f16:column,f32:column,f32:column,1,0,serial,1,1,heuristic,invalid,invalid,false,false,1,tensorop,f32,256,128,32,1,1,1,0,0,0,2,4,2,1,16,16,4,70,75,6324224,270532608,42,0.0198931,296.077,13599.3
7,CUTLASS,gemm,cutlass_tensorop_s884gemm_f16_256x128_32x2_nt_align8,passed,success,universal,8192,128,128,f16:column,f16:row,f32:column,f32:column,1,0,serial,1,1,heuristic,invalid,invalid,false,false,1,tensorop,f32,256,128,32,1,1,1,0,0,0,2,4,2,1,16,16,4,70,75,6324224,270532608,42,0.0203155,289.921,13316.5
7,CUTLASS,gemm,cutlass_tensorop_s884gemm_f16_256x128_32x2_tn_align8,passed,success,universal,8192,128,128,f16:row,f16:column,f32:column,f32:column,1,0,serial,1,1,heuristic,invalid,invalid,false,false,1,tensorop,f32,256,128,32,1,1,1,0,0,0,2,4,2,1,16,16,4,70,75,6324224,270532608,42,0.0200218,294.175,13511.9
7,CUTLASS,gemm,cutlass_tensorop_s884gemm_f16_256x128_32x2_tt_align8,passed,success,universal,8192,128,128,f16:row,f16:row,f32:column,f32:column,1,0,serial,1,1,heuristic,invalid,invalid,false,false,1,tensorop,f32,256,128,32,1,1,1,0,0,0,2,4,2,1,16,16,4,70,75,6324224,270532608,42,0.0202134,291.385,13383.8
7,CUTLASS,gemm,cutlass_tensorop_f16_s884gemm_f16_256x128_32x2_nn_align8,passed,success,universal,8192,128,128,f16:column,f16:column,f16:column,f16:column,1,0,serial,1,1,heuristic,invalid,invalid,false,false,1,tensorop,f32,256,128,32,1,1,1,0,0,0,2,4,2,1,16,16,4,70,75,4227072,270532608,64,0.020319,193.748,13314.2
7,CUTLASS,gemm,cutlass_tensorop_f16_s884gemm_f16_256x128_32x2_nt_align8,passed,success,universal,8192,128,128,f16:column,f16:row,f16:column,f16:column,1,0,serial,1,1,heuristic,invalid,invalid,false,false,1,tensorop,f32,256,128,32,1,1,1,0,0,0,2,4,2,1,16,16,4,70,75,4227072,270532608,64,0.020168,195.199,13414
7,CUTLASS,gemm,cutlass_tensorop_f16_s884gemm_f16_256x128_32x2_tn_align8,passed,success,universal,8192,128,128,f16:row,f16:column,f16:column,f16:column,1,0,serial,1,1,heuristic,invalid,invalid,false,false,1,tensorop,f32,256,128,32,1,1,1,0,0,0,2,4,2,1,16,16,4,70,75,4227072,270532608,64,0.020129,195.577,13440
7,CUTLASS,gemm,cutlass_tensorop_f16_s884gemm_f16_256x128_32x2_tt_align8,passed,success,universal,8192,128,128,f16:row,f16:row,f16:column,f16:column,1,0,serial,1,1,heuristic,invalid,invalid,false,false,1,tensorop,f32,256,128,32,1,1,1,0,0,0,2,4,2,1,16,16,4,70,75,4227072,270532608,64,0.020176,195.121,13408.6
8,CUTLASS,gemm,cutlass_tensorop_s884gemm_f16_256x128_32x2_nn_align8,passed,success,universal,128,256,128,f16:column,f16:column,f32:column,f32:column,1,0,serial,1,1,heuristic,invalid,invalid,false,false,1,tensorop,f32,256,128,32,1,1,1,0,0,0,2,4,2,1,16,16,4,70,75,229376,8454144,36,0.0192445,11.1005,439.302
8,CUTLASS,gemm,cutlass_tensorop_s884gemm_f16_256x128_32x2_nt_align8,passed,success,universal,128,256,128,f16:column,f16:row,f32:column,f32:column,1,0,serial,1,1,heuristic,invalid,invalid,false,false,1,tensorop,f32,256,128,32,1,1,1,0,0,0,2,4,2,1,16,16,4,70,75,229376,8454144,36,0.0192448,11.1003,439.295
8,CUTLASS,gemm,cutlass_tensorop_s884gemm_f16_256x128_32x2_tn_align8,passed,success,universal,128,256,128,f16:row,f16:column,f32:column,f32:column,1,0,serial,1,1,heuristic,invalid,invalid,false,false,1,tensorop,f32,256,128,32,1,1,1,0,0,0,2,4,2,1,16,16,4,70,75,229376,8454144,36,0.0193747,11.0259,436.349
8,CUTLASS,gemm,cutlass_tensorop_s884gemm_f16_256x128_32x2_tt_align8,passed,success,universal,128,256,128,f16:row,f16:row,f32:column,f32:column,1,0,serial,1,1,heuristic,invalid,invalid,false,false,1,tensorop,f32,256,128,32,1,1,1,0,0,0,2,4,2,1,16,16,4,70,75,229376,8454144,36,0.0193219,11.056,437.542
8,CUTLASS,gemm,cutlass_tensorop_f16_s884gemm_f16_256x128_32x2_nn_align8,passed,success,universal,128,256,128,f16:column,f16:column,f16:column,f16:column,1,0,serial,1,1,heuristic,invalid,invalid,false,false,1,tensorop,f32,256,128,32,1,1,1,0,0,0,2,4,2,1,16,16,4,70,75,163840,8454144,51,0.0193533,7.88434,436.833
8,CUTLASS,gemm,cutlass_tensorop_f16_s884gemm_f16_256x128_32x2_nt_align8,passed,success,universal,128,256,128,f16:column,f16:row,f16:column,f16:column,1,0,serial,1,1,heuristic,invalid,invalid,false,false,1,tensorop,f32,256,128,32,1,1,1,0,0,0,2,4,2,1,16,16,4,70,75,163840,8454144,51,0.0193398,7.88982,437.136
8,CUTLASS,gemm,cutlass_tensorop_f16_s884gemm_f16_256x128_32x2_tn_align8,passed,success,universal,128,256,128,f16:row,f16:column,f16:column,f16:column,1,0,serial,1,1,heuristic,invalid,invalid,false,false,1,tensorop,f32,256,128,32,1,1,1,0,0,0,2,4,2,1,16,16,4,70,75,163840,8454144,51,0.0193904,7.86925,435.996
8,CUTLASS,gemm,cutlass_tensorop_f16_s884gemm_f16_256x128_32x2_tt_align8,passed,success,universal,128,256,128,f16:row,f16:row,f16:column,f16:column,1,0,serial,1,1,heuristic,invalid,invalid,false,false,1,tensorop,f32,256,128,32,1,1,1,0,0,0,2,4,2,1,16,16,4,70,75,163840,8454144,51,0.0194125,7.8603,435.5
9,CUTLASS,gemm,cutlass_tensorop_s884gemm_f16_256x128_32x2_nn_align8,passed,success,universal,256,256,128,f16:column,f16:column,f32:column,f32:column,1,0,serial,1,1,heuristic,invalid,invalid,false,false,1,tensorop,f32,256,128,32,1,1,1,0,0,0,2,4,2,1,16,16,4,70,75,393216,16908288,43,0.0192944,18.9802,876.331
9,CUTLASS,gemm,cutlass_tensorop_s884gemm_f16_256x128_32x2_nt_align8,passed,success,universal,256,256,128,f16:column,f16:row,f32:column,f32:column,1,0,serial,1,1,heuristic,invalid,invalid,false,false,1,tensorop,f32,256,128,32,1,1,1,0,0,0,2,4,2,1,16,16,4,70,75,393216,16908288,43,0.0192314,19.0424,879.204
9,CUTLASS,gemm,cutlass_tensorop_s884gemm_f16_256x128_32x2_tn_align8,passed,success,universal,256,256,128,f16:row,f16:column,f32:column,f32:column,1,0,serial,1,1,heuristic,invalid,invalid,false,false,1,tensorop,f32,256,128,32,1,1,1,0,0,0,2,4,2,1,16,16,4,70,75,393216,16908288,43,0.0194035,18.8734,871.403
9,CUTLASS,gemm,cutlass_tensorop_s884gemm_f16_256x128_32x2_tt_align8,passed,success,universal,256,256,128,f16:row,f16:row,f32:column,f32:column,1,0,serial,1,1,heuristic,invalid,invalid,false,false,1,tensorop,f32,256,128,32,1,1,1,0,0,0,2,4,2,1,16,16,4,70,75,393216,16908288,43,0.0193312,18.944,874.663
9,CUTLASS,gemm,cutlass_tensorop_f16_s884gemm_f16_256x128_32x2_nn_align8,passed,success,universal,256,256,128,f16:column,f16:column,f16:column,f16:column,1,0,serial,1,1,heuristic,invalid,invalid,false,false,1,tensorop,f32,256,128,32,1,1,1,0,0,0,2,4,2,1,16,16,4,70,75,262144,16908288,64,0.0193168,12.6388,875.315
9,CUTLASS,gemm,cutlass_tensorop_f16_s884gemm_f16_256x128_32x2_nt_align8,passed,success,universal,256,256,128,f16:column,f16:row,f16:column,f16:column,1,0,serial,1,1,heuristic,invalid,invalid,false,false,1,tensorop,f32,256,128,32,1,1,1,0,0,0,2,4,2,1,16,16,4,70,75,262144,16908288,64,0.019367,12.606,873.044
9,CUTLASS,gemm,cutlass_tensorop_f16_s884gemm_f16_256x128_32x2_tn_align8,passed,success,universal,256,256,128,f16:row,f16:column,f16:column,f16:column,1,0,serial,1,1,heuristic,invalid,invalid,false,false,1,tensorop,f32,256,128,32,1,1,1,0,0,0,2,4,2,1,16,16,4,70,75,262144,16908288,64,0.0195795,12.4692,863.57
9,CUTLASS,gemm,cutlass_tensorop_f16_s884gemm_f16_256x128_32x2_tt_align8,passed,success,universal,256,256,128,f16:row,f16:row,f16:column,f16:column,1,0,serial,1,1,heuristic,invalid,invalid,false,false,1,tensorop,f32,256,128,32,1,1,1,0,0,0,2,4,2,1,16,16,4,70,75,262144,16908288,64,0.0194134,12.5759,870.958
10,CUTLASS,gemm,cutlass_tensorop_s884gemm_f16_256x128_32x2_nn_align8,passed,success,universal,512,256,128,f16:column,f16:column,f32:column,f32:column,1,0,serial,1,1,heuristic,invalid,invalid,false,false,1,tensorop,f32,256,128,32,1,1,1,0,0,0,2,4,2,1,16,16,4,70,75,720896,33816576,46,0.0192301,34.9134,1758.53
10,CUTLASS,gemm,cutlass_tensorop_s884gemm_f16_256x128_32x2_nt_align8,passed,success,universal,512,256,128,f16:column,f16:row,f32:column,f32:column,1,0,serial,1,1,heuristic,invalid,invalid,false,false,1,tensorop,f32,256,128,32,1,1,1,0,0,0,2,4,2,1,16,16,4,70,75,720896,33816576,46,0.0192464,34.8838,1757.03
10,CUTLASS,gemm,cutlass_tensorop_s884gemm_f16_256x128_32x2_tn_align8,passed,success,universal,512,256,128,f16:row,f16:column,f32:column,f32:column,1,0,serial,1,1,heuristic,invalid,invalid,false,false,1,tensorop,f32,256,128,32,1,1,1,0,0,0,2,4,2,1,16,16,4,70,75,720896,33816576,46,0.0194858,34.4552,1735.45
10,CUTLASS,gemm,cutlass_tensorop_s884gemm_f16_256x128_32x2_tt_align8,passed,success,universal,512,256,128,f16:row,f16:row,f32:column,f32:column,1,0,serial,1,1,heuristic,invalid,invalid,false,false,1,tensorop,f32,256,128,32,1,1,1,0,0,0,2,4,2,1,16,16,4,70,75,720896,33816576,46,0.0193606,34.6779,1746.67
10,CUTLASS,gemm,cutlass_tensorop_f16_s884gemm_f16_256x128_32x2_nn_align8,passed,success,universal,512,256,128,f16:column,f16:column,f16:column,f16:column,1,0,serial,1,1,heuristic,invalid,invalid,false,false,1,tensorop,f32,256,128,32,1,1,1,0,0,0,2,4,2,1,16,16,4,70,75,458752,33816576,73,0.019287,22.152,1753.33
10,CUTLASS,gemm,cutlass_tensorop_f16_s884gemm_f16_256x128_32x2_nt_align8,passed,success,universal,512,256,128,f16:column,f16:row,f16:column,f16:column,1,0,serial,1,1,heuristic,invalid,invalid,false,false,1,tensorop,f32,256,128,32,1,1,1,0,0,0,2,4,2,1,16,16,4,70,75,458752,33816576,73,0.0193299,22.1028,1749.44
10,CUTLASS,gemm,cutlass_tensorop_f16_s884gemm_f16_256x128_32x2_tn_align8,passed,success,universal,512,256,128,f16:row,f16:column,f16:column,f16:column,1,0,serial,1,1,heuristic,invalid,invalid,false,false,1,tensorop,f32,256,128,32,1,1,1,0,0,0,2,4,2,1,16,16,4,70,75,458752,33816576,73,0.0195792,21.8214,1727.17
10,CUTLASS,gemm,cutlass_tensorop_f16_s884gemm_f16_256x128_32x2_tt_align8,passed,success,universal,512,256,128,f16:row,f16:row,f16:column,f16:column,1,0,serial,1,1,heuristic,invalid,invalid,false,false,1,tensorop,f32,256,128,32,1,1,1,0,0,0,2,4,2,1,16,16,4,70,75,458752,33816576,73,0.0194,22.023,1743.12
11,CUTLASS,gemm,cutlass_tensorop_s884gemm_f16_256x128_32x2_nn_align8,passed,success,universal,1024,256,128,f16:column,f16:column,f32:column,f32:column,1,0,serial,1,1,heuristic,invalid,invalid,false,false,1,tensorop,f32,256,128,32,1,1,1,0,0,0,2,4,2,1,16,16,4,70,75,1376256,67633152,49,0.019233,66.6428,3516.52
11,CUTLASS,gemm,cutlass_tensorop_s884gemm_f16_256x128_32x2_nt_align8,passed,success,universal,1024,256,128,f16:column,f16:row,f32:column,f32:column,1,0,serial,1,1,heuristic,invalid,invalid,false,false,1,tensorop,f32,256,128,32,1,1,1,0,0,0,2,4,2,1,16,16,4,70,75,1376256,67633152,49,0.0193226,66.3338,3500.22
11,CUTLASS,gemm,cutlass_tensorop_s884gemm_f16_256x128_32x2_tn_align8,passed,success,universal,1024,256,128,f16:row,f16:column,f32:column,f32:column,1,0,serial,1,1,heuristic,invalid,invalid,false,false,1,tensorop,f32,256,128,32,1,1,1,0,0,0,2,4,2,1,16,16,4,70,75,1376256,67633152,49,0.0196938,65.0835,3434.24
11,CUTLASS,gemm,cutlass_tensorop_s884gemm_f16_256x128_32x2_tt_align8,passed,success,universal,1024,256,128,f16:row,f16:row,f32:column,f32:column,1,0,serial,1,1,heuristic,invalid,invalid,false,false,1,tensorop,f32,256,128,32,1,1,1,0,0,0,2,4,2,1,16,16,4,70,75,1376256,67633152,49,0.0194755,65.8128,3472.73
11,CUTLASS,gemm,cutlass_tensorop_f16_s884gemm_f16_256x128_32x2_nn_align8,passed,success,universal,1024,256,128,f16:column,f16:column,f16:column,f16:column,1,0,serial,1,1,heuristic,invalid,invalid,false,false,1,tensorop,f32,256,128,32,1,1,1,0,0,0,2,4,2,1,16,16,4,70,75,851968,67633152,79,0.0194074,40.8843,3484.92
11,CUTLASS,gemm,cutlass_tensorop_f16_s884gemm_f16_256x128_32x2_nt_align8,passed,success,universal,1024,256,128,f16:column,f16:row,f16:column,f16:column,1,0,serial,1,1,heuristic,invalid,invalid,false,false,1,tensorop,f32,256,128,32,1,1,1,0,0,0,2,4,2,1,16,16,4,70,75,851968,67633152,79,0.0194096,40.8796,3484.52
11,CUTLASS,gemm,cutlass_tensorop_f16_s884gemm_f16_256x128_32x2_tn_align8,passed,success,universal,1024,256,128,f16:row,f16:column,f16:column,f16:column,1,0,serial,1,1,heuristic,invalid,invalid,false,false,1,tensorop,f32,256,128,32,1,1,1,0,0,0,2,4,2,1,16,16,4,70,75,851968,67633152,79,0.0198067,40.06,3414.66
11,CUTLASS,gemm,cutlass_tensorop_f16_s884gemm_f16_256x128_32x2_tt_align8,passed,success,universal,1024,256,128,f16:row,f16:row,f16:column,f16:column,1,0,serial,1,1,heuristic,invalid,invalid,false,false,1,tensorop,f32,256,128,32,1,1,1,0,0,0,2,4,2,1,16,16,4,70,75,851968,67633152,79,0.0196243,40.4323,3446.39
12,CUTLASS,gemm,cutlass_tensorop_s884gemm_f16_256x128_32x2_nn_align8,passed,success,universal,2048,256,128,f16:column,f16:column,f32:column,f32:column,1,0,serial,1,1,heuristic,invalid,invalid,false,false,1,tensorop,f32,256,128,32,1,1,1,0,0,0,2,4,2,1,16,16,4,70,75,2686976,135266304,50,0.0194464,128.684,6955.85
12,CUTLASS,gemm,cutlass_tensorop_s884gemm_f16_256x128_32x2_nt_align8,passed,success,universal,2048,256,128,f16:column,f16:row,f32:column,f32:column,1,0,serial,1,1,heuristic,invalid,invalid,false,false,1,tensorop,f32,256,128,32,1,1,1,0,0,0,2,4,2,1,16,16,4,70,75,2686976,135266304,50,0.0193942,129.03,6974.56
12,CUTLASS,gemm,cutlass_tensorop_s884gemm_f16_256x128_32x2_tn_align8,passed,success,universal,2048,256,128,f16:row,f16:column,f32:column,f32:column,1,0,serial,1,1,heuristic,invalid,invalid,false,false,1,tensorop,f32,256,128,32,1,1,1,0,0,0,2,4,2,1,16,16,4,70,75,2686976,135266304,50,0.019752,126.693,6848.23
12,CUTLASS,gemm,cutlass_tensorop_s884gemm_f16_256x128_32x2_tt_align8,passed,success,universal,2048,256,128,f16:row,f16:row,f32:column,f32:column,1,0,serial,1,1,heuristic,invalid,invalid,false,false,1,tensorop,f32,256,128,32,1,1,1,0,0,0,2,4,2,1,16,16,4,70,75,2686976,135266304,50,0.0196269,127.501,6891.89
12,CUTLASS,gemm,cutlass_tensorop_f16_s884gemm_f16_256x128_32x2_nn_align8,passed,success,universal,2048,256,128,f16:column,f16:column,f16:column,f16:column,1,0,serial,1,1,heuristic,invalid,invalid,false,false,1,tensorop,f32,256,128,32,1,1,1,0,0,0,2,4,2,1,16,16,4,70,75,1638400,135266304,82,0.0194739,78.355,6946.02
12,CUTLASS,gemm,cutlass_tensorop_f16_s884gemm_f16_256x128_32x2_nt_align8,passed,success,universal,2048,256,128,f16:column,f16:row,f16:column,f16:column,1,0,serial,1,1,heuristic,invalid,invalid,false,false,1,tensorop,f32,256,128,32,1,1,1,0,0,0,2,4,2,1,16,16,4,70,75,1638400,135266304,82,0.0195699,77.9706,6911.95
12,CUTLASS,gemm,cutlass_tensorop_f16_s884gemm_f16_256x128_32x2_tn_align8,passed,success,universal,2048,256,128,f16:row,f16:column,f16:column,f16:column,1,0,serial,1,1,heuristic,invalid,invalid,false,false,1,tensorop,f32,256,128,32,1,1,1,0,0,0,2,4,2,1,16,16,4,70,75,1638400,135266304,82,0.0199744,76.3917,6771.98
12,CUTLASS,gemm,cutlass_tensorop_f16_s884gemm_f16_256x128_32x2_tt_align8,passed,success,universal,2048,256,128,f16:row,f16:row,f16:column,f16:column,1,0,serial,1,1,heuristic,invalid,invalid,false,false,1,tensorop,f32,256,128,32,1,1,1,0,0,0,2,4,2,1,16,16,4,70,75,1638400,135266304,82,0.0197197,77.3785,6859.46
13,CUTLASS,gemm,cutlass_tensorop_s884gemm_f16_256x128_32x2_nn_align8,passed,success,universal,4096,256,128,f16:column,f16:column,f32:column,f32:column,1,0,serial,1,1,heuristic,invalid,invalid,false,false,1,tensorop,f32,256,128,32,1,1,1,0,0,0,2,4,2,1,16,16,4,70,75,5308416,270532608,50,0.019711,250.816,13724.9
13,CUTLASS,gemm,cutlass_tensorop_s884gemm_f16_256x128_32x2_nt_align8,passed,success,universal,4096,256,128,f16:column,f16:row,f32:column,f32:column,1,0,serial,1,1,heuristic,invalid,invalid,false,false,1,tensorop,f32,256,128,32,1,1,1,0,0,0,2,4,2,1,16,16,4,70,75,5308416,270532608,50,0.0198394,249.194,13636.2
13,CUTLASS,gemm,cutlass_tensorop_s884gemm_f16_256x128_32x2_tn_align8,passed,success,universal,4096,256,128,f16:row,f16:column,f32:column,f32:column,1,0,serial,1,1,heuristic,invalid,invalid,false,false,1,tensorop,f32,256,128,32,1,1,1,0,0,0,2,4,2,1,16,16,4,70,75,5308416,270532608,50,0.0200714,246.314,13478.5
13,CUTLASS,gemm,cutlass_tensorop_s884gemm_f16_256x128_32x2_tt_align8,passed,success,universal,4096,256,128,f16:row,f16:row,f32:column,f32:column,1,0,serial,1,1,heuristic,invalid,invalid,false,false,1,tensorop,f32,256,128,32,1,1,1,0,0,0,2,4,2,1,16,16,4,70,75,5308416,270532608,50,0.0200426,246.667,13497.9
13,CUTLASS,gemm,cutlass_tensorop_f16_s884gemm_f16_256x128_32x2_nn_align8,passed,success,universal,4096,256,128,f16:column,f16:column,f16:column,f16:column,1,0,serial,1,1,heuristic,invalid,invalid,false,false,1,tensorop,f32,256,128,32,1,1,1,0,0,0,2,4,2,1,16,16,4,70,75,3211264,270532608,84,0.0197565,151.379,13693.4
13,CUTLASS,gemm,cutlass_tensorop_f16_s884gemm_f16_256x128_32x2_nt_align8,passed,success,universal,4096,256,128,f16:column,f16:row,f16:column,f16:column,1,0,serial,1,1,heuristic,invalid,invalid,false,false,1,tensorop,f32,256,128,32,1,1,1,0,0,0,2,4,2,1,16,16,4,70,75,3211264,270532608,84,0.019927,150.084,13576.2
13,CUTLASS,gemm,cutlass_tensorop_f16_s884gemm_f16_256x128_32x2_tn_align8,passed,success,universal,4096,256,128,f16:row,f16:column,f16:column,f16:column,1,0,serial,1,1,heuristic,invalid,invalid,false,false,1,tensorop,f32,256,128,32,1,1,1,0,0,0,2,4,2,1,16,16,4,70,75,3211264,270532608,84,0.0201517,148.411,13424.8
13,CUTLASS,gemm,cutlass_tensorop_f16_s884gemm_f16_256x128_32x2_tt_align8,passed,success,universal,4096,256,128,f16:row,f16:row,f16:column,f16:column,1,0,serial,1,1,heuristic,invalid,invalid,false,false,1,tensorop,f32,256,128,32,1,1,1,0,0,0,2,4,2,1,16,16,4,70,75,3211264,270532608,84,0.0201219,148.63,13444.7
14,CUTLASS,gemm,cutlass_tensorop_s884gemm_f16_256x128_32x2_nn_align8,passed,success,universal,8192,256,128,f16:column,f16:column,f32:column,f32:column,1,0,serial,1,1,heuristic,invalid,invalid,false,false,1,tensorop,f32,256,128,32,1,1,1,0,0,0,2,4,2,1,16,16,4,70,75,10551296,541065216,51,0.0233466,420.904,23175.4
14,CUTLASS,gemm,cutlass_tensorop_s884gemm_f16_256x128_32x2_nt_align8,passed,success,universal,8192,256,128,f16:column,f16:row,f32:column,f32:column,1,0,serial,1,1,heuristic,invalid,invalid,false,false,1,tensorop,f32,256,128,32,1,1,1,0,0,0,2,4,2,1,16,16,4,70,75,10551296,541065216,51,0.0234803,418.506,23043.3
14,CUTLASS,gemm,cutlass_tensorop_s884gemm_f16_256x128_32x2_tn_align8,passed,success,universal,8192,256,128,f16:row,f16:column,f32:column,f32:column,1,0,serial,1,1,heuristic,invalid,invalid,false,false,1,tensorop,f32,256,128,32,1,1,1,0,0,0,2,4,2,1,16,16,4,70,75,10551296,541065216,51,0.0237558,413.652,22776.1
14,CUTLASS,gemm,cutlass_tensorop_s884gemm_f16_256x128_32x2_tt_align8,passed,success,universal,8192,256,128,f16:row,f16:row,f32:column,f32:column,1,0,serial,1,1,heuristic,invalid,invalid,false,false,1,tensorop,f32,256,128,32,1,1,1,0,0,0,2,4,2,1,16,16,4,70,75,10551296,541065216,51,0.0234819,418.478,23041.8
14,CUTLASS,gemm,cutlass_tensorop_f16_s884gemm_f16_256x128_32x2_nn_align8,passed,success,universal,8192,256,128,f16:column,f16:column,f16:column,f16:column,1,0,serial,1,1,heuristic,invalid,invalid,false,false,1,tensorop,f32,256,128,32,1,1,1,0,0,0,2,4,2,1,16,16,4,70,75,6356992,541065216,85,0.0217914,271.686,24829.3
14,CUTLASS,gemm,cutlass_tensorop_f16_s884gemm_f16_256x128_32x2_nt_align8,passed,success,universal,8192,256,128,f16:column,f16:row,f16:column,f16:column,1,0,serial,1,1,heuristic,invalid,invalid,false,false,1,tensorop,f32,256,128,32,1,1,1,0,0,0,2,4,2,1,16,16,4,70,75,6356992,541065216,85,0.0218378,271.109,24776.6
14,CUTLASS,gemm,cutlass_tensorop_f16_s884gemm_f16_256x128_32x2_tn_align8,passed,success,universal,8192,256,128,f16:row,f16:column,f16:column,f16:column,1,0,serial,1,1,heuristic,invalid,invalid,false,false,1,tensorop,f32,256,128,32,1,1,1,0,0,0,2,4,2,1,16,16,4,70,75,6356992,541065216,85,0.0218282,271.228,24787.5
14,CUTLASS,gemm,cutlass_tensorop_f16_s884gemm_f16_256x128_32x2_tt_align8,passed,success,universal,8192,256,128,f16:row,f16:row,f16:column,f16:column,1,0,serial,1,1,heuristic,invalid,invalid,false,false,1,tensorop,f32,256,128,32,1,1,1,0,0,0,2,4,2,1,16,16,4,70,75,6356992,541065216,85,0.0216902,272.953,24945.1
15,CUTLASS,gemm,cutlass_tensorop_s884gemm_f16_256x128_32x2_nn_align8,passed,success,universal,128,512,128,f16:column,f16:column,f32:column,f32:column,1,0,serial,1,1,heuristic,invalid,invalid,false,false,1,tensorop,f32,256,128,32,1,1,1,0,0,0,2,4,2,1,16,16,4,70,75,425984,16908288,39,0.0192685,20.5895,877.51
15,CUTLASS,gemm,cutlass_tensorop_s884gemm_f16_256x128_32x2_nt_align8,passed,success,universal,128,512,128,f16:column,f16:row,f32:column,f32:column,1,0,serial,1,1,heuristic,invalid,invalid,false,false,1,tensorop,f32,256,128,32,1,1,1,0,0,0,2,4,2,1,16,16,4,70,75,425984,16908288,39,0.0193856,20.4651,872.209
15,CUTLASS,gemm,cutlass_tensorop_s884gemm_f16_256x128_32x2_tn_align8,passed,success,universal,128,512,128,f16:row,f16:column,f32:column,f32:column,1,0,serial,1,1,heuristic,invalid,invalid,false,false,1,tensorop,f32,256,128,32,1,1,1,0,0,0,2,4,2,1,16,16,4,70,75,425984,16908288,39,0.019511,20.3335,866.601
15,CUTLASS,gemm,cutlass_tensorop_s884gemm_f16_256x128_32x2_tt_align8,passed,success,universal,128,512,128,f16:row,f16:row,f32:column,f32:column,1,0,serial,1,1,heuristic,invalid,invalid,false,false,1,tensorop,f32,256,128,32,1,1,1,0,0,0,2,4,2,1,16,16,4,70,75,425984,16908288,39,0.0194685,20.378,868.496
15,CUTLASS,gemm,cutlass_tensorop_f16_s884gemm_f16_256x128_32x2_nn_align8,passed,success,universal,128,512,128,f16:column,f16:column,f16:column,f16:column,1,0,serial,1,1,heuristic,invalid,invalid,false,false,1,tensorop,f32,256,128,32,1,1,1,0,0,0,2,4,2,1,16,16,4,70,75,294912,16908288,57,0.0193978,14.1593,871.662
15,CUTLASS,gemm,cutlass_tensorop_f16_s884gemm_f16_256x128_32x2_nt_align8,passed,success,universal,128,512,128,f16:column,f16:row,f16:column,f16:column,1,0,serial,1,1,heuristic,invalid,invalid,false,false,1,tensorop,f32,256,128,32,1,1,1,0,0,0,2,4,2,1,16,16,4,70,75,294912,16908288,57,0.0193635,14.1843,873.203
15,CUTLASS,gemm,cutlass_tensorop_f16_s884gemm_f16_256x128_32x2_tn_align8,passed,success,universal,128,512,128,f16:row,f16:column,f16:column,f16:column,1,0,serial,1,1,heuristic,invalid,invalid,false,false,1,tensorop,f32,256,128,32,1,1,1,0,0,0,2,4,2,1,16,16,4,70,75,294912,16908288,57,0.0195837,14.0249,863.387
15,CUTLASS,gemm,cutlass_tensorop_f16_s884gemm_f16_256x128_32x2_tt_align8,passed,success,universal,128,512,128,f16:row,f16:row,f16:column,f16:column,1,0,serial,1,1,heuristic,invalid,invalid,false,false,1,tensorop,f32,256,128,32,1,1,1,0,0,0,2,4,2,1,16,16,4,70,75,294912,16908288,57,0.0194957,14.0882,867.284
16,CUTLASS,gemm,cutlass_tensorop_s884gemm_f16_256x128_32x2_nn_align8,passed,success,universal,256,512,128,f16:column,f16:column,f32:column,f32:column,1,0,serial,1,1,heuristic,invalid,invalid,false,false,1,tensorop,f32,256,128,32,1,1,1,0,0,0,2,4,2,1,16,16,4,70,75,720896,33816576,46,0.0193414,34.7123,1748.4
16,CUTLASS,gemm,cutlass_tensorop_s884gemm_f16_256x128_32x2_nt_align8,passed,success,universal,256,512,128,f16:column,f16:row,f32:column,f32:column,1,0,serial,1,1,heuristic,invalid,invalid,false,false,1,tensorop,f32,256,128,32,1,1,1,0,0,0,2,4,2,1,16,16,4,70,75,720896,33816576,46,0.0193734,34.655,1745.51
16,CUTLASS,gemm,cutlass_tensorop_s884gemm_f16_256x128_32x2_tn_align8,passed,success,universal,256,512,128,f16:row,f16:column,f32:column,f32:column,1,0,serial,1,1,heuristic,invalid,invalid,false,false,1,tensorop,f32,256,128,32,1,1,1,0,0,0,2,4,2,1,16,16,4,70,75,720896,33816576,46,0.0196038,34.2477,1725
16,CUTLASS,gemm,cutlass_tensorop_s884gemm_f16_256x128_32x2_tt_align8,passed,success,universal,256,512,128,f16:row,f16:row,f32:column,f32:column,1,0,serial,1,1,heuristic,invalid,invalid,false,false,1,tensorop,f32,256,128,32,1,1,1,0,0,0,2,4,2,1,16,16,4,70,75,720896,33816576,46,0.0195664,34.3132,1728.3
16,CUTLASS,gemm,cutlass_tensorop_f16_s884gemm_f16_256x128_32x2_nn_align8,passed,success,universal,256,512,128,f16:column,f16:column,f16:column,f16:column,1,0,serial,1,1,heuristic,invalid,invalid,false,false,1,tensorop,f32,256,128,32,1,1,1,0,0,0,2,4,2,1,16,16,4,70,75,458752,33816576,73,0.0194378,21.9802,1739.74
16,CUTLASS,gemm,cutlass_tensorop_f16_s884gemm_f16_256x128_32x2_nt_align8,passed,success,universal,256,512,128,f16:column,f16:row,f16:column,f16:column,1,0,serial,1,1,heuristic,invalid,invalid,false,false,1,tensorop,f32,256,128,32,1,1,1,0,0,0,2,4,2,1,16,16,4,70,75,458752,33816576,73,0.0193792,22.0466,1744.99
16,CUTLASS,gemm,cutlass_tensorop_f16_s884gemm_f16_256x128_32x2_tn_align8,passed,success,universal,256,512,128,f16:row,f16:column,f16:column,f16:column,1,0,serial,1,1,heuristic,invalid,invalid,false,false,1,tensorop,f32,256,128,32,1,1,1,0,0,0,2,4,2,1,16,16,4,70,75,458752,33816576,73,0.0197114,21.6751,1715.59
16,CUTLASS,gemm,cutlass_tensorop_f16_s884gemm_f16_256x128_32x2_tt_align8,passed,success,universal,256,512,128,f16:row,f16:row,f16:column,f16:column,1,0,serial,1,1,heuristic,invalid,invalid,false,false,1,tensorop,f32,256,128,32,1,1,1,0,0,0,2,4,2,1,16,16,4,70,75,458752,33816576,73,0.0195565,21.8468,1729.18
17,CUTLASS,gemm,cutlass_tensorop_s884gemm_f16_256x128_32x2_nn_align8,passed,success,universal,512,512,128,f16:column,f16:column,f32:column,f32:column,1,0,serial,1,1,heuristic,invalid,invalid,false,false,1,tensorop,f32,256,128,32,1,1,1,0,0,0,2,4,2,1,16,16,4,70,75,1310720,67633152,51,0.0192982,63.2546,3504.63
17,CUTLASS,gemm,cutlass_tensorop_s884gemm_f16_256x128_32x2_nt_align8,passed,success,universal,512,512,128,f16:column,f16:row,f32:column,f32:column,1,0,serial,1,1,heuristic,invalid,invalid,false,false,1,tensorop,f32,256,128,32,1,1,1,0,0,0,2,4,2,1,16,16,4,70,75,1310720,67633152,51,0.0193306,63.1489,3498.77
17,CUTLASS,gemm,cutlass_tensorop_s884gemm_f16_256x128_32x2_tn_align8,passed,success,universal,512,512,128,f16:row,f16:column,f32:column,f32:column,1,0,serial,1,1,heuristic,invalid,invalid,false,false,1,tensorop,f32,256,128,32,1,1,1,0,0,0,2,4,2,1,16,16,4,70,75,1310720,67633152,51,0.0195683,62.3816,3456.26
17,CUTLASS,gemm,cutlass_tensorop_s884gemm_f16_256x128_32x2_tt_align8,passed,success,universal,512,512,128,f16:row,f16:row,f32:column,f32:column,1,0,serial,1,1,heuristic,invalid,invalid,false,false,1,tensorop,f32,256,128,32,1,1,1,0,0,0,2,4,2,1,16,16,4,70,75,1310720,67633152,51,0.0194038,62.9104,3485.55
17,CUTLASS,gemm,cutlass_tensorop_f16_s884gemm_f16_256x128_32x2_nn_align8,passed,success,universal,512,512,128,f16:column,f16:column,f16:column,f16:column,1,0,serial,1,1,heuristic,invalid,invalid,false,false,1,tensorop,f32,256,128,32,1,1,1,0,0,0,2,4,2,1,16,16,4,70,75,786432,67633152,86,0.019344,37.863,3496.34
17,CUTLASS,gemm,cutlass_tensorop_f16_s884gemm_f16_256x128_32x2_nt_align8,passed,success,universal,512,512,128,f16:column,f16:row,f16:column,f16:column,1,0,serial,1,1,heuristic,invalid,invalid,false,false,1,tensorop,f32,256,128,32,1,1,1,0,0,0,2,4,2,1,16,16,4,70,75,786432,67633152,86,0.0193891,37.7749,3488.2
17,CUTLASS,gemm,cutlass_tensorop_f16_s884gemm_f16_256x128_32x2_tn_align8,passed,success,universal,512,512,128,f16:row,f16:column,f16:column,f16:column,1,0,serial,1,1,heuristic,invalid,invalid,false,false,1,tensorop,f32,256,128,32,1,1,1,0,0,0,2,4,2,1,16,16,4,70,75,786432,67633152,86,0.0197405,37.1025,3426.11
17,CUTLASS,gemm,cutlass_tensorop_f16_s884gemm_f16_256x128_32x2_tt_align8,passed,success,universal,512,512,128,f16:row,f16:row,f16:column,f16:column,1,0,serial,1,1,heuristic,invalid,invalid,false,false,1,tensorop,f32,256,128,32,1,1,1,0,0,0,2,4,2,1,16,16,4,70,75,786432,67633152,86,0.0195261,37.5099,3463.73
18,CUTLASS,gemm,cutlass_tensorop_s884gemm_f16_256x128_32x2_nn_align8,passed,success,universal,1024,512,128,f16:column,f16:column,f32:column,f32:column,1,0,serial,1,1,heuristic,invalid,invalid,false,false,1,tensorop,f32,256,128,32,1,1,1,0,0,0,2,4,2,1,16,16,4,70,75,2490368,135266304,54,0.0193536,119.84,6989.21
18,CUTLASS,gemm,cutlass_tensorop_s884gemm_f16_256x128_32x2_nt_align8,passed,success,universal,1024,512,128,f16:column,f16:row,f32:column,f32:column,1,0,serial,1,1,heuristic,invalid,invalid,false,false,1,tensorop,f32,256,128,32,1,1,1,0,0,0,2,4,2,1,16,16,4,70,75,2490368,135266304,54,0.0193437,119.901,6992.79
18,CUTLASS,gemm,cutlass_tensorop_s884gemm_f16_256x128_32x2_tn_align8,passed,success,universal,1024,512,128,f16:row,f16:column,f32:column,f32:column,1,0,serial,1,1,heuristic,invalid,invalid,false,false,1,tensorop,f32,256,128,32,1,1,1,0,0,0,2,4,2,1,16,16,4,70,75,2490368,135266304,54,0.0196854,117.82,6871.39
18,CUTLASS,gemm,cutlass_tensorop_s884gemm_f16_256x128_32x2_tt_align8,passed,success,universal,1024,512,128,f16:row,f16:row,f32:column,f32:column,1,0,serial,1,1,heuristic,invalid,invalid,false,false,1,tensorop,f32,256,128,32,1,1,1,0,0,0,2,4,2,1,16,16,4,70,75,2490368,135266304,54,0.0194499,119.247,6954.59
18,CUTLASS,gemm,cutlass_tensorop_f16_s884gemm_f16_256x128_32x2_nn_align8,passed,success,universal,1024,512,128,f16:column,f16:column,f16:column,f16:column,1,0,serial,1,1,heuristic,invalid,invalid,false,false,1,tensorop,f32,256,128,32,1,1,1,0,0,0,2,4,2,1,16,16,4,70,75,1441792,135266304,93,0.0194349,69.0909,6959.98
18,CUTLASS,gemm,cutlass_tensorop_f16_s884gemm_f16_256x128_32x2_nt_align8,passed,success,universal,1024,512,128,f16:column,f16:row,f16:column,f16:column,1,0,serial,1,1,heuristic,invalid,invalid,false,false,1,tensorop,f32,256,128,32,1,1,1,0,0,0,2,4,2,1,16,16,4,70,75,1441792,135266304,93,0.0194413,69.0682,6957.68
18,CUTLASS,gemm,cutlass_tensorop_f16_s884gemm_f16_256x128_32x2_tn_align8,passed,success,universal,1024,512,128,f16:row,f16:column,f16:column,f16:column,1,0,serial,1,1,heuristic,invalid,invalid,false,false,1,tensorop,f32,256,128,32,1,1,1,0,0,0,2,4,2,1,16,16,4,70,75,1441792,135266304,93,0.0198579,67.619,6811.71
18,CUTLASS,gemm,cutlass_tensorop_f16_s884gemm_f16_256x128_32x2_tt_align8,passed,success,universal,1024,512,128,f16:row,f16:row,f16:column,f16:column,1,0,serial,1,1,heuristic,invalid,invalid,false,false,1,tensorop,f32,256,128,32,1,1,1,0,0,0,2,4,2,1,16,16,4,70,75,1441792,135266304,93,0.0195776,68.5872,6909.24
19,CUTLASS,gemm,cutlass_tensorop_s884gemm_f16_256x128_32x2_nn_align8,passed,success,universal,2048,512,128,f16:column,f16:column,f32:column,f32:column,1,0,serial,1,1,heuristic,invalid,invalid,false,false,1,tensorop,f32,256,128,32,1,1,1,0,0,0,2,4,2,1,16,16,4,70,75,4849664,270532608,55,0.0198586,227.439,13623
19,CUTLASS,gemm,cutlass_tensorop_s884gemm_f16_256x128_32x2_nt_align8,passed,success,universal,2048,512,128,f16:column,f16:row,f32:column,f32:column,1,0,serial,1,1,heuristic,invalid,invalid,false,false,1,tensorop,f32,256,128,32,1,1,1,0,0,0,2,4,2,1,16,16,4,70,75,4849664,270532608,55,0.0199597,226.286,13554
19,CUTLASS,gemm,cutlass_tensorop_s884gemm_f16_256x128_32x2_tn_align8,passed,success,universal,2048,512,128,f16:row,f16:column,f32:column,f32:column,1,0,serial,1,1,heuristic,invalid,invalid,false,false,1,tensorop,f32,256,128,32,1,1,1,0,0,0,2,4,2,1,16,16,4,70,75,4849664,270532608,55,0.0201718,223.906,13411.4
19,CUTLASS,gemm,cutlass_tensorop_s884gemm_f16_256x128_32x2_tt_align8,passed,success,universal,2048,512,128,f16:row,f16:row,f32:column,f32:column,1,0,serial,1,1,heuristic,invalid,invalid,false,false,1,tensorop,f32,256,128,32,1,1,1,0,0,0,2,4,2,1,16,16,4,70,75,4849664,270532608,55,0.0200749,224.988,13476.2
19,CUTLASS,gemm,cutlass_tensorop_f16_s884gemm_f16_256x128_32x2_nn_align8,passed,success,universal,2048,512,128,f16:column,f16:column,f16:column,f16:column,1,0,serial,1,1,heuristic,invalid,invalid,false,false,1,tensorop,f32,256,128,32,1,1,1,0,0,0,2,4,2,1,16,16,4,70,75,2752512,270532608,98,0.0196064,130.747,13798.2
19,CUTLASS,gemm,cutlass_tensorop_f16_s884gemm_f16_256x128_32x2_nt_align8,passed,success,universal,2048,512,128,f16:column,f16:row,f16:column,f16:column,1,0,serial,1,1,heuristic,invalid,invalid,false,false,1,tensorop,f32,256,128,32,1,1,1,0,0,0,2,4,2,1,16,16,4,70,75,2752512,270532608,98,0.0196659,130.351,13756.4
19,CUTLASS,gemm,cutlass_tensorop_f16_s884gemm_f16_256x128_32x2_tn_align8,passed,success,universal,2048,512,128,f16:row,f16:column,f16:column,f16:column,1,0,serial,1,1,heuristic,invalid,invalid,false,false,1,tensorop,f32,256,128,32,1,1,1,0,0,0,2,4,2,1,16,16,4,70,75,2752512,270532608,98,0.0200448,127.887,13496.4
19,CUTLASS,gemm,cutlass_tensorop_f16_s884gemm_f16_256x128_32x2_tt_align8,passed,success,universal,2048,512,128,f16:row,f16:row,f16:column,f16:column,1,0,serial,1,1,heuristic,invalid,invalid,false,false,1,tensorop,f32,256,128,32,1,1,1,0,0,0,2,4,2,1,16,16,4,70,75,2752512,270532608,98,0.0199056,128.782,13590.8
20,CUTLASS,gemm,cutlass_tensorop_s884gemm_f16_256x128_32x2_nn_align8,passed,success,universal,4096,512,128,f16:column,f16:column,f32:column,f32:column,1,0,serial,1,1,heuristic,invalid,invalid,false,false,1,tensorop,f32,256,128,32,1,1,1,0,0,0,2,4,2,1,16,16,4,70,75,9568256,541065216,56,0.0228397,390.16,23689.7
20,CUTLASS,gemm,cutlass_tensorop_s884gemm_f16_256x128_32x2_nt_align8,passed,success,universal,4096,512,128,f16:column,f16:row,f32:column,f32:column,1,0,serial,1,1,heuristic,invalid,invalid,false,false,1,tensorop,f32,256,128,32,1,1,1,0,0,0,2,4,2,1,16,16,4,70,75,9568256,541065216,56,0.0235341,378.648,22990.7
20,CUTLASS,gemm,cutlass_tensorop_s884gemm_f16_256x128_32x2_tn_align8,passed,success,universal,4096,512,128,f16:row,f16:column,f32:column,f32:column,1,0,serial,1,1,heuristic,invalid,invalid,false,false,1,tensorop,f32,256,128,32,1,1,1,0,0,0,2,4,2,1,16,16,4,70,75,9568256,541065216,56,0.0232541,383.207,23267.5
20,CUTLASS,gemm,cutlass_tensorop_s884gemm_f16_256x128_32x2_tt_align8,passed,success,universal,4096,512,128,f16:row,f16:row,f32:column,f32:column,1,0,serial,1,1,heuristic,invalid,invalid,false,false,1,tensorop,f32,256,128,32,1,1,1,0,0,0,2,4,2,1,16,16,4,70,75,9568256,541065216,56,0.0236246,377.197,22902.6
20,CUTLASS,gemm,cutlass_tensorop_f16_s884gemm_f16_256x128_32x2_nn_align8,passed,success,universal,4096,512,128,f16:column,f16:column,f16:column,f16:column,1,0,serial,1,1,heuristic,invalid,invalid,false,false,1,tensorop,f32,256,128,32,1,1,1,0,0,0,2,4,2,1,16,16,4,70,75,5373952,541065216,100,0.0211283,236.88,25608.5
20,CUTLASS,gemm,cutlass_tensorop_f16_s884gemm_f16_256x128_32x2_nt_align8,passed,success,universal,4096,512,128,f16:column,f16:row,f16:column,f16:column,1,0,serial,1,1,heuristic,invalid,invalid,false,false,1,tensorop,f32,256,128,32,1,1,1,0,0,0,2,4,2,1,16,16,4,70,75,5373952,541065216,100,0.0214128,233.733,25268.3
20,CUTLASS,gemm,cutlass_tensorop_f16_s884gemm_f16_256x128_32x2_tn_align8,passed,success,universal,4096,512,128,f16:row,f16:column,f16:column,f16:column,1,0,serial,1,1,heuristic,invalid,invalid,false,false,1,tensorop,f32,256,128,32,1,1,1,0,0,0,2,4,2,1,16,16,4,70,75,5373952,541065216,100,0.0214461,233.371,25229.1
20,CUTLASS,gemm,cutlass_tensorop_f16_s884gemm_f16_256x128_32x2_tt_align8,passed,success,universal,4096,512,128,f16:row,f16:row,f16:column,f16:column,1,0,serial,1,1,heuristic,invalid,invalid,false,false,1,tensorop,f32,256,128,32,1,1,1,0,0,0,2,4,2,1,16,16,4,70,75,5373952,541065216,100,0.0217018,230.621,24931.9
21,CUTLASS,gemm,cutlass_tensorop_s884gemm_f16_256x128_32x2_nn_align8,passed,success,universal,8192,512,128,f16:column,f16:column,f32:column,f32:column,1,0,serial,1,1,heuristic,invalid,invalid,false,false,1,tensorop,f32,256,128,32,1,1,1,0,0,0,2,4,2,1,16,16,4,70,75,19005440,1082130432,56,0.0455872,388.271,23737.6
21,CUTLASS,gemm,cutlass_tensorop_s884gemm_f16_256x128_32x2_nt_align8,passed,success,universal,8192,512,128,f16:column,f16:row,f32:column,f32:column,1,0,serial,1,1,heuristic,invalid,invalid,false,false,1,tensorop,f32,256,128,32,1,1,1,0,0,0,2,4,2,1,16,16,4,70,75,19005440,1082130432,56,0.0459578,385.141,23546.2
21,CUTLASS,gemm,cutlass_tensorop_s884gemm_f16_256x128_32x2_tn_align8,passed,success,universal,8192,512,128,f16:row,f16:column,f32:column,f32:column,1,0,serial,1,1,heuristic,invalid,invalid,false,false,1,tensorop,f32,256,128,32,1,1,1,0,0,0,2,4,2,1,16,16,4,70,75,19005440,1082130432,56,0.0460099,384.704,23519.5
21,CUTLASS,gemm,cutlass_tensorop_s884gemm_f16_256x128_32x2_tt_align8,passed,success,universal,8192,512,128,f16:row,f16:row,f32:column,f32:column,1,0,serial,1,1,heuristic,invalid,invalid,false,false,1,tensorop,f32,256,128,32,1,1,1,0,0,0,2,4,2,1,16,16,4,70,75,19005440,1082130432,56,0.0465101,380.567,23266.6
21,CUTLASS,gemm,cutlass_tensorop_f16_s884gemm_f16_256x128_32x2_nn_align8,passed,success,universal,8192,512,128,f16:column,f16:column,f16:column,f16:column,1,0,serial,1,1,heuristic,invalid,invalid,false,false,1,tensorop,f32,256,128,32,1,1,1,0,0,0,2,4,2,1,16,16,4,70,75,10616832,1082130432,101,0.0389693,253.731,27768.8
21,CUTLASS,gemm,cutlass_tensorop_f16_s884gemm_f16_256x128_32x2_nt_align8,passed,success,universal,8192,512,128,f16:column,f16:row,f16:column,f16:column,1,0,serial,1,1,heuristic,invalid,invalid,false,false,1,tensorop,f32,256,128,32,1,1,1,0,0,0,2,4,2,1,16,16,4,70,75,10616832,1082130432,101,0.0398714,247.99,27140.5
21,CUTLASS,gemm,cutlass_tensorop_f16_s884gemm_f16_256x128_32x2_tn_align8,passed,success,universal,8192,512,128,f16:row,f16:column,f16:column,f16:column,1,0,serial,1,1,heuristic,invalid,invalid,false,false,1,tensorop,f32,256,128,32,1,1,1,0,0,0,2,4,2,1,16,16,4,70,75,10616832,1082130432,101,0.0394758,250.475,27412.5
21,CUTLASS,gemm,cutlass_tensorop_f16_s884gemm_f16_256x128_32x2_tt_align8,passed,success,universal,8192,512,128,f16:row,f16:row,f16:column,f16:column,1,0,serial,1,1,heuristic,invalid,invalid,false,false,1,tensorop,f32,256,128,32,1,1,1,0,0,0,2,4,2,1,16,16,4,70,75,10616832,1082130432,101,0.0403594,244.991,26812.4
22,CUTLASS,gemm,cutlass_tensorop_s884gemm_f16_256x128_32x2_nn_align8,passed,success,universal,128,1024,128,f16:column,f16:column,f32:column,f32:column,1,0,serial,1,1,heuristic,invalid,invalid,false,false,1,tensorop,f32,256,128,32,1,1,1,0,0,0,2,4,2,1,16,16,4,70,75,819200,33816576,41,0.0193923,39.3424,1743.81
22,CUTLASS,gemm,cutlass_tensorop_s884gemm_f16_256x128_32x2_nt_align8,passed,success,universal,128,1024,128,f16:column,f16:row,f32:column,f32:column,1,0,serial,1,1,heuristic,invalid,invalid,false,false,1,tensorop,f32,256,128,32,1,1,1,0,0,0,2,4,2,1,16,16,4,70,75,819200,33816576,41,0.0193424,39.4439,1748.31
22,CUTLASS,gemm,cutlass_tensorop_s884gemm_f16_256x128_32x2_tn_align8,passed,success,universal,128,1024,128,f16:row,f16:column,f32:column,f32:column,1,0,serial,1,1,heuristic,invalid,invalid,false,false,1,tensorop,f32,256,128,32,1,1,1,0,0,0,2,4,2,1,16,16,4,70,75,819200,33816576,41,0.0196179,38.8899,1723.76
22,CUTLASS,gemm,cutlass_tensorop_s884gemm_f16_256x128_32x2_tt_align8,passed,success,universal,128,1024,128,f16:row,f16:row,f32:column,f32:column,1,0,serial,1,1,heuristic,invalid,invalid,false,false,1,tensorop,f32,256,128,32,1,1,1,0,0,0,2,4,2,1,16,16,4,70,75,819200,33816576,41,0.0194442,39.2375,1739.16
22,CUTLASS,gemm,cutlass_tensorop_f16_s884gemm_f16_256x128_32x2_nn_align8,passed,success,universal,128,1024,128,f16:column,f16:column,f16:column,f16:column,1,0,serial,1,1,heuristic,invalid,invalid,false,false,1,tensorop,f32,256,128,32,1,1,1,0,0,0,2,4,2,1,16,16,4,70,75,557056,33816576,60,0.0194909,26.6175,1734.99
22,CUTLASS,gemm,cutlass_tensorop_f16_s884gemm_f16_256x128_32x2_nt_align8,passed,success,universal,128,1024,128,f16:column,f16:row,f16:column,f16:column,1,0,serial,1,1,heuristic,invalid,invalid,false,false,1,tensorop,f32,256,128,32,1,1,1,0,0,0,2,4,2,1,16,16,4,70,75,557056,33816576,60,0.0193709,26.7824,1745.74
22,CUTLASS,gemm,cutlass_tensorop_f16_s884gemm_f16_256x128_32x2_tn_align8,passed,success,universal,128,1024,128,f16:row,f16:column,f16:column,f16:column,1,0,serial,1,1,heuristic,invalid,invalid,false,false,1,tensorop,f32,256,128,32,1,1,1,0,0,0,2,4,2,1,16,16,4,70,75,557056,33816576,60,0.01968,26.3617,1718.32
22,CUTLASS,gemm,cutlass_tensorop_f16_s884gemm_f16_256x128_32x2_tt_align8,passed,success,universal,128,1024,128,f16:row,f16:row,f16:column,f16:column,1,0,serial,1,1,heuristic,invalid,invalid,false,false,1,tensorop,f32,256,128,32,1,1,1,0,0,0,2,4,2,1,16,16,4,70,75,557056,33816576,60,0.019456,26.6652,1738.11
23,CUTLASS,gemm,cutlass_tensorop_s884gemm_f16_256x128_32x2_nn_align8,passed,success,universal,256,1024,128,f16:column,f16:column,f32:column,f32:column,1,0,serial,1,1,heuristic,invalid,invalid,false,false,1,tensorop,f32,256,128,32,1,1,1,0,0,0,2,4,2,1,16,16,4,70,75,1376256,67633152,49,0.0193408,66.2712,3496.92
23,CUTLASS,gemm,cutlass_tensorop_s884gemm_f16_256x128_32x2_nt_align8,passed,success,universal,256,1024,128,f16:column,f16:row,f32:column,f32:column,1,0,serial,1,1,heuristic,invalid,invalid,false,false,1,tensorop,f32,256,128,32,1,1,1,0,0,0,2,4,2,1,16,16,4,70,75,1376256,67633152,49,0.0193594,66.2077,3493.56
23,CUTLASS,gemm,cutlass_tensorop_s884gemm_f16_256x128_32x2_tn_align8,passed,success,universal,256,1024,128,f16:row,f16:column,f32:column,f32:column,1,0,serial,1,1,heuristic,invalid,invalid,false,false,1,tensorop,f32,256,128,32,1,1,1,0,0,0,2,4,2,1,16,16,4,70,75,1376256,67633152,49,0.0197171,65.0064,3430.17
23,CUTLASS,gemm,cutlass_tensorop_s884gemm_f16_256x128_32x2_tt_align8,passed,success,universal,256,1024,128,f16:row,f16:row,f32:column,f32:column,1,0,serial,1,1,heuristic,invalid,invalid,false,false,1,tensorop,f32,256,128,32,1,1,1,0,0,0,2,4,2,1,16,16,4,70,75,1376256,67633152,49,0.01944,65.933,3479.07
23,CUTLASS,gemm,cutlass_tensorop_f16_s884gemm_f16_256x128_32x2_nn_align8,passed,success,universal,256,1024,128,f16:column,f16:column,f16:column,f16:column,1,0,serial,1,1,heuristic,invalid,invalid,false,false,1,tensorop,f32,256,128,32,1,1,1,0,0,0,2,4,2,1,16,16,4,70,75,851968,67633152,79,0.019551,40.5839,3459.31
23,CUTLASS,gemm,cutlass_tensorop_f16_s884gemm_f16_256x128_32x2_nt_align8,passed,success,universal,256,1024,128,f16:column,f16:row,f16:column,f16:column,1,0,serial,1,1,heuristic,invalid,invalid,false,false,1,tensorop,f32,256,128,32,1,1,1,0,0,0,2,4,2,1,16,16,4,70,75,851968,67633152,79,0.019497,40.6964,3468.91
23,CUTLASS,gemm,cutlass_tensorop_f16_s884gemm_f16_256x128_32x2_tn_align8,passed,success,universal,256,1024,128,f16:row,f16:column,f16:column,f16:column,1,0,serial,1,1,heuristic,invalid,invalid,false,false,1,tensorop,f32,256,128,32,1,1,1,0,0,0,2,4,2,1,16,16,4,70,75,851968,67633152,79,0.0198339,40.0051,3409.97
23,CUTLASS,gemm,cutlass_tensorop_f16_s884gemm_f16_256x128_32x2_tt_align8,passed,success,universal,256,1024,128,f16:row,f16:row,f16:column,f16:column,1,0,serial,1,1,heuristic,invalid,invalid,false,false,1,tensorop,f32,256,128,32,1,1,1,0,0,0,2,4,2,1,16,16,4,70,75,851968,67633152,79,0.01964,40.4001,3443.64
24,CUTLASS,gemm,cutlass_tensorop_s884gemm_f16_256x128_32x2_nn_align8,passed,success,universal,512,1024,128,f16:column,f16:column,f32:column,f32:column,1,0,serial,1,1,heuristic,invalid,invalid,false,false,1,tensorop,f32,256,128,32,1,1,1,0,0,0,2,4,2,1,16,16,4,70,75,2490368,135266304,54,0.0194627,119.168,6950.02
24,CUTLASS,gemm,cutlass_tensorop_s884gemm_f16_256x128_32x2_nt_align8,passed,success,universal,512,1024,128,f16:column,f16:row,f32:column,f32:column,1,0,serial,1,1,heuristic,invalid,invalid,false,false,1,tensorop,f32,256,128,32,1,1,1,0,0,0,2,4,2,1,16,16,4,70,75,2490368,135266304,54,0.0193818,119.666,6979.05
24,CUTLASS,gemm,cutlass_tensorop_s884gemm_f16_256x128_32x2_tn_align8,passed,success,universal,512,1024,128,f16:row,f16:column,f32:column,f32:column,1,0,serial,1,1,heuristic,invalid,invalid,false,false,1,tensorop,f32,256,128,32,1,1,1,0,0,0,2,4,2,1,16,16,4,70,75,2490368,135266304,54,0.0197062,117.696,6864.14
24,CUTLASS,gemm,cutlass_tensorop_s884gemm_f16_256x128_32x2_tt_align8,passed,success,universal,512,1024,128,f16:row,f16:row,f32:column,f32:column,1,0,serial,1,1,heuristic,invalid,invalid,false,false,1,tensorop,f32,256,128,32,1,1,1,0,0,0,2,4,2,1,16,16,4,70,75,2490368,135266304,54,0.0194998,118.941,6936.79
24,CUTLASS,gemm,cutlass_tensorop_f16_s884gemm_f16_256x128_32x2_nn_align8,passed,success,universal,512,1024,128,f16:column,f16:column,f16:column,f16:column,1,0,serial,1,1,heuristic,invalid,invalid,false,false,1,tensorop,f32,256,128,32,1,1,1,0,0,0,2,4,2,1,16,16,4,70,75,1441792,135266304,93,0.0195005,68.8585,6936.56
24,CUTLASS,gemm,cutlass_tensorop_f16_s884gemm_f16_256x128_32x2_nt_align8,passed,success,universal,512,1024,128,f16:column,f16:row,f16:column,f16:column,1,0,serial,1,1,heuristic,invalid,invalid,false,false,1,tensorop,f32,256,128,32,1,1,1,0,0,0,2,4,2,1,16,16,4,70,75,1441792,135266304,93,0.0194522,69.0295,6953.79
24,CUTLASS,gemm,cutlass_tensorop_f16_s884gemm_f16_256x128_32x2_tn_align8,passed,success,universal,512,1024,128,f16:row,f16:column,f16:column,f16:column,1,0,serial,1,1,heuristic,invalid,invalid,false,false,1,tensorop,f32,256,128,32,1,1,1,0,0,0,2,4,2,1,16,16,4,70,75,1441792,135266304,93,0.019831,67.7107,6820.94
24,CUTLASS,gemm,cutlass_tensorop_f16_s884gemm_f16_256x128_32x2_tt_align8,passed,success,universal,512,1024,128,f16:row,f16:row,f16:column,f16:column,1,0,serial,1,1,heuristic,invalid,invalid,false,false,1,tensorop,f32,256,128,32,1,1,1,0,0,0,2,4,2,1,16,16,4,70,75,1441792,135266304,93,0.0195568,68.6602,6916.59
25,CUTLASS,gemm,cutlass_tensorop_s884gemm_f16_256x128_32x2_nn_align8,passed,success,universal,1024,1024,128,f16:column,f16:column,f32:column,f32:column,1,0,serial,1,1,heuristic,invalid,invalid,false,false,1,tensorop,f32,256,128,32,1,1,1,0,0,0,2,4,2,1,16,16,4,70,75,4718592,270532608,57,0.0194918,225.455,13879.3
25,CUTLASS,gemm,cutlass_tensorop_s884gemm_f16_256x128_32x2_nt_align8,passed,success,universal,1024,1024,128,f16:column,f16:row,f32:column,f32:column,1,0,serial,1,1,heuristic,invalid,invalid,false,false,1,tensorop,f32,256,128,32,1,1,1,0,0,0,2,4,2,1,16,16,4,70,75,4718592,270532608,57,0.0194768,225.629,13890
25,CUTLASS,gemm,cutlass_tensorop_s884gemm_f16_256x128_32x2_tn_align8,passed,success,universal,1024,1024,128,f16:row,f16:column,f32:column,f32:column,1,0,serial,1,1,heuristic,invalid,invalid,false,false,1,tensorop,f32,256,128,32,1,1,1,0,0,0,2,4,2,1,16,16,4,70,75,4718592,270532608,57,0.019952,220.255,13559.2
25,CUTLASS,gemm,cutlass_tensorop_s884gemm_f16_256x128_32x2_tt_align8,passed,success,universal,1024,1024,128,f16:row,f16:row,f32:column,f32:column,1,0,serial,1,1,heuristic,invalid,invalid,false,false,1,tensorop,f32,256,128,32,1,1,1,0,0,0,2,4,2,1,16,16,4,70,75,4718592,270532608,57,0.0196656,223.463,13756.6
25,CUTLASS,gemm,cutlass_tensorop_f16_s884gemm_f16_256x128_32x2_nn_align8,passed,success,universal,1024,1024,128,f16:column,f16:column,f16:column,f16:column,1,0,serial,1,1,heuristic,invalid,invalid,false,false,1,tensorop,f32,256,128,32,1,1,1,0,0,0,2,4,2,1,16,16,4,70,75,2621440,270532608,103,0.0196397,124.31,13774.8
25,CUTLASS,gemm,cutlass_tensorop_f16_s884gemm_f16_256x128_32x2_nt_align8,passed,success,universal,1024,1024,128,f16:column,f16:row,f16:column,f16:column,1,0,serial,1,1,heuristic,invalid,invalid,false,false,1,tensorop,f32,256,128,32,1,1,1,0,0,0,2,4,2,1,16,16,4,70,75,2621440,270532608,103,0.0196758,124.081,13749.5
25,CUTLASS,gemm,cutlass_tensorop_f16_s884gemm_f16_256x128_32x2_tn_align8,passed,success,universal,1024,1024,128,f16:row,f16:column,f16:column,f16:column,1,0,serial,1,1,heuristic,invalid,invalid,false,false,1,tensorop,f32,256,128,32,1,1,1,0,0,0,2,4,2,1,16,16,4,70,75,2621440,270532608,103,0.020063,121.687,13484.1
25,CUTLASS,gemm,cutlass_tensorop_f16_s884gemm_f16_256x128_32x2_tt_align8,passed,success,universal,1024,1024,128,f16:row,f16:row,f16:column,f16:column,1,0,serial,1,1,heuristic,invalid,invalid,false,false,1,tensorop,f32,256,128,32,1,1,1,0,0,0,2,4,2,1,16,16,4,70,75,2621440,270532608,103,0.0197437,123.655,13702.2
26,CUTLASS,gemm,cutlass_tensorop_s884gemm_f16_256x128_32x2_nn_align8,passed,success,universal,2048,1024,128,f16:column,f16:column,f32:column,f32:column,1,0,serial,1,1,heuristic,invalid,invalid,false,false,1,tensorop,f32,256,128,32,1,1,1,0,0,0,2,4,2,1,16,16,4,70,75,9175040,541065216,58,0.0242086,352.97,22350.1
26,CUTLASS,gemm,cutlass_tensorop_s884gemm_f16_256x128_32x2_nt_align8,passed,success,universal,2048,1024,128,f16:column,f16:row,f32:column,f32:column,1,0,serial,1,1,heuristic,invalid,invalid,false,false,1,tensorop,f32,256,128,32,1,1,1,0,0,0,2,4,2,1,16,16,4,70,75,9175040,541065216,58,0.0248198,344.278,21799.7
26,CUTLASS,gemm,cutlass_tensorop_s884gemm_f16_256x128_32x2_tn_align8,passed,success,universal,2048,1024,128,f16:row,f16:column,f32:column,f32:column,1,0,serial,1,1,heuristic,invalid,invalid,false,false,1,tensorop,f32,256,128,32,1,1,1,0,0,0,2,4,2,1,16,16,4,70,75,9175040,541065216,58,0.0268246,318.548,20170.5
26,CUTLASS,gemm,cutlass_tensorop_s884gemm_f16_256x128_32x2_tt_align8,passed,success,universal,2048,1024,128,f16:row,f16:row,f32:column,f32:column,1,0,serial,1,1,heuristic,invalid,invalid,false,false,1,tensorop,f32,256,128,32,1,1,1,0,0,0,2,4,2,1,16,16,4,70,75,9175040,541065216,58,0.0266205,320.991,20325.1
26,CUTLASS,gemm,cutlass_tensorop_f16_s884gemm_f16_256x128_32x2_nn_align8,passed,success,universal,2048,1024,128,f16:column,f16:column,f16:column,f16:column,1,0,serial,1,1,heuristic,invalid,invalid,false,false,1,tensorop,f32,256,128,32,1,1,1,0,0,0,2,4,2,1,16,16,4,70,75,4980736,541065216,108,0.0210374,220.496,25719.2
26,CUTLASS,gemm,cutlass_tensorop_f16_s884gemm_f16_256x128_32x2_nt_align8,passed,success,universal,2048,1024,128,f16:column,f16:row,f16:column,f16:column,1,0,serial,1,1,heuristic,invalid,invalid,false,false,1,tensorop,f32,256,128,32,1,1,1,0,0,0,2,4,2,1,16,16,4,70,75,4980736,541065216,108,0.0210083,220.802,25754.8
