results/cutlass/cutlass_fp32.gemm.csv
Problem,Provider,OperationKind,Operation,Disposition,Status,gemm_kind,m,n,k,A,B,C,D,alpha,beta,split_k_mode,split_k_slices,batch_count,raster_order,runtime_input_datatype_a,runtime_input_datatype_b,use_pdl,enable_sm90_mixed_dtype_shuffle_test,swizzle_size,op_class,accum,cta_m,cta_n,cta_k,cluster_m,cluster_n,cluster_k,cluster_m_fallback,cluster_n_fallback,cluster_k_fallback,stages,warps_m,warps_n,warps_k,inst_m,inst_n,inst_k,min_cc,max_cc,Bytes,Flops,Flops/Byte,Runtime,GB/s,GFLOPs
1,CUTLASS,gemm,cutlass_simt_sgemm_128x128_8x2_nn_align1,passed,success,universal,128,128,128,f32:column,f32:column,f32:column,f32:column,1,0,serial,1,1,heuristic,invalid,invalid,false,false,1,simt,f32,128,128,8,1,1,1,0,0,0,2,4,2,1,1,1,1,50,1024,196608,4227072,21,0.029856,6.13295,141.582
1,CUTLASS,gemm,cutlass_simt_sgemm_128x128_8x2_nt_align1,passed,success,universal,128,128,128,f32:column,f32:row,f32:column,f32:column,1,0,serial,1,1,heuristic,invalid,invalid,false,false,1,simt,f32,128,128,8,1,1,1,0,0,0,2,4,2,1,1,1,1,50,1024,196608,4227072,21,0.0302397,6.05514,139.786
1,CUTLASS,gemm,cutlass_simt_sgemm_128x128_8x2_tn_align1,passed,success,universal,128,128,128,f32:row,f32:column,f32:column,f32:column,1,0,serial,1,1,heuristic,invalid,invalid,false,false,1,simt,f32,128,128,8,1,1,1,0,0,0,2,4,2,1,1,1,1,50,1024,196608,4227072,21,0.0301062,6.08198,140.405
1,CUTLASS,gemm,cutlass_simt_sgemm_128x128_8x2_tt_align1,passed,success,universal,128,128,128,f32:row,f32:row,f32:column,f32:column,1,0,serial,1,1,heuristic,invalid,invalid,false,false,1,simt,f32,128,128,8,1,1,1,0,0,0,2,4,2,1,1,1,1,50,1024,196608,4227072,21,0.0298157,6.14125,141.773
1,CUTLASS,gemm,cutlass_tensorop_s884gemm_f16_256x128_32x2_nn_align8,passed,success,universal,128,128,128,f16:column,f16:column,f32:column,f32:column,1,0,serial,1,1,heuristic,invalid,invalid,false,false,1,tensorop,f32,256,128,32,1,1,1,0,0,0,2,4,2,1,16,16,4,70,75,131072,4227072,32,0.0155408,7.85483,271.998
1,CUTLASS,gemm,cutlass_tensorop_s884gemm_f16_256x128_32x2_nt_align8,passed,success,universal,128,128,128,f16:column,f16:row,f32:column,f32:column,1,0,serial,1,1,heuristic,invalid,invalid,false,false,1,tensorop,f32,256,128,32,1,1,1,0,0,0,2,4,2,1,16,16,4,70,75,131072,4227072,32,0.0156042,7.82293,270.894
1,CUTLASS,gemm,cutlass_tensorop_s884gemm_f16_256x128_32x2_tn_align8,passed,success,universal,128,128,128,f16:row,f16:column,f32:column,f32:column,1,0,serial,1,1,heuristic,invalid,invalid,false,false,1,tensorop,f32,256,128,32,1,1,1,0,0,0,2,4,2,1,16,16,4,70,75,131072,4227072,32,0.0155891,7.83048,271.155
1,CUTLASS,gemm,cutlass_tensorop_s884gemm_f16_256x128_32x2_tt_align8,passed,success,universal,128,128,128,f16:row,f16:row,f32:column,f32:column,1,0,serial,1,1,heuristic,invalid,invalid,false,false,1,tensorop,f32,256,128,32,1,1,1,0,0,0,2,4,2,1,16,16,4,70,75,131072,4227072,32,0.0156534,7.79831,270.041
1,CUTLASS,gemm,cutlass_tensorop_f16_s884gemm_f16_256x128_32x2_nn_align8,passed,success,universal,128,128,128,f16:column,f16:column,f16:column,f16:column,1,0,serial,1,1,heuristic,invalid,invalid,false,false,1,tensorop,f32,256,128,32,1,1,1,0,0,0,2,4,2,1,16,16,4,70,75,98304,4227072,43,0.0164976,5.54946,256.223
1,CUTLASS,gemm,cutlass_tensorop_f16_s884gemm_f16_256x128_32x2_nt_align8,passed,success,universal,128,128,128,f16:column,f16:row,f16:column,f16:column,1,0,serial,1,1,heuristic,invalid,invalid,false,false,1,tensorop,f32,256,128,32,1,1,1,0,0,0,2,4,2,1,16,16,4,70,75,98304,4227072,43,0.0165437,5.534,255.51
1,CUTLASS,gemm,cutlass_tensorop_f16_s884gemm_f16_256x128_32x2_tn_align8,passed,success,universal,128,128,128,f16:row,f16:column,f16:column,f16:column,1,0,serial,1,1,heuristic,invalid,invalid,false,false,1,tensorop,f32,256,128,32,1,1,1,0,0,0,2,4,2,1,16,16,4,70,75,98304,4227072,43,0.0166659,5.49341,253.636
1,CUTLASS,gemm,cutlass_tensorop_f16_s884gemm_f16_256x128_32x2_tt_align8,passed,success,universal,128,128,128,f16:row,f16:row,f16:column,f16:column,1,0,serial,1,1,heuristic,invalid,invalid,false,false,1,tensorop,f32,256,128,32,1,1,1,0,0,0,2,4,2,1,16,16,4,70,75,98304,4227072,43,0.0166413,5.50154,254.011
2,CUTLASS,gemm,cutlass_simt_sgemm_128x128_8x2_nn_align1,passed,success,universal,256,128,128,f32:column,f32:column,f32:column,f32:column,1,0,serial,1,1,heuristic,invalid,invalid,false,false,1,simt,f32,128,128,8,1,1,1,0,0,0,2,4,2,1,1,1,1,50,1024,327680,8454144,25,0.029921,10.1994,282.549
2,CUTLASS,gemm,cutlass_simt_sgemm_128x128_8x2_nt_align1,passed,success,universal,256,128,128,f32:column,f32:row,f32:column,f32:column,1,0,serial,1,1,heuristic,invalid,invalid,false,false,1,simt,f32,128,128,8,1,1,1,0,0,0,2,4,2,1,1,1,1,50,1024,327680,8454144,25,0.030479,10.0126,277.376
2,CUTLASS,gemm,cutlass_simt_sgemm_128x128_8x2_tn_align1,passed,success,universal,256,128,128,f32:row,f32:column,f32:column,f32:column,1,0,serial,1,1,heuristic,invalid,invalid,false,false,1,simt,f32,128,128,8,1,1,1,0,0,0,2,4,2,1,1,1,1,50,1024,327680,8454144,25,0.0302864,10.0763,279.14
2,CUTLASS,gemm,cutlass_simt_sgemm_128x128_8x2_tt_align1,passed,success,universal,256,128,128,f32:row,f32:row,f32:column,f32:column,1,0,serial,1,1,heuristic,invalid,invalid,false,false,1,simt,f32,128,128,8,1,1,1,0,0,0,2,4,2,1,1,1,1,50,1024,327680,8454144,25,0.030008,10.1698,281.73
2,CUTLASS,gemm,cutlass_tensorop_s884gemm_f16_256x128_32x2_nn_align8,passed,success,universal,256,128,128,f16:column,f16:column,f32:column,f32:column,1,0,serial,1,1,heuristic,invalid,invalid,false,false,1,tensorop,f32,256,128,32,1,1,1,0,0,0,2,4,2,1,16,16,4,70,75,229376,8454144,36,0.0155898,13.7028,542.288
2,CUTLASS,gemm,cutlass_tensorop_s884gemm_f16_256x128_32x2_nt_align8,passed,success,universal,256,128,128,f16:column,f16:row,f32:column,f32:column,1,0,serial,1,1,heuristic,invalid,invalid,false,false,1,tensorop,f32,256,128,32,1,1,1,0,0,0,2,4,2,1,16,16,4,70,75,229376,8454144,36,0.0177078,12.0638,477.424
2,CUTLASS,gemm,cutlass_tensorop_s884gemm_f16_256x128_32x2_tn_align8,passed,success,universal,256,128,128,f16:row,f16:column,f32:column,f32:column,1,0,serial,1,1,heuristic,invalid,invalid,false,false,1,tensorop,f32,256,128,32,1,1,1,0,0,0,2,4,2,1,16,16,4,70,75,229376,8454144,36,0.0177421,12.0405,476.502
2,CUTLASS,gemm,cutlass_tensorop_s884gemm_f16_256x128_32x2_tt_align8,passed,success,universal,256,128,128,f16:row,f16:row,f32:column,f32:column,1,0,serial,1,1,heuristic,invalid,invalid,false,false,1,tensorop,f32,256,128,32,1,1,1,0,0,0,2,4,2,1,16,16,4,70,75,229376,8454144,36,0.0176432,12.108,479.173
2,CUTLASS,gemm,cutlass_tensorop_f16_s884gemm_f16_256x128_32x2_nn_align8,passed,success,universal,256,128,128,f16:column,f16:column,f16:column,f16:column,1,0,serial,1,1,heuristic,invalid,invalid,false,false,1,tensorop,f32,256,128,32,1,1,1,0,0,0,2,4,2,1,16,16,4,70,75,163840,8454144,51,0.0186618,8.1765,453.02
2,CUTLASS,gemm,cutlass_tensorop_f16_s884gemm_f16_256x128_32x2_nt_align8,passed,success,universal,256,128,128,f16:column,f16:row,f16:column,f16:column,1,0,serial,1,1,heuristic,invalid,invalid,false,false,1,tensorop,f32,256,128,32,1,1,1,0,0,0,2,4,2,1,16,16,4,70,75,163840,8454144,51,0.0187181,8.1519,451.657
2,CUTLASS,gemm,cutlass_tensorop_f16_s884gemm_f16_256x128_32x2_tn_align8,passed,success,universal,256,128,128,f16:row,f16:column,f16:column,f16:column,1,0,serial,1,1,heuristic,invalid,invalid,false,false,1,tensorop,f32,256,128,32,1,1,1,0,0,0,2,4,2,1,16,16,4,70,75,163840,8454144,51,0.0187299,8.14675,451.371
2,CUTLASS,gemm,cutlass_tensorop_f16_s884gemm_f16_256x128_32x2_tt_align8,passed,success,universal,256,128,128,f16:row,f16:row,f16:column,f16:column,1,0,serial,1,1,heuristic,invalid,invalid,false,false,1,tensorop,f32,256,128,32,1,1,1,0,0,0,2,4,2,1,16,16,4,70,75,163840,8454144,51,0.018768,8.13022,450.455
3,CUTLASS,gemm,cutlass_simt_sgemm_128x128_8x2_nn_align1,passed,success,universal,512,128,128,f32:column,f32:column,f32:column,f32:column,1,0,serial,1,1,heuristic,invalid,invalid,false,false,1,simt,f32,128,128,8,1,1,1,0,0,0,2,4,2,1,1,1,1,50,1024,589824,16908288,28,0.0334518,16.4211,505.452
3,CUTLASS,gemm,cutlass_simt_sgemm_128x128_8x2_nt_align1,passed,success,universal,512,128,128,f32:column,f32:row,f32:column,f32:column,1,0,serial,1,1,heuristic,invalid,invalid,false,false,1,simt,f32,128,128,8,1,1,1,0,0,0,2,4,2,1,1,1,1,50,1024,589824,16908288,28,0.0338358,16.2347,499.715
3,CUTLASS,gemm,cutlass_simt_sgemm_128x128_8x2_tn_align1,passed,success,universal,512,128,128,f32:row,f32:column,f32:column,f32:column,1,0,serial,1,1,heuristic,invalid,invalid,false,false,1,simt,f32,128,128,8,1,1,1,0,0,0,2,4,2,1,1,1,1,50,1024,589824,16908288,28,0.0338406,16.2324,499.644
3,CUTLASS,gemm,cutlass_simt_sgemm_128x128_8x2_tt_align1,passed,success,universal,512,128,128,f32:row,f32:row,f32:column,f32:column,1,0,serial,1,1,heuristic,invalid,invalid,false,false,1,simt,f32,128,128,8,1,1,1,0,0,0,2,4,2,1,1,1,1,50,1024,589824,16908288,28,0.0335725,16.3621,503.635
3,CUTLASS,gemm,cutlass_tensorop_s884gemm_f16_256x128_32x2_nn_align8,passed,success,universal,512,128,128,f16:column,f16:column,f32:column,f32:column,1,0,serial,1,1,heuristic,invalid,invalid,false,false,1,tensorop,f32,256,128,32,1,1,1,0,0,0,2,4,2,1,16,16,4,70,75,425984,16908288,39,0.0175526,22.6022,963.29
3,CUTLASS,gemm,cutlass_tensorop_s884gemm_f16_256x128_32x2_nt_align8,passed,success,universal,512,128,128,f16:column,f16:row,f32:column,f32:column,1,0,serial,1,1,heuristic,invalid,invalid,false,false,1,tensorop,f32,256,128,32,1,1,1,0,0,0,2,4,2,1,16,16,4,70,75,425984,16908288,39,0.0175565,22.5973,963.08
3,CUTLASS,gemm,cutlass_tensorop_s884gemm_f16_256x128_32x2_tn_align8,passed,success,universal,512,128,128,f16:row,f16:column,f32:column,f32:column,1,0,serial,1,1,heuristic,invalid,invalid,false,false,1,tensorop,f32,256,128,32,1,1,1,0,0,0,2,4,2,1,16,16,4,70,75,425984,16908288,39,0.0176374,22.4935,958.659
3,CUTLASS,gemm,cutlass_tensorop_s884gemm_f16_256x128_32x2_tt_align8,passed,success,universal,512,128,128,f16:row,f16:row,f32:column,f32:column,1,0,serial,1,1,heuristic,invalid,invalid,false,false,1,tensorop,f32,256,128,32,1,1,1,0,0,0,2,4,2,1,16,16,4,70,75,425984,16908288,39,0.0176781,22.4418,956.455
3,CUTLASS,gemm,cutlass_tensorop_f16_s884gemm_f16_256x128_32x2_nn_align8,passed,success,universal,512,128,128,f16:column,f16:column,f16:column,f16:column,1,0,serial,1,1,heuristic,invalid,invalid,false,false,1,tensorop,f32,256,128,32,1,1,1,0,0,0,2,4,2,1,16,16,4,70,75,294912,16908288,57,0.0187107,14.6792,903.668
3,CUTLASS,gemm,cutlass_tensorop_f16_s884gemm_f16_256x128_32x2_nt_align8,passed,success,universal,512,128,128,f16:column,f16:row,f16:column,f16:column,1,0,serial,1,1,heuristic,invalid,invalid,false,false,1,tensorop,f32,256,128,32,1,1,1,0,0,0,2,4,2,1,16,16,4,70,75,294912,16908288,57,0.0186346,14.7392,907.362
3,CUTLASS,gemm,cutlass_tensorop_f16_s884gemm_f16_256x128_32x2_tn_align8,passed,success,universal,512,128,128,f16:row,f16:column,f16:column,f16:column,1,0,serial,1,1,heuristic,invalid,invalid,false,false,1,tensorop,f32,256,128,32,1,1,1,0,0,0,2,4,2,1,16,16,4,70,75,294912,16908288,57,0.0187014,14.6865,904.117
3,CUTLASS,gemm,cutlass_tensorop_f16_s884gemm_f16_256x128_32x2_tt_align8,passed,success,universal,512,128,128,f16:row,f16:row,f16:column,f16:column,1,0,serial,1,1,heuristic,invalid,invalid,false,false,1,tensorop,f32,256,128,32,1,1,1,0,0,0,2,4,2,1,16,16,4,70,75,294912,16908288,57,0.0187382,14.6576,902.341
4,CUTLASS,gemm,cutlass_simt_sgemm_128x128_8x2_nn_align1,passed,success,universal,1024,128,128,f32:column,f32:column,f32:column,f32:column,1,0,serial,1,1,heuristic,invalid,invalid,false,false,1,simt,f32,128,128,8,1,1,1,0,0,0,2,4,2,1,1,1,1,50,1024,1114112,33816576,30,0.0335747,30.9041,1007.2
4,CUTLASS,gemm,cutlass_simt_sgemm_128x128_8x2_nt_align1,passed,success,universal,1024,128,128,f32:column,f32:row,f32:column,f32:column,1,0,serial,1,1,heuristic,invalid,invalid,false,false,1,simt,f32,128,128,8,1,1,1,0,0,0,2,4,2,1,1,1,1,50,1024,1114112,33816576,30,0.0339408,30.5708,996.34
4,CUTLASS,gemm,cutlass_simt_sgemm_128x128_8x2_tn_align1,passed,success,universal,1024,128,128,f32:row,f32:column,f32:column,f32:column,1,0,serial,1,1,heuristic,invalid,invalid,false,false,1,simt,f32,128,128,8,1,1,1,0,0,0,2,4,2,1,1,1,1,50,1024,1114112,33816576,30,0.0341027,30.4257,991.609
4,CUTLASS,gemm,cutlass_simt_sgemm_128x128_8x2_tt_align1,passed,success,universal,1024,128,128,f32:row,f32:row,f32:column,f32:column,1,0,serial,1,1,heuristic,invalid,invalid,false,false,1,simt,f32,128,128,8,1,1,1,0,0,0,2,4,2,1,1,1,1,50,1024,1114112,33816576,30,0.0337898,30.7075,1000.79
4,CUTLASS,gemm,cutlass_tensorop_s884gemm_f16_256x128_32x2_nn_align8,passed,success,universal,1024,128,128,f16:column,f16:column,f32:column,f32:column,1,0,serial,1,1,heuristic,invalid,invalid,false,false,1,tensorop,f32,256,128,32,1,1,1,0,0,0,2,4,2,1,16,16,4,70,75,819200,33816576,41,0.0175146,43.5603,1930.77
4,CUTLASS,gemm,cutlass_tensorop_s884gemm_f16_256x128_32x2_nt_align8,passed,success,universal,1024,128,128,f16:column,f16:row,f32:column,f32:column,1,0,serial,1,1,heuristic,invalid,invalid,false,false,1,tensorop,f32,256,128,32,1,1,1,0,0,0,2,4,2,1,16,16,4,70,75,819200,33816576,41,0.017569,43.4254,1924.79
4,CUTLASS,gemm,cutlass_tensorop_s884gemm_f16_256x128_32x2_tn_align8,passed,success,universal,1024,128,128,f16:row,f16:column,f32:column,f32:column,1,0,serial,1,1,heuristic,invalid,invalid,false,false,1,tensorop,f32,256,128,32,1,1,1,0,0,0,2,4,2,1,16,16,4,70,75,819200,33816576,41,0.0177094,43.0809,1909.52
4,CUTLASS,gemm,cutlass_tensorop_s884gemm_f16_256x128_32x2_tt_align8,passed,success,universal,1024,128,128,f16:row,f16:row,f32:column,f32:column,1,0,serial,1,1,heuristic,invalid,invalid,false,false,1,tensorop,f32,256,128,32,1,1,1,0,0,0,2,4,2,1,16,16,4,70,75,819200,33816576,41,0.0177466,42.9908,1905.53
4,CUTLASS,gemm,cutlass_tensorop_f16_s884gemm_f16_256x128_32x2_nn_align8,passed,success,universal,1024,128,128,f16:column,f16:column,f16:column,f16:column,1,0,serial,1,1,heuristic,invalid,invalid,false,false,1,tensorop,f32,256,128,32,1,1,1,0,0,0,2,4,2,1,16,16,4,70,75,557056,33816576,60,0.0186934,27.753,1809.01
4,CUTLASS,gemm,cutlass_tensorop_f16_s884gemm_f16_256x128_32x2_nt_align8,passed,success,universal,1024,128,128,f16:column,f16:row,f16:column,f16:column,1,0,serial,1,1,heuristic,invalid,invalid,false,false,1,tensorop,f32,256,128,32,1,1,1,0,0,0,2,4,2,1,16,16,4,70,75,557056,33816576,60,0.0186323,27.844,1814.94
4,CUTLASS,gemm,cutlass_tensorop_f16_s884gemm_f16_256x128_32x2_tn_align8,passed,success,universal,1024,128,128,f16:row,f16:column,f16:column,f16:column,1,0,serial,1,1,heuristic,invalid,invalid,false,false,1,tensorop,f32,256,128,32,1,1,1,0,0,0,2,4,2,1,16,16,4,70,75,557056,33816576,60,0.0187712,27.638,1801.51
4,CUTLASS,gemm,cutlass_tensorop_f16_s884gemm_f16_256x128_32x2_tt_align8,passed,success,universal,1024,128,128,f16:row,f16:row,f16:column,f16:column,1,0,serial,1,1,heuristic,invalid,invalid,false,false,1,tensorop,f32,256,128,32,1,1,1,0,0,0,2,4,2,1,16,16,4,70,75,557056,33816576,60,0.0188048,27.5886,1798.29
5,CUTLASS,gemm,cutlass_simt_sgemm_128x128_8x2_nn_align1,passed,success,universal,2048,128,128,f32:column,f32:column,f32:column,f32:column,1,0,serial,1,1,heuristic,invalid,invalid,false,false,1,simt,f32,128,128,8,1,1,1,0,0,0,2,4,2,1,1,1,1,50,1024,2162688,67633152,31,0.033536,60.0596,2016.73
5,CUTLASS,gemm,cutlass_simt_sgemm_128x128_8x2_nt_align1,passed,success,universal,2048,128,128,f32:column,f32:row,f32:column,f32:column,1,0,serial,1,1,heuristic,invalid,invalid,false,false,1,simt,f32,128,128,8,1,1,1,0,0,0,2,4,2,1,1,1,1,50,1024,2162688,67633152,31,0.03404,59.1704,1986.87
5,CUTLASS,gemm,cutlass_simt_sgemm_128x128_8x2_tn_align1,passed,success,universal,2048,128,128,f32:row,f32:column,f32:column,f32:column,1,0,serial,1,1,heuristic,invalid,invalid,false,false,1,simt,f32,128,128,8,1,1,1,0,0,0,2,4,2,1,1,1,1,50,1024,2162688,67633152,31,0.034177,58.9333,1978.91
5,CUTLASS,gemm,cutlass_simt_sgemm_128x128_8x2_tt_align1,passed,success,universal,2048,128,128,f32:row,f32:row,f32:column,f32:column,1,0,serial,1,1,heuristic,invalid,invalid,false,false,1,simt,f32,128,128,8,1,1,1,0,0,0,2,4,2,1,1,1,1,50,1024,2162688,67633152,31,0.033928,59.3657,1993.43
5,CUTLASS,gemm,cutlass_tensorop_s884gemm_f16_256x128_32x2_nn_align8,passed,success,universal,2048,128,128,f16:column,f16:column,f32:column,f32:column,1,0,serial,1,1,heuristic,invalid,invalid,false,false,1,tensorop,f32,256,128,32,1,1,1,0,0,0,2,4,2,1,16,16,4,70,75,1605632,67633152,42,0.0176563,84.6927,3830.53
5,CUTLASS,gemm,cutlass_tensorop_s884gemm_f16_256x128_32x2_nt_align8,passed,success,universal,2048,128,128,f16:column,f16:row,f32:column,f32:column,1,0,serial,1,1,heuristic,invalid,invalid,false,false,1,tensorop,f32,256,128,32,1,1,1,0,0,0,2,4,2,1,16,16,4,70,75,1605632,67633152,42,0.0177123,84.4249,3818.42
5,CUTLASS,gemm,cutlass_tensorop_s884gemm_f16_256x128_32x2_tn_align8,passed,success,universal,2048,128,128,f16:row,f16:column,f32:column,f32:column,1,0,serial,1,1,heuristic,invalid,invalid,false,false,1,tensorop,f32,256,128,32,1,1,1,0,0,0,2,4,2,1,16,16,4,70,75,1605632,67633152,42,0.0178714,83.6736,3784.44
5,CUTLASS,gemm,cutlass_tensorop_s884gemm_f16_256x128_32x2_tt_align8,passed,success,universal,2048,128,128,f16:row,f16:row,f32:column,f32:column,1,0,serial,1,1,heuristic,invalid,invalid,false,false,1,tensorop,f32,256,128,32,1,1,1,0,0,0,2,4,2,1,16,16,4,70,75,1605632,67633152,42,0.0179766,83.1836,3762.28
5,CUTLASS,gemm,cutlass_tensorop_f16_s884gemm_f16_256x128_32x2_nn_align8,passed,success,universal,2048,128,128,f16:column,f16:column,f16:column,f16:column,1,0,serial,1,1,heuristic,invalid,invalid,false,false,1,tensorop,f32,256,128,32,1,1,1,0,0,0,2,4,2,1,16,16,4,70,75,1081344,67633152,62,0.0188429,53.4462,3589.32
5,CUTLASS,gemm,cutlass_tensorop_f16_s884gemm_f16_256x128_32x2_nt_align8,passed,success,universal,2048,128,128,f16:column,f16:row,f16:column,f16:column,1,0,serial,1,1,heuristic,invalid,invalid,false,false,1,tensorop,f32,256,128,32,1,1,1,0,0,0,2,4,2,1,16,16,4,70,75,1081344,67633152,62,0.0188,53.5681,3597.51
5,CUTLASS,gemm,cutlass_tensorop_f16_s884gemm_f16_256x128_32x2_tn_align8,passed,success,universal,2048,128,128,f16:row,f16:column,f16:column,f16:column,1,0,serial,1,1,heuristic,invalid,invalid,false,false,1,tensorop,f32,256,128,32,1,1,1,0,0,0,2,4,2,1,16,16,4,70,75,1081344,67633152,62,0.0191219,52.6663,3536.94
5,CUTLASS,gemm,cutlass_tensorop_f16_s884gemm_f16_256x128_32x2_tt_align8,passed,success,universal,2048,128,128,f16:row,f16:row,f16:column,f16:column,1,0,serial,1,1,heuristic,invalid,invalid,false,false,1,tensorop,f32,256,128,32,1,1,1,0,0,0,2,4,2,1,16,16,4,70,75,1081344,67633152,62,0.0192288,52.3735,3517.28
6,CUTLASS,gemm,cutlass_simt_sgemm_128x128_8x2_nn_align1,passed,success,universal,4096,128,128,f32:column,f32:column,f32:column,f32:column,1,0,serial,1,1,heuristic,invalid,invalid,false,false,1,simt,f32,128,128,8,1,1,1,0,0,0,2,4,2,1,1,1,1,50,1024,4259840,135266304,31,0.0339069,117.005,3989.35
6,CUTLASS,gemm,cutlass_simt_sgemm_128x128_8x2_nt_align1,passed,success,universal,4096,128,128,f32:column,f32:row,f32:column,f32:column,1,0,serial,1,1,heuristic,invalid,invalid,false,false,1,simt,f32,128,128,8,1,1,1,0,0,0,2,4,2,1,1,1,1,50,1024,4259840,135266304,31,0.0344214,115.256,3929.71
6,CUTLASS,gemm,cutlass_simt_sgemm_128x128_8x2_tn_align1,passed,success,universal,4096,128,128,f32:row,f32:column,f32:column,f32:column,1,0,serial,1,1,heuristic,invalid,invalid,false,false,1,simt,f32,128,128,8,1,1,1,0,0,0,2,4,2,1,1,1,1,50,1024,4259840,135266304,31,0.0347642,114.12,3890.97
6,CUTLASS,gemm,cutlass_simt_sgemm_128x128_8x2_tt_align1,passed,success,universal,4096,128,128,f32:row,f32:row,f32:column,f32:column,1,0,serial,1,1,heuristic,invalid,invalid,false,false,1,simt,f32,128,128,8,1,1,1,0,0,0,2,4,2,1,1,1,1,50,1024,4259840,135266304,31,0.034248,115.84,3949.61
6,CUTLASS,gemm,cutlass_tensorop_s884gemm_f16_256x128_32x2_nn_align8,passed,success,universal,4096,128,128,f16:column,f16:column,f32:column,f32:column,1,0,serial,1,1,heuristic,invalid,invalid,false,false,1,tensorop,f32,256,128,32,1,1,1,0,0,0,2,4,2,1,16,16,4,70,75,3178496,135266304,42,0.0178474,165.862,7579.06
6,CUTLASS,gemm,cutlass_tensorop_s884gemm_f16_256x128_32x2_nt_align8,passed,success,universal,4096,128,128,f16:column,f16:row,f32:column,f32:column,1,0,serial,1,1,heuristic,invalid,invalid,false,false,1,tensorop,f32,256,128,32,1,1,1,0,0,0,2,4,2,1,16,16,4,70,75,3178496,135266304,42,0.0179949,164.503,7516.93
6,CUTLASS,gemm,cutlass_tensorop_s884gemm_f16_256x128_32x2_tn_align8,passed,success,universal,4096,128,128,f16:row,f16:column,f32:column,f32:column,1,0,serial,1,1,heuristic,invalid,invalid,false,false,1,tensorop,f32,256,128,32,1,1,1,0,0,0,2,4,2,1,16,16,4,70,75,3178496,135266304,42,0.0181843,162.789,7438.62
6,CUTLASS,gemm,cutlass_tensorop_s884gemm_f16_256x128_32x2_tt_align8,passed,success,universal,4096,128,128,f16:row,f16:row,f32:column,f32:column,1,0,serial,1,1,heuristic,invalid,invalid,false,false,1,tensorop,f32,256,128,32,1,1,1,0,0,0,2,4,2,1,16,16,4,70,75,3178496,135266304,42,0.0182589,162.124,7408.25
6,CUTLASS,gemm,cutlass_tensorop_f16_s884gemm_f16_256x128_32x2_nn_align8,passed,success,universal,4096,128,128,f16:column,f16:column,f16:column,f16:column,1,0,serial,1,1,heuristic,invalid,invalid,false,false,1,tensorop,f32,256,128,32,1,1,1,0,0,0,2,4,2,1,16,16,4,70,75,2129920,135266304,63,0.0190509,104.123,7100.27
6,CUTLASS,gemm,cutlass_tensorop_f16_s884gemm_f16_256x128_32x2_nt_align8,passed,success,universal,4096,128,128,f16:column,f16:row,f16:column,f16:column,1,0,serial,1,1,heuristic,invalid,invalid,false,false,1,tensorop,f32,256,128,32,1,1,1,0,0,0,2,4,2,1,16,16,4,70,75,2129920,135266304,63,0.019233,103.138,7033.05
6,CUTLASS,gemm,cutlass_tensorop_f16_s884gemm_f16_256x128_32x2_tn_align8,passed,success,universal,4096,128,128,f16:row,f16:column,f16:column,f16:column,1,0,serial,1,1,heuristic,invalid,invalid,false,false,1,tensorop,f32,256,128,32,1,1,1,0,0,0,2,4,2,1,16,16,4,70,75,2129920,135266304,63,0.0194717,101.873,6946.82
6,CUTLASS,gemm,cutlass_tensorop_f16_s884gemm_f16_256x128_32x2_tt_align8,passed,success,universal,4096,128,128,f16:row,f16:row,f16:column,f16:column,1,0,serial,1,1,heuristic,invalid,invalid,false,false,1,tensorop,f32,256,128,32,1,1,1,0,0,0,2,4,2,1,16,16,4,70,75,2129920,135266304,63,0.0194656,101.905,6948.99
7,CUTLASS,gemm,cutlass_simt_sgemm_128x128_8x2_nn_align1,passed,success,universal,8192,128,128,f32:column,f32:column,f32:column,f32:column,1,0,serial,1,1,heuristic,invalid,invalid,false,false,1,simt,f32,128,128,8,1,1,1,0,0,0,2,4,2,1,1,1,1,50,1024,8454144,270532608,32,0.0360128,218.632,7512.12
7,CUTLASS,gemm,cutlass_simt_sgemm_128x128_8x2_nt_align1,passed,success,universal,8192,128,128,f32:column,f32:row,f32:column,f32:column,1,0,serial,1,1,heuristic,invalid,invalid,false,false,1,simt,f32,128,128,8,1,1,1,0,0,0,2,4,2,1,1,1,1,50,1024,8454144,270532608,32,0.0373846,210.609,7236.46
7,CUTLASS,gemm,cutlass_simt_sgemm_128x128_8x2_tn_align1,passed,success,universal,8192,128,128,f32:row,f32:column,f32:column,f32:column,1,0,serial,1,1,heuristic,invalid,invalid,false,false,1,simt,f32,128,128,8,1,1,1,0,0,0,2,4,2,1,1,1,1,50,1024,8454144,270532608,32,0.0384582,204.729,7034.45
7,CUTLASS,gemm,cutlass_simt_sgemm_128x128_8x2_tt_align1,passed,success,universal,8192,128,128,f32:row,f32:row,f32:column,f32:column,1,0,serial,1,1,heuristic,invalid,invalid,false,false,1,simt,f32,128,128,8,1,1,1,0,0,0,2,4,2,1,1,1,1,50,1024,8454144,270532608,32,0.0372592,211.318,7260.83
7,CUTLASS,gemm,cutlass_tensorop_s884gemm_f16_256x128_32x2_nn_align8,passed,success,universal,8192,128,128,f16:column,f16:column,f32:column,f32:column,1,0,serial,1,1,heuristic,invalid,invalid,false,false,1,tensorop,f32,256,128,32,1,1,1,0,0,0,2,4,2,1,16,16,4,70,75,6324224,270532608,42,0.0202915,290.264,13332.3
7,CUTLASS,gemm,cutlass_tensorop_s884gemm_f16_256x128_32x2_nt_align8,passed,success,universal,8192,128,128,f16:column,f16:row,f32:column,f32:column,1,0,serial,1,1,heuristic,invalid,invalid,false,false,1,tensorop,f32,256,128,32,1,1,1,0,0,0,2,4,2,1,16,16,4,70,75,6324224,270532608,42,0.0201523,292.269,13424.4
7,CUTLASS,gemm,cutlass_tensorop_s884gemm_f16_256x128_32x2_tn_align8,passed,success,universal,8192,128,128,f16:row,f16:column,f32:column,f32:column,1,0,serial,1,1,heuristic,invalid,invalid,false,false,1,tensorop,f32,256,128,32,1,1,1,0,0,0,2,4,2,1,16,16,4,70,75,6324224,270532608,42,0.019817,297.215,13651.6
7,CUTLASS,gemm,cutlass_tensorop_s884gemm_f16_256x128_32x2_tt_align8,passed,success,universal,8192,128,128,f16:row,f16:row,f32:column,f32:column,1,0,serial,1,1,heuristic,invalid,invalid,false,false,1,tensorop,f32,256,128,32,1,1,1,0,0,0,2,4,2,1,16,16,4,70,75,6324224,270532608,42,0.0199066,295.877,13590.1
7,CUTLASS,gemm,cutlass_tensorop_f16_s884gemm_f16_256x128_32x2_nn_align8,passed,success,universal,8192,128,128,f16:column,f16:column,f16:column,f16:column,1,0,serial,1,1,heuristic,invalid,invalid,false,false,1,tensorop,f32,256,128,32,1,1,1,0,0,0,2,4,2,1,16,16,4,70,75,4227072,270532608,64,0.0200486,196.361,13493.8
7,CUTLASS,gemm,cutlass_tensorop_f16_s884gemm_f16_256x128_32x2_nt_align8,passed,success,universal,8192,128,128,f16:column,f16:row,f16:column,f16:column,1,0,serial,1,1,heuristic,invalid,invalid,false,false,1,tensorop,f32,256,128,32,1,1,1,0,0,0,2,4,2,1,16,16,4,70,75,4227072,270532608,64,0.0199696,197.138,13547.2
7,CUTLASS,gemm,cutlass_tensorop_f16_s884gemm_f16_256x128_32x2_tn_align8,passed,success,universal,8192,128,128,f16:row,f16:column,f16:column,f16:column,1,0,serial,1,1,heuristic,invalid,invalid,false,false,1,tensorop,f32,256,128,32,1,1,1,0,0,0,2,4,2,1,16,16,4,70,75,4227072,270532608,64,0.0201242,195.624,13443.2
7,CUTLASS,gemm,cutlass_tensorop_f16_s884gemm_f16_256x128_32x2_tt_align8,passed,success,universal,8192,128,128,f16:row,f16:row,f16:column,f16:column,1,0,serial,1,1,heuristic,invalid,invalid,false,false,1,tensorop,f32,256,128,32,1,1,1,0,0,0,2,4,2,1,16,16,4,70,75,4227072,270532608,64,0.0200749,196.104,13476.2
8,CUTLASS,gemm,cutlass_simt_sgemm_128x128_8x2_nn_align1,passed,success,universal,128,256,128,f32:column,f32:column,f32:column,f32:column,1,0,serial,1,1,heuristic,invalid,invalid,false,false,1,simt,f32,128,128,8,1,1,1,0,0,0,2,4,2,1,1,1,1,50,1024,327680,8454144,25,0.0334288,9.12913,252.9
8,CUTLASS,gemm,cutlass_simt_sgemm_128x128_8x2_nt_align1,passed,success,universal,128,256,128,f32:column,f32:row,f32:column,f32:column,1,0,serial,1,1,heuristic,invalid,invalid,false,false,1,simt,f32,128,128,8,1,1,1,0,0,0,2,4,2,1,1,1,1,50,1024,327680,8454144,25,0.0338678,9.01078,249.622
8,CUTLASS,gemm,cutlass_simt_sgemm_128x128_8x2_tn_align1,passed,success,universal,128,256,128,f32:row,f32:column,f32:column,f32:column,1,0,serial,1,1,heuristic,invalid,invalid,false,false,1,simt,f32,128,128,8,1,1,1,0,0,0,2,4,2,1,1,1,1,50,1024,327680,8454144,25,0.0337978,9.02947,250.139
8,CUTLASS,gemm,cutlass_simt_sgemm_128x128_8x2_tt_align1,passed,success,universal,128,256,128,f32:row,f32:row,f32:column,f32:column,1,0,serial,1,1,heuristic,invalid,invalid,false,false,1,simt,f32,128,128,8,1,1,1,0,0,0,2,4,2,1,1,1,1,50,1024,327680,8454144,25,0.0335171,9.10507,252.234
8,CUTLASS,gemm,cutlass_tensorop_s884gemm_f16_256x128_32x2_nn_align8,passed,success,universal,128,256,128,f16:column,f16:column,f32:column,f32:column,1,0,serial,1,1,heuristic,invalid,invalid,false,false,1,tensorop,f32,256,128,32,1,1,1,0,0,0,2,4,2,1,16,16,4,70,75,229376,8454144,36,0.0191779,11.139,440.827
8,CUTLASS,gemm,cutlass_tensorop_s884gemm_f16_256x128_32x2_nt_align8,passed,success,universal,128,256,128,f16:column,f16:row,f32:column,f32:column,1,0,serial,1,1,heuristic,invalid,invalid,false,false,1,tensorop,f32,256,128,32,1,1,1,0,0,0,2,4,2,1,16,16,4,70,75,229376,8454144,36,0.0191939,11.1297,440.459
8,CUTLASS,gemm,cutlass_tensorop_s884gemm_f16_256x128_32x2_tn_align8,passed,success,universal,128,256,128,f16:row,f16:column,f32:column,f32:column,1,0,serial,1,1,heuristic,invalid,invalid,false,false,1,tensorop,f32,256,128,32,1,1,1,0,0,0,2,4,2,1,16,16,4,70,75,229376,8454144,36,0.0193072,11.0644,437.875
8,CUTLASS,gemm,cutlass_tensorop_s884gemm_f16_256x128_32x2_tt_align8,passed,success,universal,128,256,128,f16:row,f16:row,f32:column,f32:column,1,0,serial,1,1,heuristic,invalid,invalid,false,false,1,tensorop,f32,256,128,32,1,1,1,0,0,0,2,4,2,1,16,16,4,70,75,229376,8454144,36,0.0192733,11.0839,438.646
8,CUTLASS,gemm,cutlass_tensorop_f16_s884gemm_f16_256x128_32x2_nn_align8,passed,success,universal,128,256,128,f16:column,f16:column,f16:column,f16:column,1,0,serial,1,1,heuristic,invalid,invalid,false,false,1,tensorop,f32,256,128,32,1,1,1,0,0,0,2,4,2,1,16,16,4,70,75,163840,8454144,51,0.0193117,7.90133,437.774
8,CUTLASS,gemm,cutlass_tensorop_f16_s884gemm_f16_256x128_32x2_nt_align8,passed,success,universal,128,256,128,f16:column,f16:row,f16:column,f16:column,1,0,serial,1,1,heuristic,invalid,invalid,false,false,1,tensorop,f32,256,128,32,1,1,1,0,0,0,2,4,2,1,16,16,4,70,75,163840,8454144,51,0.0192816,7.91365,438.457
8,CUTLASS,gemm,cutlass_tensorop_f16_s884gemm_f16_256x128_32x2_tn_align8,passed,success,universal,128,256,128,f16:row,f16:column,f16:column,f16:column,1,0,serial,1,1,heuristic,invalid,invalid,false,false,1,tensorop,f32,256,128,32,1,1,1,0,0,0,2,4,2,1,16,16,4,70,75,163840,8454144,51,0.0195862,7.79057,431.637
8,CUTLASS,gemm,cutlass_tensorop_f16_s884gemm_f16_256x128_32x2_tt_align8,passed,success,universal,128,256,128,f16:row,f16:row,f16:column,f16:column,1,0,serial,1,1,heuristic,invalid,invalid,false,false,1,tensorop,f32,256,128,32,1,1,1,0,0,0,2,4,2,1,16,16,4,70,75,163840,8454144,51,0.0196458,7.76696,430.329
9,CUTLASS,gemm,cutlass_simt_sgemm_128x128_8x2_nn_align1,passed,success,universal,256,256,128,f32:column,f32:column,f32:column,f32:column,1,0,serial,1,1,heuristic,invalid,invalid,false,false,1,simt,f32,128,128,8,1,1,1,0,0,0,2,4,2,1,1,1,1,50,1024,524288,16908288,32,0.0333939,14.6219,506.328
9,CUTLASS,gemm,cutlass_simt_sgemm_128x128_8x2_nt_align1,passed,success,universal,256,256,128,f32:column,f32:row,f32:column,f32:column,1,0,serial,1,1,heuristic,invalid,invalid,false,false,1,simt,f32,128,128,8,1,1,1,0,0,0,2,4,2,1,1,1,1,50,1024,524288,16908288,32,0.0339331,14.3895,498.283
9,CUTLASS,gemm,cutlass_simt_sgemm_128x128_8x2_tn_align1,passed,success,universal,256,256,128,f32:row,f32:column,f32:column,f32:column,1,0,serial,1,1,heuristic,invalid,invalid,false,false,1,simt,f32,128,128,8,1,1,1,0,0,0,2,4,2,1,1,1,1,50,1024,524288,16908288,32,0.0338736,14.4148,499.158
9,CUTLASS,gemm,cutlass_simt_sgemm_128x128_8x2_tt_align1,passed,success,universal,256,256,128,f32:row,f32:row,f32:column,f32:column,1,0,serial,1,1,heuristic,invalid,invalid,false,false,1,simt,f32,128,128,8,1,1,1,0,0,0,2,4,2,1,1,1,1,50,1024,524288,16908288,32,0.0335104,14.571,504.568
9,CUTLASS,gemm,cutlass_tensorop_s884gemm_f16_256x128_32x2_nn_align8,passed,success,universal,256,256,128,f16:column,f16:column,f32:column,f32:column,1,0,serial,1,1,heuristic,invalid,invalid,false,false,1,tensorop,f32,256,128,32,1,1,1,0,0,0,2,4,2,1,16,16,4,70,75,393216,16908288,43,0.0193315,18.9437,874.649
9,CUTLASS,gemm,cutlass_tensorop_s884gemm_f16_256x128_32x2_nt_align8,passed,success,universal,256,256,128,f16:column,f16:row,f32:column,f32:column,1,0,serial,1,1,heuristic,invalid,invalid,false,false,1,tensorop,f32,256,128,32,1,1,1,0,0,0,2,4,2,1,16,16,4,70,75,393216,16908288,43,0.0193146,18.9604,875.417
9,CUTLASS,gemm,cutlass_tensorop_s884gemm_f16_256x128_32x2_tn_align8,passed,success,universal,256,256,128,f16:row,f16:column,f32:column,f32:column,1,0,serial,1,1,heuristic,invalid,invalid,false,false,1,tensorop,f32,256,128,32,1,1,1,0,0,0,2,4,2,1,16,16,4,70,75,393216,16908288,43,0.0194448,18.8334,869.553
9,CUTLASS,gemm,cutlass_tensorop_s884gemm_f16_256x128_32x2_tt_align8,passed,success,universal,256,256,128,f16:row,f16:row,f32:column,f32:column,1,0,serial,1,1,heuristic,invalid,invalid,false,false,1,tensorop,f32,256,128,32,1,1,1,0,0,0,2,4,2,1,16,16,4,70,75,393216,16908288,43,0.0194077,18.8694,871.216
9,CUTLASS,gemm,cutlass_tensorop_f16_s884gemm_f16_256x128_32x2_nn_align8,passed,success,universal,256,256,128,f16:column,f16:column,f16:column,f16:column,1,0,serial,1,1,heuristic,invalid,invalid,false,false,1,tensorop,f32,256,128,32,1,1,1,0,0,0,2,4,2,1,16,16,4,70,75,262144,16908288,64,0.019383,12.5956,872.324
9,CUTLASS,gemm,cutlass_tensorop_f16_s884gemm_f16_256x128_32x2_nt_align8,passed,success,universal,256,256,128,f16:column,f16:row,f16:column,f16:column,1,0,serial,1,1,heuristic,invalid,invalid,false,false,1,tensorop,f32,256,128,32,1,1,1,0,0,0,2,4,2,1,16,16,4,70,75,262144,16908288,64,0.0193738,12.6016,872.742
9,CUTLASS,gemm,cutlass_tensorop_f16_s884gemm_f16_256x128_32x2_tn_align8,passed,success,universal,256,256,128,f16:row,f16:column,f16:column,f16:column,1,0,serial,1,1,heuristic,invalid,invalid,false,false,1,tensorop,f32,256,128,32,1,1,1,0,0,0,2,4,2,1,16,16,4,70,75,262144,16908288,64,0.0195846,12.4659,863.344
9,CUTLASS,gemm,cutlass_tensorop_f16_s884gemm_f16_256x128_32x2_tt_align8,passed,success,universal,256,256,128,f16:row,f16:row,f16:column,f16:column,1,0,serial,1,1,heuristic,invalid,invalid,false,false,1,tensorop,f32,256,128,32,1,1,1,0,0,0,2,4,2,1,16,16,4,70,75,262144,16908288,64,0.0194144,12.5752,870.915
10,CUTLASS,gemm,cutlass_simt_sgemm_128x128_8x2_nn_align1,passed,success,universal,512,256,128,f32:column,f32:column,f32:column,f32:column,1,0,serial,1,1,heuristic,invalid,invalid,false,false,1,simt,f32,128,128,8,1,1,1,0,0,0,2,4,2,1,1,1,1,50,1024,917504,33816576,36,0.0334778,25.5242,1010.12
10,CUTLASS,gemm,cutlass_simt_sgemm_128x128_8x2_nt_align1,passed,success,universal,512,256,128,f32:column,f32:row,f32:column,f32:column,1,0,serial,1,1,heuristic,invalid,invalid,false,false,1,simt,f32,128,128,8,1,1,1,0,0,0,2,4,2,1,1,1,1,50,1024,917504,33816576,36,0.0340003,25.1319,994.596
10,CUTLASS,gemm,cutlass_simt_sgemm_128x128_8x2_tn_align1,passed,success,universal,512,256,128,f32:row,f32:column,f32:column,f32:column,1,0,serial,1,1,heuristic,invalid,invalid,false,false,1,simt,f32,128,128,8,1,1,1,0,0,0,2,4,2,1,1,1,1,50,1024,917504,33816576,36,0.0339901,25.1395,994.895
10,CUTLASS,gemm,cutlass_simt_sgemm_128x128_8x2_tt_align1,passed,success,universal,512,256,128,f32:row,f32:row,f32:column,f32:column,1,0,serial,1,1,heuristic,invalid,invalid,false,false,1,simt,f32,128,128,8,1,1,1,0,0,0,2,4,2,1,1,1,1,50,1024,917504,33816576,36,0.0335952,25.4349,1006.59
10,CUTLASS,gemm,cutlass_tensorop_s884gemm_f16_256x128_32x2_nn_align8,passed,success,universal,512,256,128,f16:column,f16:column,f32:column,f32:column,1,0,serial,1,1,heuristic,invalid,invalid,false,false,1,tensorop,f32,256,128,32,1,1,1,0,0,0,2,4,2,1,16,16,4,70,75,720896,33816576,46,0.0192426,34.8907,1757.38
10,CUTLASS,gemm,cutlass_tensorop_s884gemm_f16_256x128_32x2_nt_align8,passed,success,universal,512,256,128,f16:column,f16:row,f32:column,f32:column,1,0,serial,1,1,heuristic,invalid,invalid,false,false,1,tensorop,f32,256,128,32,1,1,1,0,0,0,2,4,2,1,16,16,4,70,75,720896,33816576,46,0.0429162,15.6441,787.968
10,CUTLASS,gemm,cutlass_tensorop_s884gemm_f16_256x128_32x2_tn_align8,passed,success,universal,512,256,128,f16:row,f16:column,f32:column,f32:column,1,0,serial,1,1,heuristic,invalid,invalid,false,false,1,tensorop,f32,256,128,32,1,1,1,0,0,0,2,4,2,1,16,16,4,70,75,720896,33816576,46,0.0195402,34.3593,1730.62
10,CUTLASS,gemm,cutlass_tensorop_s884gemm_f16_256x128_32x2_tt_align8,passed,success,universal,512,256,128,f16:row,f16:row,f32:column,f32:column,1,0,serial,1,1,heuristic,invalid,invalid,false,false,1,tensorop,f32,256,128,32,1,1,1,0,0,0,2,4,2,1,16,16,4,70,75,720896,33816576,46,0.0193421,34.7112,1748.34
10,CUTLASS,gemm,cutlass_tensorop_f16_s884gemm_f16_256x128_32x2_nn_align8,passed,success,universal,512,256,128,f16:column,f16:column,f16:column,f16:column,1,0,serial,1,1,heuristic,invalid,invalid,false,false,1,tensorop,f32,256,128,32,1,1,1,0,0,0,2,4,2,1,16,16,4,70,75,458752,33816576,73,0.0192954,22.1424,1752.58
10,CUTLASS,gemm,cutlass_tensorop_f16_s884gemm_f16_256x128_32x2_nt_align8,passed,success,universal,512,256,128,f16:column,f16:row,f16:column,f16:column,1,0,serial,1,1,heuristic,invalid,invalid,false,false,1,tensorop,f32,256,128,32,1,1,1,0,0,0,2,4,2,1,16,16,4,70,75,458752,33816576,73,0.0193203,22.1138,1750.31
10,CUTLASS,gemm,cutlass_tensorop_f16_s884gemm_f16_256x128_32x2_tn_align8,passed,success,universal,512,256,128,f16:row,f16:column,f16:column,f16:column,1,0,serial,1,1,heuristic,invalid,invalid,false,false,1,tensorop,f32,256,128,32,1,1,1,0,0,0,2,4,2,1,16,16,4,70,75,458752,33816576,73,0.0195546,21.8489,1729.34
10,CUTLASS,gemm,cutlass_tensorop_f16_s884gemm_f16_256x128_32x2_tt_align8,passed,success,universal,512,256,128,f16:row,f16:row,f16:column,f16:column,1,0,serial,1,1,heuristic,invalid,invalid,false,false,1,tensorop,f32,256,128,32,1,1,1,0,0,0,2,4,2,1,16,16,4,70,75,458752,33816576,73,0.0193706,22.0565,1745.77
11,CUTLASS,gemm,cutlass_simt_sgemm_128x128_8x2_nn_align1,passed,success,universal,1024,256,128,f32:column,f32:column,f32:column,f32:column,1,0,serial,1,1,heuristic,invalid,invalid,false,false,1,simt,f32,128,128,8,1,1,1,0,0,0,2,4,2,1,1,1,1,50,1024,1703936,67633152,39,0.0335021,47.3676,2018.77
11,CUTLASS,gemm,cutlass_simt_sgemm_128x128_8x2_nt_align1,passed,success,universal,1024,256,128,f32:column,f32:row,f32:column,f32:column,1,0,serial,1,1,heuristic,invalid,invalid,false,false,1,simt,f32,128,128,8,1,1,1,0,0,0,2,4,2,1,1,1,1,50,1024,1703936,67633152,39,0.0338986,46.8136,1995.16
11,CUTLASS,gemm,cutlass_simt_sgemm_128x128_8x2_tn_align1,passed,success,universal,1024,256,128,f32:row,f32:column,f32:column,f32:column,1,0,serial,1,1,heuristic,invalid,invalid,false,false,1,simt,f32,128,128,8,1,1,1,0,0,0,2,4,2,1,1,1,1,50,1024,1703936,67633152,39,0.0339728,46.7113,1990.8
11,CUTLASS,gemm,cutlass_simt_sgemm_128x128_8x2_tt_align1,passed,success,universal,1024,256,128,f32:row,f32:row,f32:column,f32:column,1,0,serial,1,1,heuristic,invalid,invalid,false,false,1,simt,f32,128,128,8,1,1,1,0,0,0,2,4,2,1,1,1,1,50,1024,1703936,67633152,39,0.0335958,47.2354,2013.14
11,CUTLASS,gemm,cutlass_tensorop_s884gemm_f16_256x128_32x2_nn_align8,passed,success,universal,1024,256,128,f16:column,f16:column,f32:column,f32:column,1,0,serial,1,1,heuristic,invalid,invalid,false,false,1,tensorop,f32,256,128,32,1,1,1,0,0,0,2,4,2,1,16,16,4,70,75,1376256,67633152,49,0.0192938,66.4328,3505.44
11,CUTLASS,gemm,cutlass_tensorop_s884gemm_f16_256x128_32x2_nt_align8,passed,success,universal,1024,256,128,f16:column,f16:row,f32:column,f32:column,1,0,serial,1,1,heuristic,invalid,invalid,false,false,1,tensorop,f32,256,128,32,1,1,1,0,0,0,2,4,2,1,16,16,4,70,75,1376256,67633152,49,0.0193069,66.3876,3503.06
11,CUTLASS,gemm,cutlass_tensorop_s884gemm_f16_256x128_32x2_tn_align8,passed,success,universal,1024,256,128,f16:row,f16:column,f32:column,f32:column,1,0,serial,1,1,heuristic,invalid,invalid,false,false,1,tensorop,f32,256,128,32,1,1,1,0,0,0,2,4,2,1,16,16,4,70,75,1376256,67633152,49,0.0196333,65.284,3444.82
11,CUTLASS,gemm,cutlass_tensorop_s884gemm_f16_256x128_32x2_tt_align8,passed,success,universal,1024,256,128,f16:row,f16:row,f32:column,f32:column,1,0,serial,1,1,heuristic,invalid,invalid,false,false,1,tensorop,f32,256,128,32,1,1,1,0,0,0,2,4,2,1,16,16,4,70,75,1376256,67633152,49,0.019415,66.0178,3483.54
11,CUTLASS,gemm,cutlass_tensorop_f16_s884gemm_f16_256x128_32x2_nn_align8,passed,success,universal,1024,256,128,f16:column,f16:column,f16:column,f16:column,1,0,serial,1,1,heuristic,invalid,invalid,false,false,1,tensorop,f32,256,128,32,1,1,1,0,0,0,2,4,2,1,16,16,4,70,75,851968,67633152,79,0.0193504,41.0047,3495.18
11,CUTLASS,gemm,cutlass_tensorop_f16_s884gemm_f16_256x128_32x2_nt_align8,passed,success,universal,1024,256,128,f16:column,f16:row,f16:column,f16:column,1,0,serial,1,1,heuristic,invalid,invalid,false,false,1,tensorop,f32,256,128,32,1,1,1,0,0,0,2,4,2,1,16,16,4,70,75,851968,67633152,79,0.0194176,40.8628,3483.09
11,CUTLASS,gemm,cutlass_tensorop_f16_s884gemm_f16_256x128_32x2_tn_align8,passed,success,universal,1024,256,128,f16:row,f16:column,f16:column,f16:column,1,0,serial,1,1,heuristic,invalid,invalid,false,false,1,tensorop,f32,256,128,32,1,1,1,0,0,0,2,4,2,1,16,16,4,70,75,851968,67633152,79,0.0198416,39.9896,3408.65
11,CUTLASS,gemm,cutlass_tensorop_f16_s884gemm_f16_256x128_32x2_tt_align8,passed,success,universal,1024,256,128,f16:row,f16:row,f16:column,f16:column,1,0,serial,1,1,heuristic,invalid,invalid,false,false,1,tensorop,f32,256,128,32,1,1,1,0,0,0,2,4,2,1,16,16,4,70,75,851968,67633152,79,0.0195536,40.5786,3458.86
12,CUTLASS,gemm,cutlass_simt_sgemm_128x128_8x2_nn_align1,passed,success,universal,2048,256,128,f32:column,f32:column,f32:column,f32:column,1,0,serial,1,1,heuristic,invalid,invalid,false,false,1,simt,f32,128,128,8,1,1,1,0,0,0,2,4,2,1,1,1,1,50,1024,3276800,135266304,41,0.0336787,90.6138,4016.37
12,CUTLASS,gemm,cutlass_simt_sgemm_128x128_8x2_nt_align1,passed,success,universal,2048,256,128,f32:column,f32:row,f32:column,f32:column,1,0,serial,1,1,heuristic,invalid,invalid,false,false,1,simt,f32,128,128,8,1,1,1,0,0,0,2,4,2,1,1,1,1,50,1024,3276800,135266304,41,0.0340851,89.5334,3968.49
12,CUTLASS,gemm,cutlass_simt_sgemm_128x128_8x2_tn_align1,passed,success,universal,2048,256,128,f32:row,f32:column,f32:column,f32:column,1,0,serial,1,1,heuristic,invalid,invalid,false,false,1,simt,f32,128,128,8,1,1,1,0,0,0,2,4,2,1,1,1,1,50,1024,3276800,135266304,41,0.034241,89.1259,3950.42
12,CUTLASS,gemm,cutlass_simt_sgemm_128x128_8x2_tt_align1,passed,success,universal,2048,256,128,f32:row,f32:row,f32:column,f32:column,1,0,serial,1,1,heuristic,invalid,invalid,false,false,1,simt,f32,128,128,8,1,1,1,0,0,0,2,4,2,1,1,1,1,50,1024,3276800,135266304,41,0.0338595,90.13,3994.93
12,CUTLASS,gemm,cutlass_tensorop_s884gemm_f16_256x128_32x2_nn_align8,passed,success,universal,2048,256,128,f16:column,f16:column,f32:column,f32:column,1,0,serial,1,1,heuristic,invalid,invalid,false,false,1,tensorop,f32,256,128,32,1,1,1,0,0,0,2,4,2,1,16,16,4,70,75,2686976,135266304,50,0.0193178,129.541,7002.17
12,CUTLASS,gemm,cutlass_tensorop_s884gemm_f16_256x128_32x2_nt_align8,passed,success,universal,2048,256,128,f16:column,f16:row,f32:column,f32:column,1,0,serial,1,1,heuristic,invalid,invalid,false,false,1,tensorop,f32,256,128,32,1,1,1,0,0,0,2,4,2,1,16,16,4,70,75,2686976,135266304,50,0.0194403,128.724,6958.03
12,CUTLASS,gemm,cutlass_tensorop_s884gemm_f16_256x128_32x2_tn_align8,passed,success,universal,2048,256,128,f16:row,f16:column,f32:column,f32:column,1,0,serial,1,1,heuristic,invalid,invalid,false,false,1,tensorop,f32,256,128,32,1,1,1,0,0,0,2,4,2,1,16,16,4,70,75,2686976,135266304,50,0.019775,126.545,6840.25
12,CUTLASS,gemm,cutlass_tensorop_s884gemm_f16_256x128_32x2_tt_align8,passed,success,universal,2048,256,128,f16:row,f16:row,f32:column,f32:column,1,0,serial,1,1,heuristic,invalid,invalid,false,false,1,tensorop,f32,256,128,32,1,1,1,0,0,0,2,4,2,1,16,16,4,70,75,2686976,135266304,50,0.0195878,127.755,6905.63
12,CUTLASS,gemm,cutlass_tensorop_f16_s884gemm_f16_256x128_32x2_nn_align8,passed,success,universal,2048,256,128,f16:column,f16:column,f16:column,f16:column,1,0,serial,1,1,heuristic,invalid,invalid,false,false,1,tensorop,f32,256,128,32,1,1,1,0,0,0,2,4,2,1,16,16,4,70,75,1638400,135266304,82,0.0194771,78.3421,6944.88
12,CUTLASS,gemm,cutlass_tensorop_f16_s884gemm_f16_256x128_32x2_nt_align8,passed,success,universal,2048,256,128,f16:column,f16:row,f16:column,f16:column,1,0,serial,1,1,heuristic,invalid,invalid,false,false,1,tensorop,f32,256,128,32,1,1,1,0,0,0,2,4,2,1,16,16,4,70,75,1638400,135266304,82,0.0194925,78.2804,6939.41
12,CUTLASS,gemm,cutlass_tensorop_f16_s884gemm_f16_256x128_32x2_tn_align8,passed,success,universal,2048,256,128,f16:row,f16:column,f16:column,f16:column,1,0,serial,1,1,heuristic,invalid,invalid,false,false,1,tensorop,f32,256,128,32,1,1,1,0,0,0,2,4,2,1,16,16,4,70,75,1638400,135266304,82,0.0199219,76.593,6789.82
12,CUTLASS,gemm,cutlass_tensorop_f16_s884gemm_f16_256x128_32x2_tt_align8,passed,success,universal,2048,256,128,f16:row,f16:row,f16:column,f16:column,1,0,serial,1,1,heuristic,invalid,invalid,false,false,1,tensorop,f32,256,128,32,1,1,1,0,0,0,2,4,2,1,16,16,4,70,75,1638400,135266304,82,0.0197808,77.1394,6838.26
13,CUTLASS,gemm,cutlass_simt_sgemm_128x128_8x2_nn_align1,passed,success,universal,4096,256,128,f32:column,f32:column,f32:column,f32:column,1,0,serial,1,1,heuristic,invalid,invalid,false,false,1,simt,f32,128,128,8,1,1,1,0,0,0,2,4,2,1,1,1,1,50,1024,6422528,270532608,42,0.0362666,164.93,7459.56
13,CUTLASS,gemm,cutlass_simt_sgemm_128x128_8x2_nt_align1,passed,success,universal,4096,256,128,f32:column,f32:row,f32:column,f32:column,1,0,serial,1,1,heuristic,invalid,invalid,false,false,1,simt,f32,128,128,8,1,1,1,0,0,0,2,4,2,1,1,1,1,50,1024,6422528,270532608,42,0.0371501,161.008,7282.15
13,CUTLASS,gemm,cutlass_simt_sgemm_128x128_8x2_tn_align1,passed,success,universal,4096,256,128,f32:row,f32:column,f32:column,f32:column,1,0,serial,1,1,heuristic,invalid,invalid,false,false,1,simt,f32,128,128,8,1,1,1,0,0,0,2,4,2,1,1,1,1,50,1024,6422528,270532608,42,0.0371472,161.02,7282.72
13,CUTLASS,gemm,cutlass_simt_sgemm_128x128_8x2_tt_align1,passed,success,universal,4096,256,128,f32:row,f32:row,f32:column,f32:column,1,0,serial,1,1,heuristic,invalid,invalid,false,false,1,simt,f32,128,128,8,1,1,1,0,0,0,2,4,2,1,1,1,1,50,1024,6422528,270532608,42,0.0366074,163.395,7390.12
13,CUTLASS,gemm,cutlass_tensorop_s884gemm_f16_256x128_32x2_nn_align8,passed,success,universal,4096,256,128,f16:column,f16:column,f32:column,f32:column,1,0,serial,1,1,heuristic,invalid,invalid,false,false,1,tensorop,f32,256,128,32,1,1,1,0,0,0,2,4,2,1,16,16,4,70,75,5308416,270532608,50,0.0196771,251.249,13748.6
13,CUTLASS,gemm,cutlass_tensorop_s884gemm_f16_256x128_32x2_nt_align8,passed,success,universal,4096,256,128,f16:column,f16:row,f32:column,f32:column,1,0,serial,1,1,heuristic,invalid,invalid,false,false,1,tensorop,f32,256,128,32,1,1,1,0,0,0,2,4,2,1,16,16,4,70,75,5308416,270532608,50,0.0198128,249.528,13654.4
13,CUTLASS,gemm,cutlass_tensorop_s884gemm_f16_256x128_32x2_tn_align8,passed,success,universal,4096,256,128,f16:row,f16:column,f32:column,f32:column,1,0,serial,1,1,heuristic,invalid,invalid,false,false,1,tensorop,f32,256,128,32,1,1,1,0,0,0,2,4,2,1,16,16,4,70,75,5308416,270532608,50,0.0200186,246.963,13514.1
13,CUTLASS,gemm,cutlass_tensorop_s884gemm_f16_256x128_32x2_tt_align8,passed,success,universal,4096,256,128,f16:row,f16:row,f32:column,f32:column,1,0,serial,1,1,heuristic,invalid,invalid,false,false,1,tensorop,f32,256,128,32,1,1,1,0,0,0,2,4,2,1,16,16,4,70,75,5308416,270532608,50,0.0199475,247.843,13562.2
13,CUTLASS,gemm,cutlass_tensorop_f16_s884gemm_f16_256x128_32x2_nn_align8,passed,success,universal,4096,256,128,f16:column,f16:column,f16:column,f16:column,1,0,serial,1,1,heuristic,invalid,invalid,false,false,1,tensorop,f32,256,128,32,1,1,1,0,0,0,2,4,2,1,16,16,4,70,75,3211264,270532608,84,0.019753,151.406,13695.8
13,CUTLASS,gemm,cutlass_tensorop_f16_s884gemm_f16_256x128_32x2_nt_align8,passed,success,universal,4096,256,128,f16:column,f16:row,f16:column,f16:column,1,0,serial,1,1,heuristic,invalid,invalid,false,false,1,tensorop,f32,256,128,32,1,1,1,0,0,0,2,4,2,1,16,16,4,70,75,3211264,270532608,84,0.0199507,149.905,13560
13,CUTLASS,gemm,cutlass_tensorop_f16_s884gemm_f16_256x128_32x2_tn_align8,passed,success,universal,4096,256,128,f16:row,f16:column,f16:column,f16:column,1,0,serial,1,1,heuristic,invalid,invalid,false,false,1,tensorop,f32,256,128,32,1,1,1,0,0,0,2,4,2,1,16,16,4,70,75,3211264,270532608,84,0.0201683,148.288,13413.7
13,CUTLASS,gemm,cutlass_tensorop_f16_s884gemm_f16_256x128_32x2_tt_align8,passed,success,universal,4096,256,128,f16:row,f16:row,f16:column,f16:column,1,0,serial,1,1,heuristic,invalid,invalid,false,false,1,tensorop,f32,256,128,32,1,1,1,0,0,0,2,4,2,1,16,16,4,70,75,3211264,270532608,84,0.0201395,148.5,13432.9
14,CUTLASS,gemm,cutlass_simt_sgemm_128x128_8x2_nn_align1,passed,success,universal,8192,256,128,f32:column,f32:column,f32:column,f32:column,1,0,serial,1,1,heuristic,invalid,invalid,false,false,1,simt,f32,128,128,8,1,1,1,0,0,0,2,4,2,1,1,1,1,50,1024,12713984,541065216,42,0.069968,169.232,7733.04
14,CUTLASS,gemm,cutlass_simt_sgemm_128x128_8x2_nt_align1,passed,success,universal,8192,256,128,f32:column,f32:row,f32:column,f32:column,1,0,serial,1,1,heuristic,invalid,invalid,false,false,1,simt,f32,128,128,8,1,1,1,0,0,0,2,4,2,1,1,1,1,50,1024,12713984,541065216,42,0.0707818,167.286,7644.13
14,CUTLASS,gemm,cutlass_simt_sgemm_128x128_8x2_tn_align1,passed,success,universal,8192,256,128,f32:row,f32:column,f32:column,f32:column,1,0,serial,1,1,heuristic,invalid,invalid,false,false,1,simt,f32,128,128,8,1,1,1,0,0,0,2,4,2,1,1,1,1,50,1024,12713984,541065216,42,0.0723222,163.723,7481.31
14,CUTLASS,gemm,cutlass_simt_sgemm_128x128_8x2_tt_align1,passed,success,universal,8192,256,128,f32:row,f32:row,f32:column,f32:column,1,0,serial,1,1,heuristic,invalid,invalid,false,false,1,simt,f32,128,128,8,1,1,1,0,0,0,2,4,2,1,1,1,1,50,1024,12713984,541065216,42,0.0711382,166.448,7605.83
14,CUTLASS,gemm,cutlass_tensorop_s884gemm_f16_256x128_32x2_nn_align8,passed,success,universal,8192,256,128,f16:column,f16:column,f32:column,f32:column,1,0,serial,1,1,heuristic,invalid,invalid,false,false,1,tensorop,f32,256,128,32,1,1,1,0,0,0,2,4,2,1,16,16,4,70,75,10551296,541065216,51,0.0234672,418.74,23056.2
14,CUTLASS,gemm,cutlass_tensorop_s884gemm_f16_256x128_32x2_nt_align8,passed,success,universal,8192,256,128,f16:column,f16:row,f32:column,f32:column,1,0,serial,1,1,heuristic,invalid,invalid,false,false,1,tensorop,f32,256,128,32,1,1,1,0,0,0,2,4,2,1,16,16,4,70,75,10551296,541065216,51,0.0234406,419.215,23082.4
14,CUTLASS,gemm,cutlass_tensorop_s884gemm_f16_256x128_32x2_tn_align8,passed,success,universal,8192,256,128,f16:row,f16:column,f32:column,f32:column,1,0,serial,1,1,heuristic,invalid,invalid,false,false,1,tensorop,f32,256,128,32,1,1,1,0,0,0,2,4,2,1,16,16,4,70,75,10551296,541065216,51,0.0238198,412.541,22714.9
14,CUTLASS,gemm,cutlass_tensorop_s884gemm_f16_256x128_32x2_tt_align8,passed,success,universal,8192,256,128,f16:row,f16:row,f32:column,f32:column,1,0,serial,1,1,heuristic,invalid,invalid,false,false,1,tensorop,f32,256,128,32,1,1,1,0,0,0,2,4,2,1,16,16,4,70,75,10551296,541065216,51,0.0234819,418.478,23041.8
14,CUTLASS,gemm,cutlass_tensorop_f16_s884gemm_f16_256x128_32x2_nn_align8,passed,success,universal,8192,256,128,f16:column,f16:column,f16:column,f16:column,1,0,serial,1,1,heuristic,invalid,invalid,false,false,1,tensorop,f32,256,128,32,1,1,1,0,0,0,2,4,2,1,16,16,4,70,75,6356992,541065216,85,0.0218099,271.455,24808.2
14,CUTLASS,gemm,cutlass_tensorop_f16_s884gemm_f16_256x128_32x2_nt_align8,passed,success,universal,8192,256,128,f16:column,f16:row,f16:column,f16:column,1,0,serial,1,1,heuristic,invalid,invalid,false,false,1,tensorop,f32,256,128,32,1,1,1,0,0,0,2,4,2,1,16,16,4,70,75,6356992,541065216,85,0.0216778,273.11,24959.5
14,CUTLASS,gemm,cutlass_tensorop_f16_s884gemm_f16_256x128_32x2_tn_align8,passed,success,universal,8192,256,128,f16:row,f16:column,f16:column,f16:column,1,0,serial,1,1,heuristic,invalid,invalid,false,false,1,tensorop,f32,256,128,32,1,1,1,0,0,0,2,4,2,1,16,16,4,70,75,6356992,541065216,85,0.0220899,268.014,24493.8
14,CUTLASS,gemm,cutlass_tensorop_f16_s884gemm_f16_256x128_32x2_tt_align8,passed,success,universal,8192,256,128,f16:row,f16:row,f16:column,f16:column,1,0,serial,1,1,heuristic,invalid,invalid,false,false,1,tensorop,f32,256,128,32,1,1,1,0,0,0,2,4,2,1,16,16,4,70,75,6356992,541065216,85,0.0220557,268.43,24531.8
15,CUTLASS,gemm,cutlass_simt_sgemm_128x128_8x2_nn_align1,passed,success,universal,128,512,128,f32:column,f32:column,f32:column,f32:column,1,0,serial,1,1,heuristic,invalid,invalid,false,false,1,simt,f32,128,128,8,1,1,1,0,0,0,2,4,2,1,1,1,1,50,1024,589824,16908288,28,0.0336048,16.3464,503.151
15,CUTLASS,gemm,cutlass_simt_sgemm_128x128_8x2_nt_align1,passed,success,universal,128,512,128,f32:column,f32:row,f32:column,f32:column,1,0,serial,1,1,heuristic,invalid,invalid,false,false,1,simt,f32,128,128,8,1,1,1,0,0,0,2,4,2,1,1,1,1,50,1024,589824,16908288,28,0.0339325,16.1885,498.292
15,CUTLASS,gemm,cutlass_simt_sgemm_128x128_8x2_tn_align1,passed,success,universal,128,512,128,f32:row,f32:column,f32:column,f32:column,1,0,serial,1,1,heuristic,invalid,invalid,false,false,1,simt,f32,128,128,8,1,1,1,0,0,0,2,4,2,1,1,1,1,50,1024,589824,16908288,28,0.0339786,16.1666,497.616
15,CUTLASS,gemm,cutlass_simt_sgemm_128x128_8x2_tt_align1,passed,success,universal,128,512,128,f32:row,f32:row,f32:column,f32:column,1,0,serial,1,1,heuristic,invalid,invalid,false,false,1,simt,f32,128,128,8,1,1,1,0,0,0,2,4,2,1,1,1,1,50,1024,589824,16908288,28,0.0335562,16.3701,503.88
15,CUTLASS,gemm,cutlass_tensorop_s884gemm_f16_256x128_32x2_nn_align8,passed,success,universal,128,512,128,f16:column,f16:column,f32:column,f32:column,1,0,serial,1,1,heuristic,invalid,invalid,false,false,1,tensorop,f32,256,128,32,1,1,1,0,0,0,2,4,2,1,16,16,4,70,75,425984,16908288,39,0.0193702,20.4813,872.9
15,CUTLASS,gemm,cutlass_tensorop_s884gemm_f16_256x128_32x2_nt_align8,passed,success,universal,128,512,128,f16:column,f16:row,f32:column,f32:column,1,0,serial,1,1,heuristic,invalid,invalid,false,false,1,tensorop,f32,256,128,32,1,1,1,0,0,0,2,4,2,1,16,16,4,70,75,425984,16908288,39,0.019423,20.4257,870.527
15,CUTLASS,gemm,cutlass_tensorop_s884gemm_f16_256x128_32x2_tn_align8,passed,success,universal,128,512,128,f16:row,f16:column,f32:column,f32:column,1,0,serial,1,1,heuristic,invalid,invalid,false,false,1,tensorop,f32,256,128,32,1,1,1,0,0,0,2,4,2,1,16,16,4,70,75,425984,16908288,39,0.0194912,20.3542,867.483
15,CUTLASS,gemm,cutlass_tensorop_s884gemm_f16_256x128_32x2_tt_align8,passed,success,universal,128,512,128,f16:row,f16:row,f32:column,f32:column,1,0,serial,1,1,heuristic,invalid,invalid,false,false,1,tensorop,f32,256,128,32,1,1,1,0,0,0,2,4,2,1,16,16,4,70,75,425984,16908288,39,0.019488,20.3576,867.626
15,CUTLASS,gemm,cutlass_tensorop_f16_s884gemm_f16_256x128_32x2_nn_align8,passed,success,universal,128,512,128,f16:column,f16:column,f16:column,f16:column,1,0,serial,1,1,heuristic,invalid,invalid,false,false,1,tensorop,f32,256,128,32,1,1,1,0,0,0,2,4,2,1,16,16,4,70,75,294912,16908288,57,0.019391,14.1642,871.964
15,CUTLASS,gemm,cutlass_tensorop_f16_s884gemm_f16_256x128_32x2_nt_align8,passed,success,universal,128,512,128,f16:column,f16:row,f16:column,f16:column,1,0,serial,1,1,heuristic,invalid,invalid,false,false,1,tensorop,f32,256,128,32,1,1,1,0,0,0,2,4,2,1,16,16,4,70,75,294912,16908288,57,0.0193824,14.1705,872.353
15,CUTLASS,gemm,cutlass_tensorop_f16_s884gemm_f16_256x128_32x2_tn_align8,passed,success,universal,128,512,128,f16:row,f16:column,f16:column,f16:column,1,0,serial,1,1,heuristic,invalid,invalid,false,false,1,tensorop,f32,256,128,32,1,1,1,0,0,0,2,4,2,1,16,16,4,70,75,294912,16908288,57,0.0195904,14.02,863.09
15,CUTLASS,gemm,cutlass_tensorop_f16_s884gemm_f16_256x128_32x2_tt_align8,passed,success,universal,128,512,128,f16:row,f16:row,f16:column,f16:column,1,0,serial,1,1,heuristic,invalid,invalid,false,false,1,tensorop,f32,256,128,32,1,1,1,0,0,0,2,4,2,1,16,16,4,70,75,294912,16908288,57,0.0194285,14.1369,870.284
16,CUTLASS,gemm,cutlass_simt_sgemm_128x128_8x2_nn_align1,passed,success,universal,256,512,128,f32:column,f32:column,f32:column,f32:column,1,0,serial,1,1,heuristic,invalid,invalid,false,false,1,simt,f32,128,128,8,1,1,1,0,0,0,2,4,2,1,1,1,1,50,1024,917504,33816576,36,0.033623,25.4139,1005.76
16,CUTLASS,gemm,cutlass_simt_sgemm_128x128_8x2_nt_align1,passed,success,universal,256,512,128,f32:column,f32:row,f32:column,f32:column,1,0,serial,1,1,heuristic,invalid,invalid,false,false,1,simt,f32,128,128,8,1,1,1,0,0,0,2,4,2,1,1,1,1,50,1024,917504,33816576,36,0.0340333,25.1075,993.633
16,CUTLASS,gemm,cutlass_simt_sgemm_128x128_8x2_tn_align1,passed,success,universal,256,512,128,f32:row,f32:column,f32:column,f32:column,1,0,serial,1,1,heuristic,invalid,invalid,false,false,1,simt,f32,128,128,8,1,1,1,0,0,0,2,4,2,1,1,1,1,50,1024,917504,33816576,36,0.0341238,25.0409,990.996
16,CUTLASS,gemm,cutlass_simt_sgemm_128x128_8x2_tt_align1,passed,success,universal,256,512,128,f32:row,f32:row,f32:column,f32:column,1,0,serial,1,1,heuristic,invalid,invalid,false,false,1,simt,f32,128,128,8,1,1,1,0,0,0,2,4,2,1,1,1,1,50,1024,917504,33816576,36,0.0335664,25.4568,1007.45
16,CUTLASS,gemm,cutlass_tensorop_s884gemm_f16_256x128_32x2_nn_align8,passed,success,universal,256,512,128,f16:column,f16:column,f32:column,f32:column,1,0,serial,1,1,heuristic,invalid,invalid,false,false,1,tensorop,f32,256,128,32,1,1,1,0,0,0,2,4,2,1,16,16,4,70,75,720896,33816576,46,0.0193446,34.7066,1748.11
16,CUTLASS,gemm,cutlass_tensorop_s884gemm_f16_256x128_32x2_nt_align8,passed,success,universal,256,512,128,f16:column,f16:row,f32:column,f32:column,1,0,serial,1,1,heuristic,invalid,invalid,false,false,1,tensorop,f32,256,128,32,1,1,1,0,0,0,2,4,2,1,16,16,4,70,75,720896,33816576,46,0.0193891,34.627,1744.1
16,CUTLASS,gemm,cutlass_tensorop_s884gemm_f16_256x128_32x2_tn_align8,passed,success,universal,256,512,128,f16:row,f16:column,f32:column,f32:column,1,0,serial,1,1,heuristic,invalid,invalid,false,false,1,tensorop,f32,256,128,32,1,1,1,0,0,0,2,4,2,1,16,16,4,70,75,720896,33816576,46,0.0196128,34.2321,1724.21
16,CUTLASS,gemm,cutlass_tensorop_s884gemm_f16_256x128_32x2_tt_align8,passed,success,universal,256,512,128,f16:row,f16:row,f32:column,f32:column,1,0,serial,1,1,heuristic,invalid,invalid,false,false,1,tensorop,f32,256,128,32,1,1,1,0,0,0,2,4,2,1,16,16,4,70,75,720896,33816576,46,0.0194442,34.529,1739.16
16,CUTLASS,gemm,cutlass_tensorop_f16_s884gemm_f16_256x128_32x2_nn_align8,passed,success,universal,256,512,128,f16:column,f16:column,f16:column,f16:column,1,0,serial,1,1,heuristic,invalid,invalid,false,false,1,tensorop,f32,256,128,32,1,1,1,0,0,0,2,4,2,1,16,16,4,70,75,458752,33816576,73,0.0194125,22.0088,1742
16,CUTLASS,gemm,cutlass_tensorop_f16_s884gemm_f16_256x128_32x2_nt_align8,passed,success,universal,256,512,128,f16:column,f16:row,f16:column,f16:column,1,0,serial,1,1,heuristic,invalid,invalid,false,false,1,tensorop,f32,256,128,32,1,1,1,0,0,0,2,4,2,1,16,16,4,70,75,458752,33816576,73,0.0194762,21.9369,1736.31
16,CUTLASS,gemm,cutlass_tensorop_f16_s884gemm_f16_256x128_32x2_tn_align8,passed,success,universal,256,512,128,f16:row,f16:column,f16:column,f16:column,1,0,serial,1,1,heuristic,invalid,invalid,false,false,1,tensorop,f32,256,128,32,1,1,1,0,0,0,2,4,2,1,16,16,4,70,75,458752,33816576,73,0.0197056,21.6815,1716.09
16,CUTLASS,gemm,cutlass_tensorop_f16_s884gemm_f16_256x128_32x2_tt_align8,passed,success,universal,256,512,128,f16:row,f16:row,f16:column,f16:column,1,0,serial,1,1,heuristic,invalid,invalid,false,false,1,tensorop,f32,256,128,32,1,1,1,0,0,0,2,4,2,1,16,16,4,70,75,458752,33816576,73,0.0194934,21.9174,1734.77
17,CUTLASS,gemm,cutlass_simt_sgemm_128x128_8x2_nn_align1,passed,success,universal,512,512,128,f32:column,f32:column,f32:column,f32:column,1,0,serial,1,1,heuristic,invalid,invalid,false,false,1,simt,f32,128,128,8,1,1,1,0,0,0,2,4,2,1,1,1,1,50,1024,1572864,67633152,43,0.0335059,43.719,2018.54
17,CUTLASS,gemm,cutlass_simt_sgemm_128x128_8x2_nt_align1,passed,success,universal,512,512,128,f32:column,f32:row,f32:column,f32:column,1,0,serial,1,1,heuristic,invalid,invalid,false,false,1,simt,f32,128,128,8,1,1,1,0,0,0,2,4,2,1,1,1,1,50,1024,1572864,67633152,43,0.0339238,43.1804,1993.68
17,CUTLASS,gemm,cutlass_simt_sgemm_128x128_8x2_tn_align1,passed,success,universal,512,512,128,f32:row,f32:column,f32:column,f32:column,1,0,serial,1,1,heuristic,invalid,invalid,false,false,1,simt,f32,128,128,8,1,1,1,0,0,0,2,4,2,1,1,1,1,50,1024,1572864,67633152,43,0.0340346,43.0399,1987.19
17,CUTLASS,gemm,cutlass_simt_sgemm_128x128_8x2_tt_align1,passed,success,universal,512,512,128,f32:row,f32:row,f32:column,f32:column,1,0,serial,1,1,heuristic,invalid,invalid,false,false,1,simt,f32,128,128,8,1,1,1,0,0,0,2,4,2,1,1,1,1,50,1024,1572864,67633152,43,0.033608,43.5862,2012.41
17,CUTLASS,gemm,cutlass_tensorop_s884gemm_f16_256x128_32x2_nn_align8,passed,success,universal,512,512,128,f16:column,f16:column,f32:column,f32:column,1,0,serial,1,1,heuristic,invalid,invalid,false,false,1,tensorop,f32,256,128,32,1,1,1,0,0,0,2,4,2,1,16,16,4,70,75,1310720,67633152,51,0.0192797,63.3155,3508
17,CUTLASS,gemm,cutlass_tensorop_s884gemm_f16_256x128_32x2_nt_align8,passed,success,universal,512,512,128,f16:column,f16:row,f32:column,f32:column,1,0,serial,1,1,heuristic,invalid,invalid,false,false,1,tensorop,f32,256,128,32,1,1,1,0,0,0,2,4,2,1,16,16,4,70,75,1310720,67633152,51,0.0193408,63.1154,3496.92
17,CUTLASS,gemm,cutlass_tensorop_s884gemm_f16_256x128_32x2_tn_align8,passed,success,universal,512,512,128,f16:row,f16:column,f32:column,f32:column,1,0,serial,1,1,heuristic,invalid,invalid,false,false,1,tensorop,f32,256,128,32,1,1,1,0,0,0,2,4,2,1,16,16,4,70,75,1310720,67633152,51,0.0196554,62.1054,3440.95
17,CUTLASS,gemm,cutlass_tensorop_s884gemm_f16_256x128_32x2_tt_align8,passed,success,universal,512,512,128,f16:row,f16:row,f32:column,f32:column,1,0,serial,1,1,heuristic,invalid,invalid,false,false,1,tensorop,f32,256,128,32,1,1,1,0,0,0,2,4,2,1,16,16,4,70,75,1310720,67633152,51,0.0194365,62.8047,3479.7
17,CUTLASS,gemm,cutlass_tensorop_f16_s884gemm_f16_256x128_32x2_nn_align8,passed,success,universal,512,512,128,f16:column,f16:column,f16:column,f16:column,1,0,serial,1,1,heuristic,invalid,invalid,false,false,1,tensorop,f32,256,128,32,1,1,1,0,0,0,2,4,2,1,16,16,4,70,75,786432,67633152,86,0.01944,37.676,3479.07
17,CUTLASS,gemm,cutlass_tensorop_f16_s884gemm_f16_256x128_32x2_nt_align8,passed,success,universal,512,512,128,f16:column,f16:row,f16:column,f16:column,1,0,serial,1,1,heuristic,invalid,invalid,false,false,1,tensorop,f32,256,128,32,1,1,1,0,0,0,2,4,2,1,16,16,4,70,75,786432,67633152,86,0.0193776,37.7973,3490.27
17,CUTLASS,gemm,cutlass_tensorop_f16_s884gemm_f16_256x128_32x2_tn_align8,passed,success,universal,512,512,128,f16:row,f16:column,f16:column,f16:column,1,0,serial,1,1,heuristic,invalid,invalid,false,false,1,tensorop,f32,256,128,32,1,1,1,0,0,0,2,4,2,1,16,16,4,70,75,786432,67633152,86,0.0197824,37.0239,3418.85
17,CUTLASS,gemm,cutlass_tensorop_f16_s884gemm_f16_256x128_32x2_tt_align8,passed,success,universal,512,512,128,f16:row,f16:row,f16:column,f16:column,1,0,serial,1,1,heuristic,invalid,invalid,false,false,1,tensorop,f32,256,128,32,1,1,1,0,0,0,2,4,2,1,16,16,4,70,75,786432,67633152,86,0.0195856,37.3959,3453.21
18,CUTLASS,gemm,cutlass_simt_sgemm_128x128_8x2_nn_align1,passed,success,universal,1024,512,128,f32:column,f32:column,f32:column,f32:column,1,0,serial,1,1,heuristic,invalid,invalid,false,false,1,simt,f32,128,128,8,1,1,1,0,0,0,2,4,2,1,1,1,1,50,1024,2883584,135266304,46,0.033791,79.4751,4003.02
18,CUTLASS,gemm,cutlass_simt_sgemm_128x128_8x2_nt_align1,passed,success,universal,1024,512,128,f32:column,f32:row,f32:column,f32:column,1,0,serial,1,1,heuristic,invalid,invalid,false,false,1,simt,f32,128,128,8,1,1,1,0,0,0,2,4,2,1,1,1,1,50,1024,2883584,135266304,46,0.03416,78.6167,3959.79
18,CUTLASS,gemm,cutlass_simt_sgemm_128x128_8x2_tn_align1,passed,success,universal,1024,512,128,f32:row,f32:column,f32:column,f32:column,1,0,serial,1,1,heuristic,invalid,invalid,false,false,1,simt,f32,128,128,8,1,1,1,0,0,0,2,4,2,1,1,1,1,50,1024,2883584,135266304,46,0.0342477,78.4154,3949.65
18,CUTLASS,gemm,cutlass_simt_sgemm_128x128_8x2_tt_align1,passed,success,universal,1024,512,128,f32:row,f32:row,f32:column,f32:column,1,0,serial,1,1,heuristic,invalid,invalid,false,false,1,simt,f32,128,128,8,1,1,1,0,0,0,2,4,2,1,1,1,1,50,1024,2883584,135266304,46,0.0339344,79.1394,3986.11
18,CUTLASS,gemm,cutlass_tensorop_s884gemm_f16_256x128_32x2_nn_align8,passed,success,universal,1024,512,128,f16:column,f16:column,f32:column,f32:column,1,0,serial,1,1,heuristic,invalid,invalid,false,false,1,tensorop,f32,256,128,32,1,1,1,0,0,0,2,4,2,1,16,16,4,70,75,2490368,135266304,54,0.0194621,119.172,6950.25
18,CUTLASS,gemm,cutlass_tensorop_s884gemm_f16_256x128_32x2_nt_align8,passed,success,universal,1024,512,128,f16:column,f16:row,f32:column,f32:column,1,0,serial,1,1,heuristic,invalid,invalid,false,false,1,tensorop,f32,256,128,32,1,1,1,0,0,0,2,4,2,1,16,16,4,70,75,2490368,135266304,54,0.0193331,119.967,6996.61
18,CUTLASS,gemm,cutlass_tensorop_s884gemm_f16_256x128_32x2_tn_align8,passed,success,universal,1024,512,128,f16:row,f16:column,f32:column,f32:column,1,0,serial,1,1,heuristic,invalid,invalid,false,false,1,tensorop,f32,256,128,32,1,1,1,0,0,0,2,4,2,1,16,16,4,70,75,2490368,135266304,54,0.0197533,117.415,6847.79
