results/cutlass/cutlass_fp32.gemm.csv
Problem,Provider,OperationKind,Operation,Disposition,Status,gemm_kind,m,n,k,A,B,C,D,alpha,beta,split_k_mode,split_k_slices,batch_count,raster_order,runtime_input_datatype_a,runtime_input_datatype_b,use_pdl,enable_sm90_mixed_dtype_shuffle_test,swizzle_size,op_class,accum,cta_m,cta_n,cta_k,cluster_m,cluster_n,cluster_k,cluster_m_fallback,cluster_n_fallback,cluster_k_fallback,stages,warps_m,warps_n,warps_k,inst_m,inst_n,inst_k,min_cc,max_cc,Bytes,Flops,Flops/Byte,Runtime,GB/s,GFLOPs
1,CUTLASS,gemm,cutlass_simt_sgemm_128x128_8x2_nn_align1,passed,success,universal,128,128,128,f32:column,f32:column,f32:column,f32:column,1,0,serial,1,1,heuristic,invalid,invalid,false,false,1,simt,f32,128,128,8,1,1,1,0,0,0,2,4,2,1,1,1,1,50,1024,196608,4227072,21,0.0338845,5.40382,124.75
1,CUTLASS,gemm,cutlass_simt_sgemm_128x128_8x2_nt_align1,passed,success,universal,128,128,128,f32:column,f32:row,f32:column,f32:column,1,0,serial,1,1,heuristic,invalid,invalid,false,false,1,simt,f32,128,128,8,1,1,1,0,0,0,2,4,2,1,1,1,1,50,1024,196608,4227072,21,0.0332397,5.50864,127.169
1,CUTLASS,gemm,cutlass_simt_sgemm_128x128_8x2_tn_align1,passed,success,universal,128,128,128,f32:row,f32:column,f32:column,f32:column,1,0,serial,1,1,heuristic,invalid,invalid,false,false,1,simt,f32,128,128,8,1,1,1,0,0,0,2,4,2,1,1,1,1,50,1024,196608,4227072,21,0.0333504,5.49035,126.747
1,CUTLASS,gemm,cutlass_simt_sgemm_128x128_8x2_tt_align1,passed,success,universal,128,128,128,f32:row,f32:row,f32:column,f32:column,1,0,serial,1,1,heuristic,invalid,invalid,false,false,1,simt,f32,128,128,8,1,1,1,0,0,0,2,4,2,1,1,1,1,50,1024,196608,4227072,21,0.033449,5.47418,126.374
1,CUTLASS,gemm,cutlass_tensorop_s884gemm_f16_256x128_32x2_nn_align8,passed,success,universal,128,128,128,f16:column,f16:column,f32:column,f32:column,1,0,serial,1,1,heuristic,invalid,invalid,false,false,1,tensorop,f32,256,128,32,1,1,1,0,0,0,2,4,2,1,16,16,4,70,75,131072,4227072,32,0.0238442,5.11951,177.279
1,CUTLASS,gemm,cutlass_tensorop_s884gemm_f16_256x128_32x2_nt_align8,passed,success,universal,128,128,128,f16:column,f16:row,f32:column,f32:column,1,0,serial,1,1,heuristic,invalid,invalid,false,false,1,tensorop,f32,256,128,32,1,1,1,0,0,0,2,4,2,1,16,16,4,70,75,131072,4227072,32,0.0262698,4.6468,160.91
1,CUTLASS,gemm,cutlass_tensorop_s884gemm_f16_256x128_32x2_tn_align8,passed,success,universal,128,128,128,f16:row,f16:column,f32:column,f32:column,1,0,serial,1,1,heuristic,invalid,invalid,false,false,1,tensorop,f32,256,128,32,1,1,1,0,0,0,2,4,2,1,16,16,4,70,75,131072,4227072,32,0.0241066,5.06378,175.349
1,CUTLASS,gemm,cutlass_tensorop_s884gemm_f16_256x128_32x2_tt_align8,passed,success,universal,128,128,128,f16:row,f16:row,f32:column,f32:column,1,0,serial,1,1,heuristic,invalid,invalid,false,false,1,tensorop,f32,256,128,32,1,1,1,0,0,0,2,4,2,1,16,16,4,70,75,131072,4227072,32,0.0240867,5.06795,175.494
1,CUTLASS,gemm,cutlass_tensorop_f16_s884gemm_f16_256x128_32x2_nn_align8,passed,success,universal,128,128,128,f16:column,f16:column,f16:column,f16:column,1,0,serial,1,1,heuristic,invalid,invalid,false,false,1,tensorop,f32,256,128,32,1,1,1,0,0,0,2,4,2,1,16,16,4,70,75,98304,4227072,43,0.0251594,3.63891,168.012
1,CUTLASS,gemm,cutlass_tensorop_f16_s884gemm_f16_256x128_32x2_nt_align8,passed,success,universal,128,128,128,f16:column,f16:row,f16:column,f16:column,1,0,serial,1,1,heuristic,invalid,invalid,false,false,1,tensorop,f32,256,128,32,1,1,1,0,0,0,2,4,2,1,16,16,4,70,75,98304,4227072,43,0.0274822,3.33134,153.811
1,CUTLASS,gemm,cutlass_tensorop_f16_s884gemm_f16_256x128_32x2_tn_align8,passed,success,universal,128,128,128,f16:row,f16:column,f16:column,f16:column,1,0,serial,1,1,heuristic,invalid,invalid,false,false,1,tensorop,f32,256,128,32,1,1,1,0,0,0,2,4,2,1,16,16,4,70,75,98304,4227072,43,0.0252032,3.63258,167.72
1,CUTLASS,gemm,cutlass_tensorop_f16_s884gemm_f16_256x128_32x2_tt_align8,passed,success,universal,128,128,128,f16:row,f16:row,f16:column,f16:column,1,0,serial,1,1,heuristic,invalid,invalid,false,false,1,tensorop,f32,256,128,32,1,1,1,0,0,0,2,4,2,1,16,16,4,70,75,98304,4227072,43,0.025113,3.64564,168.322
1,CUTLASS,gemm,cutlass_tensorop_s1688gemm_f16_256x128_32x2_nn_align8,passed,success,universal,128,128,128,f16:column,f16:column,f32:column,f32:column,1,0,serial,1,1,heuristic,invalid,invalid,false,false,1,tensorop,f32,256,128,32,1,1,1,0,0,0,2,4,2,1,16,8,8,75,1024,131072,4227072,32,0.0139034,8.77991,304.032
1,CUTLASS,gemm,cutlass_tensorop_s1688gemm_f16_256x128_32x2_nt_align8,passed,success,universal,128,128,128,f16:column,f16:row,f32:column,f32:column,1,0,serial,1,1,heuristic,invalid,invalid,false,false,1,tensorop,f32,256,128,32,1,1,1,0,0,0,2,4,2,1,16,8,8,75,1024,131072,4227072,32,0.0137318,8.88958,307.83
1,CUTLASS,gemm,cutlass_tensorop_s1688gemm_f16_256x128_32x2_tn_align8,passed,success,universal,128,128,128,f16:row,f16:column,f32:column,f32:column,1,0,serial,1,1,heuristic,invalid,invalid,false,false,1,tensorop,f32,256,128,32,1,1,1,0,0,0,2,4,2,1,16,8,8,75,1024,131072,4227072,32,0.0139149,8.77265,303.781
1,CUTLASS,gemm,cutlass_tensorop_s1688gemm_f16_256x128_32x2_tt_align8,passed,success,universal,128,128,128,f16:row,f16:row,f32:column,f32:column,1,0,serial,1,1,heuristic,invalid,invalid,false,false,1,tensorop,f32,256,128,32,1,1,1,0,0,0,2,4,2,1,16,8,8,75,1024,131072,4227072,32,0.0138918,8.7872,304.285
1,CUTLASS,gemm,cutlass_tensorop_f16_s1688gemm_f16_256x128_32x2_nn_align8,passed,success,universal,128,128,128,f16:column,f16:column,f16:column,f16:column,1,0,serial,1,1,heuristic,invalid,invalid,false,false,1,tensorop,f32,256,128,32,1,1,1,0,0,0,2,4,2,1,16,8,8,75,1024,98304,4227072,43,0.0147853,6.19215,285.897
1,CUTLASS,gemm,cutlass_tensorop_f16_s1688gemm_f16_256x128_32x2_nt_align8,passed,success,universal,128,128,128,f16:column,f16:row,f16:column,f16:column,1,0,serial,1,1,heuristic,invalid,invalid,false,false,1,tensorop,f32,256,128,32,1,1,1,0,0,0,2,4,2,1,16,8,8,75,1024,98304,4227072,43,0.0147674,6.19967,286.244
1,CUTLASS,gemm,cutlass_tensorop_f16_s1688gemm_f16_256x128_32x2_tn_align8,passed,success,universal,128,128,128,f16:row,f16:column,f16:column,f16:column,1,0,serial,1,1,heuristic,invalid,invalid,false,false,1,tensorop,f32,256,128,32,1,1,1,0,0,0,2,4,2,1,16,8,8,75,1024,98304,4227072,43,0.0148083,6.18252,285.453
1,CUTLASS,gemm,cutlass_tensorop_f16_s1688gemm_f16_256x128_32x2_tt_align8,passed,success,universal,128,128,128,f16:row,f16:row,f16:column,f16:column,1,0,serial,1,1,heuristic,invalid,invalid,false,false,1,tensorop,f32,256,128,32,1,1,1,0,0,0,2,4,2,1,16,8,8,75,1024,98304,4227072,43,0.0147309,6.21502,286.953
2,CUTLASS,gemm,cutlass_simt_sgemm_128x128_8x2_nn_align1,passed,success,universal,256,128,128,f32:column,f32:column,f32:column,f32:column,1,0,serial,1,1,heuristic,invalid,invalid,false,false,1,simt,f32,128,128,8,1,1,1,0,0,0,2,4,2,1,1,1,1,50,1024,327680,8454144,25,0.0334714,9.11752,252.578
2,CUTLASS,gemm,cutlass_simt_sgemm_128x128_8x2_nt_align1,passed,success,universal,256,128,128,f32:column,f32:row,f32:column,f32:column,1,0,serial,1,1,heuristic,invalid,invalid,false,false,1,simt,f32,128,128,8,1,1,1,0,0,0,2,4,2,1,1,1,1,50,1024,327680,8454144,25,0.0332685,9.17312,254.119
2,CUTLASS,gemm,cutlass_simt_sgemm_128x128_8x2_tn_align1,passed,success,universal,256,128,128,f32:row,f32:column,f32:column,f32:column,1,0,serial,1,1,heuristic,invalid,invalid,false,false,1,simt,f32,128,128,8,1,1,1,0,0,0,2,4,2,1,1,1,1,50,1024,327680,8454144,25,0.0334582,9.12109,252.677
2,CUTLASS,gemm,cutlass_simt_sgemm_128x128_8x2_tt_align1,passed,success,universal,256,128,128,f32:row,f32:row,f32:column,f32:column,1,0,serial,1,1,heuristic,invalid,invalid,false,false,1,simt,f32,128,128,8,1,1,1,0,0,0,2,4,2,1,1,1,1,50,1024,327680,8454144,25,0.0334854,9.11369,252.472
2,CUTLASS,gemm,cutlass_tensorop_s884gemm_f16_256x128_32x2_nn_align8,passed,success,universal,256,128,128,f16:column,f16:column,f32:column,f32:column,1,0,serial,1,1,heuristic,invalid,invalid,false,false,1,tensorop,f32,256,128,32,1,1,1,0,0,0,2,4,2,1,16,16,4,70,75,229376,8454144,36,0.0238746,8.94773,354.107
2,CUTLASS,gemm,cutlass_tensorop_s884gemm_f16_256x128_32x2_nt_align8,passed,success,universal,256,128,128,f16:column,f16:row,f32:column,f32:column,1,0,serial,1,1,heuristic,invalid,invalid,false,false,1,tensorop,f32,256,128,32,1,1,1,0,0,0,2,4,2,1,16,16,4,70,75,229376,8454144,36,0.0262374,8.14192,322.217
2,CUTLASS,gemm,cutlass_tensorop_s884gemm_f16_256x128_32x2_tn_align8,passed,success,universal,256,128,128,f16:row,f16:column,f32:column,f32:column,1,0,serial,1,1,heuristic,invalid,invalid,false,false,1,tensorop,f32,256,128,32,1,1,1,0,0,0,2,4,2,1,16,16,4,70,75,229376,8454144,36,0.0238554,8.95493,354.392
2,CUTLASS,gemm,cutlass_tensorop_s884gemm_f16_256x128_32x2_tt_align8,passed,success,universal,256,128,128,f16:row,f16:row,f32:column,f32:column,1,0,serial,1,1,heuristic,invalid,invalid,false,false,1,tensorop,f32,256,128,32,1,1,1,0,0,0,2,4,2,1,16,16,4,70,75,229376,8454144,36,0.023809,8.97238,355.082
2,CUTLASS,gemm,cutlass_tensorop_f16_s884gemm_f16_256x128_32x2_nn_align8,passed,success,universal,256,128,128,f16:column,f16:column,f16:column,f16:column,1,0,serial,1,1,heuristic,invalid,invalid,false,false,1,tensorop,f32,256,128,32,1,1,1,0,0,0,2,4,2,1,16,16,4,70,75,163840,8454144,51,0.0252509,6.04287,334.806
2,CUTLASS,gemm,cutlass_tensorop_f16_s884gemm_f16_256x128_32x2_nt_align8,passed,success,universal,256,128,128,f16:column,f16:row,f16:column,f16:column,1,0,serial,1,1,heuristic,invalid,invalid,false,false,1,tensorop,f32,256,128,32,1,1,1,0,0,0,2,4,2,1,16,16,4,70,75,163840,8454144,51,0.0275213,5.54436,307.186
2,CUTLASS,gemm,cutlass_tensorop_f16_s884gemm_f16_256x128_32x2_tn_align8,passed,success,universal,256,128,128,f16:row,f16:column,f16:column,f16:column,1,0,serial,1,1,heuristic,invalid,invalid,false,false,1,tensorop,f32,256,128,32,1,1,1,0,0,0,2,4,2,1,16,16,4,70,75,163840,8454144,51,0.0251898,6.05754,335.618
2,CUTLASS,gemm,cutlass_tensorop_f16_s884gemm_f16_256x128_32x2_tt_align8,passed,success,universal,256,128,128,f16:row,f16:row,f16:column,f16:column,1,0,serial,1,1,heuristic,invalid,invalid,false,false,1,tensorop,f32,256,128,32,1,1,1,0,0,0,2,4,2,1,16,16,4,70,75,163840,8454144,51,0.0251456,6.06817,336.208
2,CUTLASS,gemm,cutlass_tensorop_s1688gemm_f16_256x128_32x2_nn_align8,passed,success,universal,256,128,128,f16:column,f16:column,f32:column,f32:column,1,0,serial,1,1,heuristic,invalid,invalid,false,false,1,tensorop,f32,256,128,32,1,1,1,0,0,0,2,4,2,1,16,8,8,75,1024,229376,8454144,36,0.0137802,15.5022,613.501
2,CUTLASS,gemm,cutlass_tensorop_s1688gemm_f16_256x128_32x2_nt_align8,passed,success,universal,256,128,128,f16:column,f16:row,f32:column,f32:column,1,0,serial,1,1,heuristic,invalid,invalid,false,false,1,tensorop,f32,256,128,32,1,1,1,0,0,0,2,4,2,1,16,8,8,75,1024,229376,8454144,36,0.0135949,15.7135,621.862
2,CUTLASS,gemm,cutlass_tensorop_s1688gemm_f16_256x128_32x2_tn_align8,passed,success,universal,256,128,128,f16:row,f16:column,f32:column,f32:column,1,0,serial,1,1,heuristic,invalid,invalid,false,false,1,tensorop,f32,256,128,32,1,1,1,0,0,0,2,4,2,1,16,8,8,75,1024,229376,8454144,36,0.0138528,15.4209,610.284
2,CUTLASS,gemm,cutlass_tensorop_s1688gemm_f16_256x128_32x2_tt_align8,passed,success,universal,256,128,128,f16:row,f16:row,f32:column,f32:column,1,0,serial,1,1,heuristic,invalid,invalid,false,false,1,tensorop,f32,256,128,32,1,1,1,0,0,0,2,4,2,1,16,8,8,75,1024,229376,8454144,36,0.0137475,15.539,614.958
2,CUTLASS,gemm,cutlass_tensorop_f16_s1688gemm_f16_256x128_32x2_nn_align8,passed,success,universal,256,128,128,f16:column,f16:column,f16:column,f16:column,1,0,serial,1,1,heuristic,invalid,invalid,false,false,1,tensorop,f32,256,128,32,1,1,1,0,0,0,2,4,2,1,16,8,8,75,1024,163840,8454144,51,0.0147869,10.3191,571.733
2,CUTLASS,gemm,cutlass_tensorop_f16_s1688gemm_f16_256x128_32x2_nt_align8,passed,success,universal,256,128,128,f16:column,f16:row,f16:column,f16:column,1,0,serial,1,1,heuristic,invalid,invalid,false,false,1,tensorop,f32,256,128,32,1,1,1,0,0,0,2,4,2,1,16,8,8,75,1024,163840,8454144,51,0.0147674,10.3328,572.489
2,CUTLASS,gemm,cutlass_tensorop_f16_s1688gemm_f16_256x128_32x2_tn_align8,passed,success,universal,256,128,128,f16:row,f16:column,f16:column,f16:column,1,0,serial,1,1,heuristic,invalid,invalid,false,false,1,tensorop,f32,256,128,32,1,1,1,0,0,0,2,4,2,1,16,8,8,75,1024,163840,8454144,51,0.0148493,10.2758,569.33
2,CUTLASS,gemm,cutlass_tensorop_f16_s1688gemm_f16_256x128_32x2_tt_align8,passed,success,universal,256,128,128,f16:row,f16:row,f16:column,f16:column,1,0,serial,1,1,heuristic,invalid,invalid,false,false,1,tensorop,f32,256,128,32,1,1,1,0,0,0,2,4,2,1,16,8,8,75,1024,163840,8454144,51,0.0147546,10.3417,572.985
3,CUTLASS,gemm,cutlass_simt_sgemm_128x128_8x2_nn_align1,passed,success,universal,512,128,128,f32:column,f32:column,f32:column,f32:column,1,0,serial,1,1,heuristic,invalid,invalid,false,false,1,simt,f32,128,128,8,1,1,1,0,0,0,2,4,2,1,1,1,1,50,1024,589824,16908288,28,0.0334614,16.4164,505.307
3,CUTLASS,gemm,cutlass_simt_sgemm_128x128_8x2_nt_align1,passed,success,universal,512,128,128,f32:column,f32:row,f32:column,f32:column,1,0,serial,1,1,heuristic,invalid,invalid,false,false,1,simt,f32,128,128,8,1,1,1,0,0,0,2,4,2,1,1,1,1,50,1024,589824,16908288,28,0.0332742,16.5088,508.149
3,CUTLASS,gemm,cutlass_simt_sgemm_128x128_8x2_tn_align1,passed,success,universal,512,128,128,f32:row,f32:column,f32:column,f32:column,1,0,serial,1,1,heuristic,invalid,invalid,false,false,1,simt,f32,128,128,8,1,1,1,0,0,0,2,4,2,1,1,1,1,50,1024,589824,16908288,28,0.0335277,16.384,504.308
3,CUTLASS,gemm,cutlass_simt_sgemm_128x128_8x2_tt_align1,passed,success,universal,512,128,128,f32:row,f32:row,f32:column,f32:column,1,0,serial,1,1,heuristic,invalid,invalid,false,false,1,simt,f32,128,128,8,1,1,1,0,0,0,2,4,2,1,1,1,1,50,1024,589824,16908288,28,0.0336138,16.342,503.017
3,CUTLASS,gemm,cutlass_tensorop_s884gemm_f16_256x128_32x2_nn_align8,passed,success,universal,512,128,128,f16:column,f16:column,f32:column,f32:column,1,0,serial,1,1,heuristic,invalid,invalid,false,false,1,tensorop,f32,256,128,32,1,1,1,0,0,0,2,4,2,1,16,16,4,70,75,425984,16908288,39,0.023903,16.5974,707.37
3,CUTLASS,gemm,cutlass_tensorop_s884gemm_f16_256x128_32x2_nt_align8,passed,success,universal,512,128,128,f16:column,f16:row,f32:column,f32:column,1,0,serial,1,1,heuristic,invalid,invalid,false,false,1,tensorop,f32,256,128,32,1,1,1,0,0,0,2,4,2,1,16,16,4,70,75,425984,16908288,39,0.0263059,15.0813,642.756
3,CUTLASS,gemm,cutlass_tensorop_s884gemm_f16_256x128_32x2_tn_align8,passed,success,universal,512,128,128,f16:row,f16:column,f32:column,f32:column,1,0,serial,1,1,heuristic,invalid,invalid,false,false,1,tensorop,f32,256,128,32,1,1,1,0,0,0,2,4,2,1,16,16,4,70,75,425984,16908288,39,0.0238966,16.6019,707.559
3,CUTLASS,gemm,cutlass_tensorop_s884gemm_f16_256x128_32x2_tt_align8,passed,success,universal,512,128,128,f16:row,f16:row,f32:column,f32:column,1,0,serial,1,1,heuristic,invalid,invalid,false,false,1,tensorop,f32,256,128,32,1,1,1,0,0,0,2,4,2,1,16,16,4,70,75,425984,16908288,39,0.0238147,16.659,709.993
3,CUTLASS,gemm,cutlass_tensorop_f16_s884gemm_f16_256x128_32x2_nn_align8,passed,success,universal,512,128,128,f16:column,f16:column,f16:column,f16:column,1,0,serial,1,1,heuristic,invalid,invalid,false,false,1,tensorop,f32,256,128,32,1,1,1,0,0,0,2,4,2,1,16,16,4,70,75,294912,16908288,57,0.0252685,10.8696,669.145
3,CUTLASS,gemm,cutlass_tensorop_f16_s884gemm_f16_256x128_32x2_nt_align8,passed,success,universal,512,128,128,f16:column,f16:row,f16:column,f16:column,1,0,serial,1,1,heuristic,invalid,invalid,false,false,1,tensorop,f32,256,128,32,1,1,1,0,0,0,2,4,2,1,16,16,4,70,75,294912,16908288,57,0.0275408,9.97277,613.936
3,CUTLASS,gemm,cutlass_tensorop_f16_s884gemm_f16_256x128_32x2_tn_align8,passed,success,universal,512,128,128,f16:row,f16:column,f16:column,f16:column,1,0,serial,1,1,heuristic,invalid,invalid,false,false,1,tensorop,f32,256,128,32,1,1,1,0,0,0,2,4,2,1,16,16,4,70,75,294912,16908288,57,0.0252957,10.8579,668.426
3,CUTLASS,gemm,cutlass_tensorop_f16_s884gemm_f16_256x128_32x2_tt_align8,passed,success,universal,512,128,128,f16:row,f16:row,f16:column,f16:column,1,0,serial,1,1,heuristic,invalid,invalid,false,false,1,tensorop,f32,256,128,32,1,1,1,0,0,0,2,4,2,1,16,16,4,70,75,294912,16908288,57,0.0251408,10.9248,672.544
3,CUTLASS,gemm,cutlass_tensorop_s1688gemm_f16_256x128_32x2_nn_align8,passed,success,universal,512,128,128,f16:column,f16:column,f32:column,f32:column,1,0,serial,1,1,heuristic,invalid,invalid,false,false,1,tensorop,f32,256,128,32,1,1,1,0,0,0,2,4,2,1,16,8,8,75,1024,425984,16908288,39,0.013929,28.4823,1213.89
3,CUTLASS,gemm,cutlass_tensorop_s1688gemm_f16_256x128_32x2_nt_align8,passed,success,universal,512,128,128,f16:column,f16:row,f32:column,f32:column,1,0,serial,1,1,heuristic,invalid,invalid,false,false,1,tensorop,f32,256,128,32,1,1,1,0,0,0,2,4,2,1,16,8,8,75,1024,425984,16908288,39,0.0137453,28.8629,1230.12
3,CUTLASS,gemm,cutlass_tensorop_s1688gemm_f16_256x128_32x2_tn_align8,passed,success,universal,512,128,128,f16:row,f16:column,f32:column,f32:column,1,0,serial,1,1,heuristic,invalid,invalid,false,false,1,tensorop,f32,256,128,32,1,1,1,0,0,0,2,4,2,1,16,8,8,75,1024,425984,16908288,39,0.0141075,28.1218,1198.53
3,CUTLASS,gemm,cutlass_tensorop_s1688gemm_f16_256x128_32x2_tt_align8,passed,success,universal,512,128,128,f16:row,f16:row,f32:column,f32:column,1,0,serial,1,1,heuristic,invalid,invalid,false,false,1,tensorop,f32,256,128,32,1,1,1,0,0,0,2,4,2,1,16,8,8,75,1024,425984,16908288,39,0.0139142,28.5124,1215.18
3,CUTLASS,gemm,cutlass_tensorop_f16_s1688gemm_f16_256x128_32x2_nn_align8,passed,success,universal,512,128,128,f16:column,f16:column,f16:column,f16:column,1,0,serial,1,1,heuristic,invalid,invalid,false,false,1,tensorop,f32,256,128,32,1,1,1,0,0,0,2,4,2,1,16,8,8,75,1024,294912,16908288,57,0.0148083,18.5476,1141.81
3,CUTLASS,gemm,cutlass_tensorop_f16_s1688gemm_f16_256x128_32x2_nt_align8,passed,success,universal,512,128,128,f16:column,f16:row,f16:column,f16:column,1,0,serial,1,1,heuristic,invalid,invalid,false,false,1,tensorop,f32,256,128,32,1,1,1,0,0,0,2,4,2,1,16,8,8,75,1024,294912,16908288,57,0.0147923,18.5676,1143.05
3,CUTLASS,gemm,cutlass_tensorop_f16_s1688gemm_f16_256x128_32x2_tn_align8,passed,success,universal,512,128,128,f16:row,f16:column,f16:column,f16:column,1,0,serial,1,1,heuristic,invalid,invalid,false,false,1,tensorop,f32,256,128,32,1,1,1,0,0,0,2,4,2,1,16,8,8,75,1024,294912,16908288,57,0.0148973,18.4368,1134.99
3,CUTLASS,gemm,cutlass_tensorop_f16_s1688gemm_f16_256x128_32x2_tt_align8,passed,success,universal,512,128,128,f16:row,f16:row,f16:column,f16:column,1,0,serial,1,1,heuristic,invalid,invalid,false,false,1,tensorop,f32,256,128,32,1,1,1,0,0,0,2,4,2,1,16,8,8,75,1024,294912,16908288,57,0.0147408,18.6325,1147.04
4,CUTLASS,gemm,cutlass_simt_sgemm_128x128_8x2_nn_align1,passed,success,universal,1024,128,128,f32:column,f32:column,f32:column,f32:column,1,0,serial,1,1,heuristic,invalid,invalid,false,false,1,simt,f32,128,128,8,1,1,1,0,0,0,2,4,2,1,1,1,1,50,1024,1114112,33816576,30,0.0340666,30.458,992.662
4,CUTLASS,gemm,cutlass_simt_sgemm_128x128_8x2_nt_align1,passed,success,universal,1024,128,128,f32:column,f32:row,f32:column,f32:column,1,0,serial,1,1,heuristic,invalid,invalid,false,false,1,simt,f32,128,128,8,1,1,1,0,0,0,2,4,2,1,1,1,1,50,1024,1114112,33816576,30,0.033833,30.6682,999.516
4,CUTLASS,gemm,cutlass_simt_sgemm_128x128_8x2_tn_align1,passed,success,universal,1024,128,128,f32:row,f32:column,f32:column,f32:column,1,0,serial,1,1,heuristic,invalid,invalid,false,false,1,simt,f32,128,128,8,1,1,1,0,0,0,2,4,2,1,1,1,1,50,1024,1114112,33816576,30,0.0341584,30.3761,989.993
4,CUTLASS,gemm,cutlass_simt_sgemm_128x128_8x2_tt_align1,passed,success,universal,1024,128,128,f32:row,f32:row,f32:column,f32:column,1,0,serial,1,1,heuristic,invalid,invalid,false,false,1,simt,f32,128,128,8,1,1,1,0,0,0,2,4,2,1,1,1,1,50,1024,1114112,33816576,30,0.0342906,30.259,986.177
4,CUTLASS,gemm,cutlass_tensorop_s884gemm_f16_256x128_32x2_nn_align8,passed,success,universal,1024,128,128,f16:column,f16:column,f32:column,f32:column,1,0,serial,1,1,heuristic,invalid,invalid,false,false,1,tensorop,f32,256,128,32,1,1,1,0,0,0,2,4,2,1,16,16,4,70,75,819200,33816576,41,0.0242394,31.4752,1395.11
4,CUTLASS,gemm,cutlass_tensorop_s884gemm_f16_256x128_32x2_nt_align8,passed,success,universal,1024,128,128,f16:column,f16:row,f32:column,f32:column,1,0,serial,1,1,heuristic,invalid,invalid,false,false,1,tensorop,f32,256,128,32,1,1,1,0,0,0,2,4,2,1,16,16,4,70,75,819200,33816576,41,0.0266058,28.6757,1271.02
4,CUTLASS,gemm,cutlass_tensorop_s884gemm_f16_256x128_32x2_tn_align8,passed,success,universal,1024,128,128,f16:row,f16:column,f32:column,f32:column,1,0,serial,1,1,heuristic,invalid,invalid,false,false,1,tensorop,f32,256,128,32,1,1,1,0,0,0,2,4,2,1,16,16,4,70,75,819200,33816576,41,0.0243683,31.3087,1387.73
4,CUTLASS,gemm,cutlass_tensorop_s884gemm_f16_256x128_32x2_tt_align8,passed,success,universal,1024,128,128,f16:row,f16:row,f32:column,f32:column,1,0,serial,1,1,heuristic,invalid,invalid,false,false,1,tensorop,f32,256,128,32,1,1,1,0,0,0,2,4,2,1,16,16,4,70,75,819200,33816576,41,0.0242035,31.5218,1397.18
4,CUTLASS,gemm,cutlass_tensorop_f16_s884gemm_f16_256x128_32x2_nn_align8,passed,success,universal,1024,128,128,f16:column,f16:column,f16:column,f16:column,1,0,serial,1,1,heuristic,invalid,invalid,false,false,1,tensorop,f32,256,128,32,1,1,1,0,0,0,2,4,2,1,16,16,4,70,75,557056,33816576,60,0.0255907,20.2729,1321.44
4,CUTLASS,gemm,cutlass_tensorop_f16_s884gemm_f16_256x128_32x2_nt_align8,passed,success,universal,1024,128,128,f16:column,f16:row,f16:column,f16:column,1,0,serial,1,1,heuristic,invalid,invalid,false,false,1,tensorop,f32,256,128,32,1,1,1,0,0,0,2,4,2,1,16,16,4,70,75,557056,33816576,60,0.0279069,18.5904,1211.76
4,CUTLASS,gemm,cutlass_tensorop_f16_s884gemm_f16_256x128_32x2_tn_align8,passed,success,universal,1024,128,128,f16:row,f16:column,f16:column,f16:column,1,0,serial,1,1,heuristic,invalid,invalid,false,false,1,tensorop,f32,256,128,32,1,1,1,0,0,0,2,4,2,1,16,16,4,70,75,557056,33816576,60,0.0256394,20.2345,1318.93
4,CUTLASS,gemm,cutlass_tensorop_f16_s884gemm_f16_256x128_32x2_tt_align8,passed,success,universal,1024,128,128,f16:row,f16:row,f16:column,f16:column,1,0,serial,1,1,heuristic,invalid,invalid,false,false,1,tensorop,f32,256,128,32,1,1,1,0,0,0,2,4,2,1,16,16,4,70,75,557056,33816576,60,0.0255414,20.312,1323.99
4,CUTLASS,gemm,cutlass_tensorop_s1688gemm_f16_256x128_32x2_nn_align8,passed,success,universal,1024,128,128,f16:column,f16:column,f32:column,f32:column,1,0,serial,1,1,heuristic,invalid,invalid,false,false,1,tensorop,f32,256,128,32,1,1,1,0,0,0,2,4,2,1,16,8,8,75,1024,819200,33816576,41,0.0139629,54.6405,2421.89
4,CUTLASS,gemm,cutlass_tensorop_s1688gemm_f16_256x128_32x2_nt_align8,passed,success,universal,1024,128,128,f16:column,f16:row,f32:column,f32:column,1,0,serial,1,1,heuristic,invalid,invalid,false,false,1,tensorop,f32,256,128,32,1,1,1,0,0,0,2,4,2,1,16,8,8,75,1024,819200,33816576,41,0.0137914,55.3201,2452.01
4,CUTLASS,gemm,cutlass_tensorop_s1688gemm_f16_256x128_32x2_tn_align8,passed,success,universal,1024,128,128,f16:row,f16:column,f32:column,f32:column,1,0,serial,1,1,heuristic,invalid,invalid,false,false,1,tensorop,f32,256,128,32,1,1,1,0,0,0,2,4,2,1,16,8,8,75,1024,819200,33816576,41,0.0143072,53.3256,2363.61
4,CUTLASS,gemm,cutlass_tensorop_s1688gemm_f16_256x128_32x2_tt_align8,passed,success,universal,1024,128,128,f16:row,f16:row,f32:column,f32:column,1,0,serial,1,1,heuristic,invalid,invalid,false,false,1,tensorop,f32,256,128,32,1,1,1,0,0,0,2,4,2,1,16,8,8,75,1024,819200,33816576,41,0.0140058,54.4733,2414.48
4,CUTLASS,gemm,cutlass_tensorop_f16_s1688gemm_f16_256x128_32x2_nn_align8,passed,success,universal,1024,128,128,f16:column,f16:column,f16:column,f16:column,1,0,serial,1,1,heuristic,invalid,invalid,false,false,1,tensorop,f32,256,128,32,1,1,1,0,0,0,2,4,2,1,16,8,8,75,1024,557056,33816576,60,0.0149683,34.6598,2259.21
4,CUTLASS,gemm,cutlass_tensorop_f16_s1688gemm_f16_256x128_32x2_nt_align8,passed,success,universal,1024,128,128,f16:column,f16:row,f16:column,f16:column,1,0,serial,1,1,heuristic,invalid,invalid,false,false,1,tensorop,f32,256,128,32,1,1,1,0,0,0,2,4,2,1,16,8,8,75,1024,557056,33816576,60,0.0149523,34.6969,2261.63
4,CUTLASS,gemm,cutlass_tensorop_f16_s1688gemm_f16_256x128_32x2_tn_align8,passed,success,universal,1024,128,128,f16:row,f16:column,f16:column,f16:column,1,0,serial,1,1,heuristic,invalid,invalid,false,false,1,tensorop,f32,256,128,32,1,1,1,0,0,0,2,4,2,1,16,8,8,75,1024,557056,33816576,60,0.0152048,34.1207,2224.07
4,CUTLASS,gemm,cutlass_tensorop_f16_s1688gemm_f16_256x128_32x2_tt_align8,passed,success,universal,1024,128,128,f16:row,f16:row,f16:column,f16:column,1,0,serial,1,1,heuristic,invalid,invalid,false,false,1,tensorop,f32,256,128,32,1,1,1,0,0,0,2,4,2,1,16,8,8,75,1024,557056,33816576,60,0.0149648,34.6679,2259.74
5,CUTLASS,gemm,cutlass_simt_sgemm_128x128_8x2_nn_align1,passed,success,universal,2048,128,128,f32:column,f32:column,f32:column,f32:column,1,0,serial,1,1,heuristic,invalid,invalid,false,false,1,simt,f32,128,128,8,1,1,1,0,0,0,2,4,2,1,1,1,1,50,1024,2162688,67633152,31,0.0341418,58.994,1980.95
5,CUTLASS,gemm,cutlass_simt_sgemm_128x128_8x2_nt_align1,passed,success,universal,2048,128,128,f32:column,f32:row,f32:column,f32:column,1,0,serial,1,1,heuristic,invalid,invalid,false,false,1,simt,f32,128,128,8,1,1,1,0,0,0,2,4,2,1,1,1,1,50,1024,2162688,67633152,31,0.0339558,59.317,1991.8
5,CUTLASS,gemm,cutlass_simt_sgemm_128x128_8x2_tn_align1,passed,success,universal,2048,128,128,f32:row,f32:column,f32:column,f32:column,1,0,serial,1,1,heuristic,invalid,invalid,false,false,1,simt,f32,128,128,8,1,1,1,0,0,0,2,4,2,1,1,1,1,50,1024,2162688,67633152,31,0.0346998,58.0452,1949.09
5,CUTLASS,gemm,cutlass_simt_sgemm_128x128_8x2_tt_align1,passed,success,universal,2048,128,128,f32:row,f32:row,f32:column,f32:column,1,0,serial,1,1,heuristic,invalid,invalid,false,false,1,simt,f32,128,128,8,1,1,1,0,0,0,2,4,2,1,1,1,1,50,1024,2162688,67633152,31,0.0346998,58.0452,1949.09
5,CUTLASS,gemm,cutlass_tensorop_s884gemm_f16_256x128_32x2_nn_align8,passed,success,universal,2048,128,128,f16:column,f16:column,f32:column,f32:column,1,0,serial,1,1,heuristic,invalid,invalid,false,false,1,tensorop,f32,256,128,32,1,1,1,0,0,0,2,4,2,1,16,16,4,70,75,1605632,67633152,42,0.0244138,61.2508,2770.29
5,CUTLASS,gemm,cutlass_tensorop_s884gemm_f16_256x128_32x2_nt_align8,passed,success,universal,2048,128,128,f16:column,f16:row,f32:column,f32:column,1,0,serial,1,1,heuristic,invalid,invalid,false,false,1,tensorop,f32,256,128,32,1,1,1,0,0,0,2,4,2,1,16,16,4,70,75,1605632,67633152,42,0.026751,55.8992,2528.24
5,CUTLASS,gemm,cutlass_tensorop_s884gemm_f16_256x128_32x2_tn_align8,passed,success,universal,2048,128,128,f16:row,f16:column,f32:column,f32:column,1,0,serial,1,1,heuristic,invalid,invalid,false,false,1,tensorop,f32,256,128,32,1,1,1,0,0,0,2,4,2,1,16,16,4,70,75,1605632,67633152,42,0.0248317,60.2199,2723.66
5,CUTLASS,gemm,cutlass_tensorop_s884gemm_f16_256x128_32x2_tt_align8,passed,success,universal,2048,128,128,f16:row,f16:row,f32:column,f32:column,1,0,serial,1,1,heuristic,invalid,invalid,false,false,1,tensorop,f32,256,128,32,1,1,1,0,0,0,2,4,2,1,16,16,4,70,75,1605632,67633152,42,0.0246928,60.5586,2738.98
5,CUTLASS,gemm,cutlass_tensorop_f16_s884gemm_f16_256x128_32x2_nn_align8,passed,success,universal,2048,128,128,f16:column,f16:column,f16:column,f16:column,1,0,serial,1,1,heuristic,invalid,invalid,false,false,1,tensorop,f32,256,128,32,1,1,1,0,0,0,2,4,2,1,16,16,4,70,75,1081344,67633152,62,0.0257475,39.1137,2626.78
5,CUTLASS,gemm,cutlass_tensorop_f16_s884gemm_f16_256x128_32x2_nt_align8,passed,success,universal,2048,128,128,f16:column,f16:row,f16:column,f16:column,1,0,serial,1,1,heuristic,invalid,invalid,false,false,1,tensorop,f32,256,128,32,1,1,1,0,0,0,2,4,2,1,16,16,4,70,75,1081344,67633152,62,0.0280749,35.8712,2409.03
5,CUTLASS,gemm,cutlass_tensorop_f16_s884gemm_f16_256x128_32x2_tn_align8,passed,success,universal,2048,128,128,f16:row,f16:column,f16:column,f16:column,1,0,serial,1,1,heuristic,invalid,invalid,false,false,1,tensorop,f32,256,128,32,1,1,1,0,0,0,2,4,2,1,16,16,4,70,75,1081344,67633152,62,0.0261392,38.5276,2587.42
5,CUTLASS,gemm,cutlass_tensorop_f16_s884gemm_f16_256x128_32x2_tt_align8,passed,success,universal,2048,128,128,f16:row,f16:row,f16:column,f16:column,1,0,serial,1,1,heuristic,invalid,invalid,false,false,1,tensorop,f32,256,128,32,1,1,1,0,0,0,2,4,2,1,16,16,4,70,75,1081344,67633152,62,0.0260224,38.7005,2599.04
5,CUTLASS,gemm,cutlass_tensorop_s1688gemm_f16_256x128_32x2_nn_align8,passed,success,universal,2048,128,128,f16:column,f16:column,f32:column,f32:column,1,0,serial,1,1,heuristic,invalid,invalid,false,false,1,tensorop,f32,256,128,32,1,1,1,0,0,0,2,4,2,1,16,8,8,75,1024,1605632,67633152,42,0.0142605,104.861,4742.7
5,CUTLASS,gemm,cutlass_tensorop_s1688gemm_f16_256x128_32x2_nt_align8,passed,success,universal,2048,128,128,f16:column,f16:row,f32:column,f32:column,1,0,serial,1,1,heuristic,invalid,invalid,false,false,1,tensorop,f32,256,128,32,1,1,1,0,0,0,2,4,2,1,16,8,8,75,1024,1605632,67633152,42,0.0140278,106.6,4821.35
5,CUTLASS,gemm,cutlass_tensorop_s1688gemm_f16_256x128_32x2_tn_align8,passed,success,universal,2048,128,128,f16:row,f16:column,f32:column,f32:column,1,0,serial,1,1,heuristic,invalid,invalid,false,false,1,tensorop,f32,256,128,32,1,1,1,0,0,0,2,4,2,1,16,8,8,75,1024,1605632,67633152,42,0.0149939,99.7312,4510.71
5,CUTLASS,gemm,cutlass_tensorop_s1688gemm_f16_256x128_32x2_tt_align8,passed,success,universal,2048,128,128,f16:row,f16:row,f32:column,f32:column,1,0,serial,1,1,heuristic,invalid,invalid,false,false,1,tensorop,f32,256,128,32,1,1,1,0,0,0,2,4,2,1,16,8,8,75,1024,1605632,67633152,42,0.0146384,102.153,4620.26
5,CUTLASS,gemm,cutlass_tensorop_f16_s1688gemm_f16_256x128_32x2_nn_align8,passed,success,universal,2048,128,128,f16:column,f16:column,f16:column,f16:column,1,0,serial,1,1,heuristic,invalid,invalid,false,false,1,tensorop,f32,256,128,32,1,1,1,0,0,0,2,4,2,1,16,8,8,75,1024,1081344,67633152,62,0.0151901,66.2985,4452.46
5,CUTLASS,gemm,cutlass_tensorop_f16_s1688gemm_f16_256x128_32x2_nt_align8,passed,success,universal,2048,128,128,f16:column,f16:row,f16:column,f16:column,1,0,serial,1,1,heuristic,invalid,invalid,false,false,1,tensorop,f32,256,128,32,1,1,1,0,0,0,2,4,2,1,16,8,8,75,1024,1081344,67633152,62,0.015129,66.5664,4470.44
5,CUTLASS,gemm,cutlass_tensorop_f16_s1688gemm_f16_256x128_32x2_tn_align8,passed,success,universal,2048,128,128,f16:row,f16:column,f16:column,f16:column,1,0,serial,1,1,heuristic,invalid,invalid,false,false,1,tensorop,f32,256,128,32,1,1,1,0,0,0,2,4,2,1,16,8,8,75,1024,1081344,67633152,62,0.0158582,63.5052,4264.86
5,CUTLASS,gemm,cutlass_tensorop_f16_s1688gemm_f16_256x128_32x2_tt_align8,passed,success,universal,2048,128,128,f16:row,f16:row,f16:column,f16:column,1,0,serial,1,1,heuristic,invalid,invalid,false,false,1,tensorop,f32,256,128,32,1,1,1,0,0,0,2,4,2,1,16,8,8,75,1024,1081344,67633152,62,0.0154806,65.0542,4368.89
6,CUTLASS,gemm,cutlass_simt_sgemm_128x128_8x2_nn_align1,passed,success,universal,4096,128,128,f32:column,f32:column,f32:column,f32:column,1,0,serial,1,1,heuristic,invalid,invalid,false,false,1,simt,f32,128,128,8,1,1,1,0,0,0,2,4,2,1,1,1,1,50,1024,4259840,135266304,31,0.0344678,115.101,3924.42
6,CUTLASS,gemm,cutlass_simt_sgemm_128x128_8x2_nt_align1,passed,success,universal,4096,128,128,f32:column,f32:row,f32:column,f32:column,1,0,serial,1,1,heuristic,invalid,invalid,false,false,1,simt,f32,128,128,8,1,1,1,0,0,0,2,4,2,1,1,1,1,50,1024,4259840,135266304,31,0.0343078,115.638,3942.72
6,CUTLASS,gemm,cutlass_simt_sgemm_128x128_8x2_tn_align1,passed,success,universal,4096,128,128,f32:row,f32:column,f32:column,f32:column,1,0,serial,1,1,heuristic,invalid,invalid,false,false,1,simt,f32,128,128,8,1,1,1,0,0,0,2,4,2,1,1,1,1,50,1024,4259840,135266304,31,0.035745,110.989,3784.21
6,CUTLASS,gemm,cutlass_simt_sgemm_128x128_8x2_tt_align1,passed,success,universal,4096,128,128,f32:row,f32:row,f32:column,f32:column,1,0,serial,1,1,heuristic,invalid,invalid,false,false,1,simt,f32,128,128,8,1,1,1,0,0,0,2,4,2,1,1,1,1,50,1024,4259840,135266304,31,0.035639,111.319,3795.45
6,CUTLASS,gemm,cutlass_tensorop_s884gemm_f16_256x128_32x2_nn_align8,passed,success,universal,4096,128,128,f16:column,f16:column,f32:column,f32:column,1,0,serial,1,1,heuristic,invalid,invalid,false,false,1,tensorop,f32,256,128,32,1,1,1,0,0,0,2,4,2,1,16,16,4,70,75,3178496,135266304,42,0.0248522,119.113,5442.84
6,CUTLASS,gemm,cutlass_tensorop_s884gemm_f16_256x128_32x2_nt_align8,passed,success,universal,4096,128,128,f16:column,f16:row,f32:column,f32:column,1,0,serial,1,1,heuristic,invalid,invalid,false,false,1,tensorop,f32,256,128,32,1,1,1,0,0,0,2,4,2,1,16,16,4,70,75,3178496,135266304,42,0.0270678,109.362,4997.31
6,CUTLASS,gemm,cutlass_tensorop_s884gemm_f16_256x128_32x2_tn_align8,passed,success,universal,4096,128,128,f16:row,f16:column,f32:column,f32:column,1,0,serial,1,1,heuristic,invalid,invalid,false,false,1,tensorop,f32,256,128,32,1,1,1,0,0,0,2,4,2,1,16,16,4,70,75,3178496,135266304,42,0.0257123,115.128,5260.76
6,CUTLASS,gemm,cutlass_tensorop_s884gemm_f16_256x128_32x2_tt_align8,passed,success,universal,4096,128,128,f16:row,f16:row,f32:column,f32:column,1,0,serial,1,1,heuristic,invalid,invalid,false,false,1,tensorop,f32,256,128,32,1,1,1,0,0,0,2,4,2,1,16,16,4,70,75,3178496,135266304,42,0.025633,115.484,5277.05
6,CUTLASS,gemm,cutlass_tensorop_f16_s884gemm_f16_256x128_32x2_nn_align8,passed,success,universal,4096,128,128,f16:column,f16:column,f16:column,f16:column,1,0,serial,1,1,heuristic,invalid,invalid,false,false,1,tensorop,f32,256,128,32,1,1,1,0,0,0,2,4,2,1,16,16,4,70,75,2129920,135266304,63,0.0261674,75.806,5169.28
6,CUTLASS,gemm,cutlass_tensorop_f16_s884gemm_f16_256x128_32x2_nt_align8,passed,success,universal,4096,128,128,f16:column,f16:row,f16:column,f16:column,1,0,serial,1,1,heuristic,invalid,invalid,false,false,1,tensorop,f32,256,128,32,1,1,1,0,0,0,2,4,2,1,16,16,4,70,75,2129920,135266304,63,0.028463,69.6919,4752.35
6,CUTLASS,gemm,cutlass_tensorop_f16_s884gemm_f16_256x128_32x2_tn_align8,passed,success,universal,4096,128,128,f16:row,f16:column,f16:column,f16:column,1,0,serial,1,1,heuristic,invalid,invalid,false,false,1,tensorop,f32,256,128,32,1,1,1,0,0,0,2,4,2,1,16,16,4,70,75,2129920,135266304,63,0.0269766,73.5319,5014.2
6,CUTLASS,gemm,cutlass_tensorop_f16_s884gemm_f16_256x128_32x2_tt_align8,passed,success,universal,4096,128,128,f16:row,f16:row,f16:column,f16:column,1,0,serial,1,1,heuristic,invalid,invalid,false,false,1,tensorop,f32,256,128,32,1,1,1,0,0,0,2,4,2,1,16,16,4,70,75,2129920,135266304,63,0.0268042,74.005,5046.47
6,CUTLASS,gemm,cutlass_tensorop_s1688gemm_f16_256x128_32x2_nn_align8,passed,success,universal,4096,128,128,f16:column,f16:column,f32:column,f32:column,1,0,serial,1,1,heuristic,invalid,invalid,false,false,1,tensorop,f32,256,128,32,1,1,1,0,0,0,2,4,2,1,16,8,8,75,1024,3178496,135266304,42,0.0146442,202.142,9236.88
6,CUTLASS,gemm,cutlass_tensorop_s1688gemm_f16_256x128_32x2_nt_align8,passed,success,universal,4096,128,128,f16:column,f16:row,f32:column,f32:column,1,0,serial,1,1,heuristic,invalid,invalid,false,false,1,tensorop,f32,256,128,32,1,1,1,0,0,0,2,4,2,1,16,8,8,75,1024,3178496,135266304,42,0.0143747,205.931,9410.01
6,CUTLASS,gemm,cutlass_tensorop_s1688gemm_f16_256x128_32x2_tn_align8,passed,success,universal,4096,128,128,f16:row,f16:column,f32:column,f32:column,1,0,serial,1,1,heuristic,invalid,invalid,false,false,1,tensorop,f32,256,128,32,1,1,1,0,0,0,2,4,2,1,16,8,8,75,1024,3178496,135266304,42,0.0158355,186.935,8541.96
6,CUTLASS,gemm,cutlass_tensorop_s1688gemm_f16_256x128_32x2_tt_align8,passed,success,universal,4096,128,128,f16:row,f16:row,f32:column,f32:column,1,0,serial,1,1,heuristic,invalid,invalid,false,false,1,tensorop,f32,256,128,32,1,1,1,0,0,0,2,4,2,1,16,8,8,75,1024,3178496,135266304,42,0.0154208,191.962,8771.68
6,CUTLASS,gemm,cutlass_tensorop_f16_s1688gemm_f16_256x128_32x2_nn_align8,passed,success,universal,4096,128,128,f16:column,f16:column,f16:column,f16:column,1,0,serial,1,1,heuristic,invalid,invalid,false,false,1,tensorop,f32,256,128,32,1,1,1,0,0,0,2,4,2,1,16,8,8,75,1024,2129920,135266304,63,0.0156026,127.136,8669.49
6,CUTLASS,gemm,cutlass_tensorop_f16_s1688gemm_f16_256x128_32x2_nt_align8,passed,success,universal,4096,128,128,f16:column,f16:row,f16:column,f16:column,1,0,serial,1,1,heuristic,invalid,invalid,false,false,1,tensorop,f32,256,128,32,1,1,1,0,0,0,2,4,2,1,16,8,8,75,1024,2129920,135266304,63,0.0155162,127.844,8717.77
6,CUTLASS,gemm,cutlass_tensorop_f16_s1688gemm_f16_256x128_32x2_tn_align8,passed,success,universal,4096,128,128,f16:row,f16:column,f16:column,f16:column,1,0,serial,1,1,heuristic,invalid,invalid,false,false,1,tensorop,f32,256,128,32,1,1,1,0,0,0,2,4,2,1,16,8,8,75,1024,2129920,135266304,63,0.0167258,118.598,8087.3
6,CUTLASS,gemm,cutlass_tensorop_f16_s1688gemm_f16_256x128_32x2_tt_align8,passed,success,universal,4096,128,128,f16:row,f16:row,f16:column,f16:column,1,0,serial,1,1,heuristic,invalid,invalid,false,false,1,tensorop,f32,256,128,32,1,1,1,0,0,0,2,4,2,1,16,8,8,75,1024,2129920,135266304,63,0.0163107,121.616,8293.09
7,CUTLASS,gemm,cutlass_simt_sgemm_128x128_8x2_nn_align1,passed,success,universal,8192,128,128,f32:column,f32:column,f32:column,f32:column,1,0,serial,1,1,heuristic,invalid,invalid,false,false,1,simt,f32,128,128,8,1,1,1,0,0,0,2,4,2,1,1,1,1,50,1024,8454144,270532608,32,0.0376474,209.139,7185.97
7,CUTLASS,gemm,cutlass_simt_sgemm_128x128_8x2_nt_align1,passed,success,universal,8192,128,128,f32:column,f32:row,f32:column,f32:column,1,0,serial,1,1,heuristic,invalid,invalid,false,false,1,simt,f32,128,128,8,1,1,1,0,0,0,2,4,2,1,1,1,1,50,1024,8454144,270532608,32,0.0374474,210.256,7224.34
7,CUTLASS,gemm,cutlass_simt_sgemm_128x128_8x2_tn_align1,passed,success,universal,8192,128,128,f32:row,f32:column,f32:column,f32:column,1,0,serial,1,1,heuristic,invalid,invalid,false,false,1,simt,f32,128,128,8,1,1,1,0,0,0,2,4,2,1,1,1,1,50,1024,8454144,270532608,32,0.0424096,185.655,6379.04
7,CUTLASS,gemm,cutlass_simt_sgemm_128x128_8x2_tt_align1,passed,success,universal,8192,128,128,f32:row,f32:row,f32:column,f32:column,1,0,serial,1,1,heuristic,invalid,invalid,false,false,1,simt,f32,128,128,8,1,1,1,0,0,0,2,4,2,1,1,1,1,50,1024,8454144,270532608,32,0.0430938,182.707,6277.77
7,CUTLASS,gemm,cutlass_tensorop_s884gemm_f16_256x128_32x2_nn_align8,passed,success,universal,8192,128,128,f16:column,f16:column,f32:column,f32:column,1,0,serial,1,1,heuristic,invalid,invalid,false,false,1,tensorop,f32,256,128,32,1,1,1,0,0,0,2,4,2,1,16,16,4,70,75,6324224,270532608,42,0.0320282,183.897,8446.71
7,CUTLASS,gemm,cutlass_tensorop_s884gemm_f16_256x128_32x2_nt_align8,passed,success,universal,8192,128,128,f16:column,f16:row,f32:column,f32:column,1,0,serial,1,1,heuristic,invalid,invalid,false,false,1,tensorop,f32,256,128,32,1,1,1,0,0,0,2,4,2,1,16,16,4,70,75,6324224,270532608,42,0.0344893,170.775,7843.96
7,CUTLASS,gemm,cutlass_tensorop_s884gemm_f16_256x128_32x2_tn_align8,passed,success,universal,8192,128,128,f16:row,f16:column,f32:column,f32:column,1,0,serial,1,1,heuristic,invalid,invalid,false,false,1,tensorop,f32,256,128,32,1,1,1,0,0,0,2,4,2,1,16,16,4,70,75,6324224,270532608,42,0.0337648,174.439,8012.27
7,CUTLASS,gemm,cutlass_tensorop_s884gemm_f16_256x128_32x2_tt_align8,passed,success,universal,8192,128,128,f16:row,f16:row,f32:column,f32:column,1,0,serial,1,1,heuristic,invalid,invalid,false,false,1,tensorop,f32,256,128,32,1,1,1,0,0,0,2,4,2,1,16,16,4,70,75,6324224,270532608,42,0.0331674,177.581,8156.59
7,CUTLASS,gemm,cutlass_tensorop_f16_s884gemm_f16_256x128_32x2_nn_align8,passed,success,universal,8192,128,128,f16:column,f16:column,f16:column,f16:column,1,0,serial,1,1,heuristic,invalid,invalid,false,false,1,tensorop,f32,256,128,32,1,1,1,0,0,0,2,4,2,1,16,16,4,70,75,4227072,270532608,64,0.0337821,116.534,8008.17
7,CUTLASS,gemm,cutlass_tensorop_f16_s884gemm_f16_256x128_32x2_nt_align8,passed,success,universal,8192,128,128,f16:column,f16:row,f16:column,f16:column,1,0,serial,1,1,heuristic,invalid,invalid,false,false,1,tensorop,f32,256,128,32,1,1,1,0,0,0,2,4,2,1,16,16,4,70,75,4227072,270532608,64,0.0363382,108.337,7444.85
7,CUTLASS,gemm,cutlass_tensorop_f16_s884gemm_f16_256x128_32x2_tn_align8,passed,success,universal,8192,128,128,f16:row,f16:column,f16:column,f16:column,1,0,serial,1,1,heuristic,invalid,invalid,false,false,1,tensorop,f32,256,128,32,1,1,1,0,0,0,2,4,2,1,16,16,4,70,75,4227072,270532608,64,0.0360883,109.087,7496.4
7,CUTLASS,gemm,cutlass_tensorop_f16_s884gemm_f16_256x128_32x2_tt_align8,passed,success,universal,8192,128,128,f16:row,f16:row,f16:column,f16:column,1,0,serial,1,1,heuristic,invalid,invalid,false,false,1,tensorop,f32,256,128,32,1,1,1,0,0,0,2,4,2,1,16,16,4,70,75,4227072,270532608,64,0.0354237,111.134,7637.06
7,CUTLASS,gemm,cutlass_tensorop_s1688gemm_f16_256x128_32x2_nn_align8,passed,success,universal,8192,128,128,f16:column,f16:column,f32:column,f32:column,1,0,serial,1,1,heuristic,invalid,invalid,false,false,1,tensorop,f32,256,128,32,1,1,1,0,0,0,2,4,2,1,16,8,8,75,1024,6324224,270532608,42,0.0197939,297.561,13667.5
7,CUTLASS,gemm,cutlass_tensorop_s1688gemm_f16_256x128_32x2_nt_align8,passed,success,universal,8192,128,128,f16:column,f16:row,f32:column,f32:column,1,0,serial,1,1,heuristic,invalid,invalid,false,false,1,tensorop,f32,256,128,32,1,1,1,0,0,0,2,4,2,1,16,8,8,75,1024,6324224,270532608,42,0.0195699,300.967,13823.9
7,CUTLASS,gemm,cutlass_tensorop_s1688gemm_f16_256x128_32x2_tn_align8,passed,success,universal,8192,128,128,f16:row,f16:column,f32:column,f32:column,1,0,serial,1,1,heuristic,invalid,invalid,false,false,1,tensorop,f32,256,128,32,1,1,1,0,0,0,2,4,2,1,16,8,8,75,1024,6324224,270532608,42,0.0218682,269.336,12371.1
7,CUTLASS,gemm,cutlass_tensorop_s1688gemm_f16_256x128_32x2_tt_align8,passed,success,universal,8192,128,128,f16:row,f16:row,f32:column,f32:column,1,0,serial,1,1,heuristic,invalid,invalid,false,false,1,tensorop,f32,256,128,32,1,1,1,0,0,0,2,4,2,1,16,8,8,75,1024,6324224,270532608,42,0.0214154,275.031,12632.6
7,CUTLASS,gemm,cutlass_tensorop_f16_s1688gemm_f16_256x128_32x2_nn_align8,passed,success,universal,8192,128,128,f16:column,f16:column,f16:column,f16:column,1,0,serial,1,1,heuristic,invalid,invalid,false,false,1,tensorop,f32,256,128,32,1,1,1,0,0,0,2,4,2,1,16,8,8,75,1024,4227072,270532608,64,0.0179043,219.878,15109.9
7,CUTLASS,gemm,cutlass_tensorop_f16_s1688gemm_f16_256x128_32x2_nt_align8,passed,success,universal,8192,128,128,f16:column,f16:row,f16:column,f16:column,1,0,serial,1,1,heuristic,invalid,invalid,false,false,1,tensorop,f32,256,128,32,1,1,1,0,0,0,2,4,2,1,16,8,8,75,1024,4227072,270532608,64,0.0174544,225.546,15499.4
7,CUTLASS,gemm,cutlass_tensorop_f16_s1688gemm_f16_256x128_32x2_tn_align8,passed,success,universal,8192,128,128,f16:row,f16:column,f16:column,f16:column,1,0,serial,1,1,heuristic,invalid,invalid,false,false,1,tensorop,f32,256,128,32,1,1,1,0,0,0,2,4,2,1,16,8,8,75,1024,4227072,270532608,64,0.0200186,196.656,13514.1
7,CUTLASS,gemm,cutlass_tensorop_f16_s1688gemm_f16_256x128_32x2_tt_align8,passed,success,universal,8192,128,128,f16:row,f16:row,f16:column,f16:column,1,0,serial,1,1,heuristic,invalid,invalid,false,false,1,tensorop,f32,256,128,32,1,1,1,0,0,0,2,4,2,1,16,8,8,75,1024,4227072,270532608,64,0.019671,200.13,13752.8
8,CUTLASS,gemm,cutlass_simt_sgemm_128x128_8x2_nn_align1,passed,success,universal,128,256,128,f32:column,f32:column,f32:column,f32:column,1,0,serial,1,1,heuristic,invalid,invalid,false,false,1,simt,f32,128,128,8,1,1,1,0,0,0,2,4,2,1,1,1,1,50,1024,327680,8454144,25,0.0334589,9.12092,252.673
8,CUTLASS,gemm,cutlass_simt_sgemm_128x128_8x2_nt_align1,passed,success,universal,128,256,128,f32:column,f32:row,f32:column,f32:column,1,0,serial,1,1,heuristic,invalid,invalid,false,false,1,simt,f32,128,128,8,1,1,1,0,0,0,2,4,2,1,1,1,1,50,1024,327680,8454144,25,0.0332627,9.17471,254.163
8,CUTLASS,gemm,cutlass_simt_sgemm_128x128_8x2_tn_align1,passed,success,universal,128,256,128,f32:row,f32:column,f32:column,f32:column,1,0,serial,1,1,heuristic,invalid,invalid,false,false,1,simt,f32,128,128,8,1,1,1,0,0,0,2,4,2,1,1,1,1,50,1024,327680,8454144,25,0.0334691,9.11813,252.595
8,CUTLASS,gemm,cutlass_simt_sgemm_128x128_8x2_tt_align1,passed,success,universal,128,256,128,f32:row,f32:row,f32:column,f32:column,1,0,serial,1,1,heuristic,invalid,invalid,false,false,1,simt,f32,128,128,8,1,1,1,0,0,0,2,4,2,1,1,1,1,50,1024,327680,8454144,25,0.0334621,9.12005,252.648
8,CUTLASS,gemm,cutlass_tensorop_s884gemm_f16_256x128_32x2_nn_align8,passed,success,universal,128,256,128,f16:column,f16:column,f32:column,f32:column,1,0,serial,1,1,heuristic,invalid,invalid,false,false,1,tensorop,f32,256,128,32,1,1,1,0,0,0,2,4,2,1,16,16,4,70,75,229376,8454144,36,0.0256643,8.32374,329.412
8,CUTLASS,gemm,cutlass_tensorop_s884gemm_f16_256x128_32x2_nt_align8,passed,success,universal,128,256,128,f16:column,f16:row,f32:column,f32:column,1,0,serial,1,1,heuristic,invalid,invalid,false,false,1,tensorop,f32,256,128,32,1,1,1,0,0,0,2,4,2,1,16,16,4,70,75,229376,8454144,36,0.0283581,7.53306,298.121
8,CUTLASS,gemm,cutlass_tensorop_s884gemm_f16_256x128_32x2_tn_align8,passed,success,universal,128,256,128,f16:row,f16:column,f32:column,f32:column,1,0,serial,1,1,heuristic,invalid,invalid,false,false,1,tensorop,f32,256,128,32,1,1,1,0,0,0,2,4,2,1,16,16,4,70,75,229376,8454144,36,0.0258042,8.27863,327.627
8,CUTLASS,gemm,cutlass_tensorop_s884gemm_f16_256x128_32x2_tt_align8,passed,success,universal,128,256,128,f16:row,f16:row,f32:column,f32:column,1,0,serial,1,1,heuristic,invalid,invalid,false,false,1,tensorop,f32,256,128,32,1,1,1,0,0,0,2,4,2,1,16,16,4,70,75,229376,8454144,36,0.025561,8.3574,330.744
8,CUTLASS,gemm,cutlass_tensorop_f16_s884gemm_f16_256x128_32x2_nn_align8,passed,success,universal,128,256,128,f16:column,f16:column,f16:column,f16:column,1,0,serial,1,1,heuristic,invalid,invalid,false,false,1,tensorop,f32,256,128,32,1,1,1,0,0,0,2,4,2,1,16,16,4,70,75,163840,8454144,51,0.025777,5.91955,327.973
8,CUTLASS,gemm,cutlass_tensorop_f16_s884gemm_f16_256x128_32x2_nt_align8,passed,success,universal,128,256,128,f16:column,f16:row,f16:column,f16:column,1,0,serial,1,1,heuristic,invalid,invalid,false,false,1,tensorop,f32,256,128,32,1,1,1,0,0,0,2,4,2,1,16,16,4,70,75,163840,8454144,51,0.0284262,5.36785,297.406
8,CUTLASS,gemm,cutlass_tensorop_f16_s884gemm_f16_256x128_32x2_tn_align8,passed,success,universal,128,256,128,f16:row,f16:column,f16:column,f16:column,1,0,serial,1,1,heuristic,invalid,invalid,false,false,1,tensorop,f32,256,128,32,1,1,1,0,0,0,2,4,2,1,16,16,4,70,75,163840,8454144,51,0.0260198,5.86429,324.911
8,CUTLASS,gemm,cutlass_tensorop_f16_s884gemm_f16_256x128_32x2_tt_align8,passed,success,universal,128,256,128,f16:row,f16:row,f16:column,f16:column,1,0,serial,1,1,heuristic,invalid,invalid,false,false,1,tensorop,f32,256,128,32,1,1,1,0,0,0,2,4,2,1,16,16,4,70,75,163840,8454144,51,0.025655,5.94768,329.531
8,CUTLASS,gemm,cutlass_tensorop_s1688gemm_f16_256x128_32x2_nn_align8,passed,success,universal,128,256,128,f16:column,f16:column,f32:column,f32:column,1,0,serial,1,1,heuristic,invalid,invalid,false,false,1,tensorop,f32,256,128,32,1,1,1,0,0,0,2,4,2,1,16,8,8,75,1024,229376,8454144,36,0.0160061,13.3464,528.183
8,CUTLASS,gemm,cutlass_tensorop_s1688gemm_f16_256x128_32x2_nt_align8,passed,success,universal,128,256,128,f16:column,f16:row,f32:column,f32:column,1,0,serial,1,1,heuristic,invalid,invalid,false,false,1,tensorop,f32,256,128,32,1,1,1,0,0,0,2,4,2,1,16,8,8,75,1024,229376,8454144,36,0.0155971,13.6963,542.032
8,CUTLASS,gemm,cutlass_tensorop_s1688gemm_f16_256x128_32x2_tn_align8,passed,success,universal,128,256,128,f16:row,f16:column,f32:column,f32:column,1,0,serial,1,1,heuristic,invalid,invalid,false,false,1,tensorop,f32,256,128,32,1,1,1,0,0,0,2,4,2,1,16,8,8,75,1024,229376,8454144,36,0.0161878,13.1965,522.253
8,CUTLASS,gemm,cutlass_tensorop_s1688gemm_f16_256x128_32x2_tt_align8,passed,success,universal,128,256,128,f16:row,f16:row,f32:column,f32:column,1,0,serial,1,1,heuristic,invalid,invalid,false,false,1,tensorop,f32,256,128,32,1,1,1,0,0,0,2,4,2,1,16,8,8,75,1024,229376,8454144,36,0.0157094,13.5984,538.157
8,CUTLASS,gemm,cutlass_tensorop_f16_s1688gemm_f16_256x128_32x2_nn_align8,passed,success,universal,128,256,128,f16:column,f16:column,f16:column,f16:column,1,0,serial,1,1,heuristic,invalid,invalid,false,false,1,tensorop,f32,256,128,32,1,1,1,0,0,0,2,4,2,1,16,8,8,75,1024,163840,8454144,51,0.0154029,9.90645,548.868
8,CUTLASS,gemm,cutlass_tensorop_f16_s1688gemm_f16_256x128_32x2_nt_align8,passed,success,universal,128,256,128,f16:column,f16:row,f16:column,f16:column,1,0,serial,1,1,heuristic,invalid,invalid,false,false,1,tensorop,f32,256,128,32,1,1,1,0,0,0,2,4,2,1,16,8,8,75,1024,163840,8454144,51,0.0150048,10.1693,563.429
8,CUTLASS,gemm,cutlass_tensorop_f16_s1688gemm_f16_256x128_32x2_tn_align8,passed,success,universal,128,256,128,f16:row,f16:column,f16:column,f16:column,1,0,serial,1,1,heuristic,invalid,invalid,false,false,1,tensorop,f32,256,128,32,1,1,1,0,0,0,2,4,2,1,16,8,8,75,1024,163840,8454144,51,0.0155331,9.82339,544.266
8,CUTLASS,gemm,cutlass_tensorop_f16_s1688gemm_f16_256x128_32x2_tt_align8,passed,success,universal,128,256,128,f16:row,f16:row,f16:column,f16:column,1,0,serial,1,1,heuristic,invalid,invalid,false,false,1,tensorop,f32,256,128,32,1,1,1,0,0,0,2,4,2,1,16,8,8,75,1024,163840,8454144,51,0.0150675,10.1269,561.084
9,CUTLASS,gemm,cutlass_simt_sgemm_128x128_8x2_nn_align1,passed,success,universal,256,256,128,f32:column,f32:column,f32:column,f32:column,1,0,serial,1,1,heuristic,invalid,invalid,false,false,1,simt,f32,128,128,8,1,1,1,0,0,0,2,4,2,1,1,1,1,50,1024,524288,16908288,32,0.0335469,14.5552,504.02
9,CUTLASS,gemm,cutlass_simt_sgemm_128x128_8x2_nt_align1,passed,success,universal,256,256,128,f32:column,f32:row,f32:column,f32:column,1,0,serial,1,1,heuristic,invalid,invalid,false,false,1,simt,f32,128,128,8,1,1,1,0,0,0,2,4,2,1,1,1,1,50,1024,524288,16908288,32,0.0332778,14.6729,508.096
9,CUTLASS,gemm,cutlass_simt_sgemm_128x128_8x2_tn_align1,passed,success,universal,256,256,128,f32:row,f32:column,f32:column,f32:column,1,0,serial,1,1,heuristic,invalid,invalid,false,false,1,simt,f32,128,128,8,1,1,1,0,0,0,2,4,2,1,1,1,1,50,1024,524288,16908288,32,0.0335293,14.5628,504.284
9,CUTLASS,gemm,cutlass_simt_sgemm_128x128_8x2_tt_align1,passed,success,universal,256,256,128,f32:row,f32:row,f32:column,f32:column,1,0,serial,1,1,heuristic,invalid,invalid,false,false,1,simt,f32,128,128,8,1,1,1,0,0,0,2,4,2,1,1,1,1,50,1024,524288,16908288,32,0.0335283,14.5632,504.299
9,CUTLASS,gemm,cutlass_tensorop_s884gemm_f16_256x128_32x2_nn_align8,passed,success,universal,256,256,128,f16:column,f16:column,f32:column,f32:column,1,0,serial,1,1,heuristic,invalid,invalid,false,false,1,tensorop,f32,256,128,32,1,1,1,0,0,0,2,4,2,1,16,16,4,70,75,393216,16908288,43,0.0256618,14.2707,658.89
9,CUTLASS,gemm,cutlass_tensorop_s884gemm_f16_256x128_32x2_nt_align8,passed,success,universal,256,256,128,f16:column,f16:row,f32:column,f32:column,1,0,serial,1,1,heuristic,invalid,invalid,false,false,1,tensorop,f32,256,128,32,1,1,1,0,0,0,2,4,2,1,16,16,4,70,75,393216,16908288,43,0.0283069,12.9372,597.321
9,CUTLASS,gemm,cutlass_tensorop_s884gemm_f16_256x128_32x2_tn_align8,passed,success,universal,256,256,128,f16:row,f16:column,f32:column,f32:column,1,0,serial,1,1,heuristic,invalid,invalid,false,false,1,tensorop,f32,256,128,32,1,1,1,0,0,0,2,4,2,1,16,16,4,70,75,393216,16908288,43,0.0258333,14.1759,654.516
9,CUTLASS,gemm,cutlass_tensorop_s884gemm_f16_256x128_32x2_tt_align8,passed,success,universal,256,256,128,f16:row,f16:row,f32:column,f32:column,1,0,serial,1,1,heuristic,invalid,invalid,false,false,1,tensorop,f32,256,128,32,1,1,1,0,0,0,2,4,2,1,16,16,4,70,75,393216,16908288,43,0.0255418,14.3377,661.986
9,CUTLASS,gemm,cutlass_tensorop_f16_s884gemm_f16_256x128_32x2_nn_align8,passed,success,universal,256,256,128,f16:column,f16:column,f16:column,f16:column,1,0,serial,1,1,heuristic,invalid,invalid,false,false,1,tensorop,f32,256,128,32,1,1,1,0,0,0,2,4,2,1,16,16,4,70,75,262144,16908288,64,0.0258986,9.4268,652.866
9,CUTLASS,gemm,cutlass_tensorop_f16_s884gemm_f16_256x128_32x2_nt_align8,passed,success,universal,256,256,128,f16:column,f16:row,f16:column,f16:column,1,0,serial,1,1,heuristic,invalid,invalid,false,false,1,tensorop,f32,256,128,32,1,1,1,0,0,0,2,4,2,1,16,16,4,70,75,262144,16908288,64,0.0284384,8.58489,594.558
9,CUTLASS,gemm,cutlass_tensorop_f16_s884gemm_f16_256x128_32x2_tn_align8,passed,success,universal,256,256,128,f16:row,f16:column,f16:column,f16:column,1,0,serial,1,1,heuristic,invalid,invalid,false,false,1,tensorop,f32,256,128,32,1,1,1,0,0,0,2,4,2,1,16,16,4,70,75,262144,16908288,64,0.026041,9.37525,649.296
9,CUTLASS,gemm,cutlass_tensorop_f16_s884gemm_f16_256x128_32x2_tt_align8,passed,success,universal,256,256,128,f16:row,f16:row,f16:column,f16:column,1,0,serial,1,1,heuristic,invalid,invalid,false,false,1,tensorop,f32,256,128,32,1,1,1,0,0,0,2,4,2,1,16,16,4,70,75,262144,16908288,64,0.025696,9.50111,658.012
9,CUTLASS,gemm,cutlass_tensorop_s1688gemm_f16_256x128_32x2_nn_align8,passed,success,universal,256,256,128,f16:column,f16:column,f32:column,f32:column,1,0,serial,1,1,heuristic,invalid,invalid,false,false,1,tensorop,f32,256,128,32,1,1,1,0,0,0,2,4,2,1,16,8,8,75,1024,393216,16908288,43,0.015943,22.97,1060.54
9,CUTLASS,gemm,cutlass_tensorop_s1688gemm_f16_256x128_32x2_nt_align8,passed,success,universal,256,256,128,f16:column,f16:row,f32:column,f32:column,1,0,serial,1,1,heuristic,invalid,invalid,false,false,1,tensorop,f32,256,128,32,1,1,1,0,0,0,2,4,2,1,16,8,8,75,1024,393216,16908288,43,0.015385,23.8032,1099.01
9,CUTLASS,gemm,cutlass_tensorop_s1688gemm_f16_256x128_32x2_tn_align8,passed,success,universal,256,256,128,f16:row,f16:column,f32:column,f32:column,1,0,serial,1,1,heuristic,invalid,invalid,false,false,1,tensorop,f32,256,128,32,1,1,1,0,0,0,2,4,2,1,16,8,8,75,1024,393216,16908288,43,0.0161654,22.6539,1045.95
9,CUTLASS,gemm,cutlass_tensorop_s1688gemm_f16_256x128_32x2_tt_align8,passed,success,universal,256,256,128,f16:row,f16:row,f32:column,f32:column,1,0,serial,1,1,heuristic,invalid,invalid,false,false,1,tensorop,f32,256,128,32,1,1,1,0,0,0,2,4,2,1,16,8,8,75,1024,393216,16908288,43,0.0155226,23.5922,1089.27
9,CUTLASS,gemm,cutlass_tensorop_f16_s1688gemm_f16_256x128_32x2_nn_align8,passed,success,universal,256,256,128,f16:column,f16:column,f16:column,f16:column,1,0,serial,1,1,heuristic,invalid,invalid,false,false,1,tensorop,f32,256,128,32,1,1,1,0,0,0,2,4,2,1,16,8,8,75,1024,262144,16908288,64,0.0155824,15.6677,1085.09
9,CUTLASS,gemm,cutlass_tensorop_f16_s1688gemm_f16_256x128_32x2_nt_align8,passed,success,universal,256,256,128,f16:column,f16:row,f16:column,f16:column,1,0,serial,1,1,heuristic,invalid,invalid,false,false,1,tensorop,f32,256,128,32,1,1,1,0,0,0,2,4,2,1,16,8,8,75,1024,262144,16908288,64,0.0151235,16.1431,1118.01
9,CUTLASS,gemm,cutlass_tensorop_f16_s1688gemm_f16_256x128_32x2_tn_align8,passed,success,universal,256,256,128,f16:row,f16:column,f16:column,f16:column,1,0,serial,1,1,heuristic,invalid,invalid,false,false,1,tensorop,f32,256,128,32,1,1,1,0,0,0,2,4,2,1,16,8,8,75,1024,262144,16908288,64,0.0157738,15.4776,1071.93
9,CUTLASS,gemm,cutlass_tensorop_f16_s1688gemm_f16_256x128_32x2_tt_align8,passed,success,universal,256,256,128,f16:row,f16:row,f16:column,f16:column,1,0,serial,1,1,heuristic,invalid,invalid,false,false,1,tensorop,f32,256,128,32,1,1,1,0,0,0,2,4,2,1,16,8,8,75,1024,262144,16908288,64,0.0151898,16.0727,1113.14
10,CUTLASS,gemm,cutlass_simt_sgemm_128x128_8x2_nn_align1,passed,success,universal,512,256,128,f32:column,f32:column,f32:column,f32:column,1,0,serial,1,1,heuristic,invalid,invalid,false,false,1,simt,f32,128,128,8,1,1,1,0,0,0,2,4,2,1,1,1,1,50,1024,917504,33816576,36,0.0339843,25.1437,995.064
10,CUTLASS,gemm,cutlass_simt_sgemm_128x128_8x2_nt_align1,passed,success,universal,512,256,128,f32:column,f32:row,f32:column,f32:column,1,0,serial,1,1,heuristic,invalid,invalid,false,false,1,simt,f32,128,128,8,1,1,1,0,0,0,2,4,2,1,1,1,1,50,1024,917504,33816576,36,0.0337379,25.3274,1002.33
10,CUTLASS,gemm,cutlass_simt_sgemm_128x128_8x2_tn_align1,passed,success,universal,512,256,128,f32:row,f32:column,f32:column,f32:column,1,0,serial,1,1,heuristic,invalid,invalid,false,false,1,simt,f32,128,128,8,1,1,1,0,0,0,2,4,2,1,1,1,1,50,1024,917504,33816576,36,0.0340144,25.1215,994.184
10,CUTLASS,gemm,cutlass_simt_sgemm_128x128_8x2_tt_align1,passed,success,universal,512,256,128,f32:row,f32:row,f32:column,f32:column,1,0,serial,1,1,heuristic,invalid,invalid,false,false,1,simt,f32,128,128,8,1,1,1,0,0,0,2,4,2,1,1,1,1,50,1024,917504,33816576,36,0.0340432,25.1002,993.343
10,CUTLASS,gemm,cutlass_tensorop_s884gemm_f16_256x128_32x2_nn_align8,passed,success,universal,512,256,128,f16:column,f16:column,f32:column,f32:column,1,0,serial,1,1,heuristic,invalid,invalid,false,false,1,tensorop,f32,256,128,32,1,1,1,0,0,0,2,4,2,1,16,16,4,70,75,720896,33816576,46,0.0257085,26.1154,1315.39
10,CUTLASS,gemm,cutlass_tensorop_s884gemm_f16_256x128_32x2_nt_align8,passed,success,universal,512,256,128,f16:column,f16:row,f32:column,f32:column,1,0,serial,1,1,heuristic,invalid,invalid,false,false,1,tensorop,f32,256,128,32,1,1,1,0,0,0,2,4,2,1,16,16,4,70,75,720896,33816576,46,0.0283594,23.6743,1192.43
10,CUTLASS,gemm,cutlass_tensorop_s884gemm_f16_256x128_32x2_tn_align8,passed,success,universal,512,256,128,f16:row,f16:column,f32:column,f32:column,1,0,serial,1,1,heuristic,invalid,invalid,false,false,1,tensorop,f32,256,128,32,1,1,1,0,0,0,2,4,2,1,16,16,4,70,75,720896,33816576,46,0.0259046,25.9176,1305.43
10,CUTLASS,gemm,cutlass_tensorop_s884gemm_f16_256x128_32x2_tt_align8,passed,success,universal,512,256,128,f16:row,f16:row,f32:column,f32:column,1,0,serial,1,1,heuristic,invalid,invalid,false,false,1,tensorop,f32,256,128,32,1,1,1,0,0,0,2,4,2,1,16,16,4,70,75,720896,33816576,46,0.0255901,26.2362,1321.47
10,CUTLASS,gemm,cutlass_tensorop_f16_s884gemm_f16_256x128_32x2_nn_align8,passed,success,universal,512,256,128,f16:column,f16:column,f16:column,f16:column,1,0,serial,1,1,heuristic,invalid,invalid,false,false,1,tensorop,f32,256,128,32,1,1,1,0,0,0,2,4,2,1,16,16,4,70,75,458752,33816576,73,0.0258656,16.5179,1307.4
10,CUTLASS,gemm,cutlass_tensorop_f16_s884gemm_f16_256x128_32x2_nt_align8,passed,success,universal,512,256,128,f16:column,f16:row,f16:column,f16:column,1,0,serial,1,1,heuristic,invalid,invalid,false,false,1,tensorop,f32,256,128,32,1,1,1,0,0,0,2,4,2,1,16,16,4,70,75,458752,33816576,73,0.028367,15.0614,1192.11
10,CUTLASS,gemm,cutlass_tensorop_f16_s884gemm_f16_256x128_32x2_tn_align8,passed,success,universal,512,256,128,f16:row,f16:column,f16:column,f16:column,1,0,serial,1,1,heuristic,invalid,invalid,false,false,1,tensorop,f32,256,128,32,1,1,1,0,0,0,2,4,2,1,16,16,4,70,75,458752,33816576,73,0.0260224,16.4184,1299.52
10,CUTLASS,gemm,cutlass_tensorop_f16_s884gemm_f16_256x128_32x2_tt_align8,passed,success,universal,512,256,128,f16:row,f16:row,f16:column,f16:column,1,0,serial,1,1,heuristic,invalid,invalid,false,false,1,tensorop,f32,256,128,32,1,1,1,0,0,0,2,4,2,1,16,16,4,70,75,458752,33816576,73,0.0256893,16.6313,1316.37
10,CUTLASS,gemm,cutlass_tensorop_s1688gemm_f16_256x128_32x2_nn_align8,passed,success,universal,512,256,128,f16:column,f16:column,f32:column,f32:column,1,0,serial,1,1,heuristic,invalid,invalid,false,false,1,tensorop,f32,256,128,32,1,1,1,0,0,0,2,4,2,1,16,8,8,75,1024,720896,33816576,46,0.0163773,40.995,2064.85
10,CUTLASS,gemm,cutlass_tensorop_s1688gemm_f16_256x128_32x2_nt_align8,passed,success,universal,512,256,128,f16:column,f16:row,f32:column,f32:column,1,0,serial,1,1,heuristic,invalid,invalid,false,false,1,tensorop,f32,256,128,32,1,1,1,0,0,0,2,4,2,1,16,8,8,75,1024,720896,33816576,46,0.0156243,42.9706,2164.35
10,CUTLASS,gemm,cutlass_tensorop_s1688gemm_f16_256x128_32x2_tn_align8,passed,success,universal,512,256,128,f16:row,f16:column,f32:column,f32:column,1,0,serial,1,1,heuristic,invalid,invalid,false,false,1,tensorop,f32,256,128,32,1,1,1,0,0,0,2,4,2,1,16,8,8,75,1024,720896,33816576,46,0.016465,40.7767,2053.85
10,CUTLASS,gemm,cutlass_tensorop_s1688gemm_f16_256x128_32x2_tt_align8,passed,success,universal,512,256,128,f16:row,f16:row,f32:column,f32:column,1,0,serial,1,1,heuristic,invalid,invalid,false,false,1,tensorop,f32,256,128,32,1,1,1,0,0,0,2,4,2,1,16,8,8,75,1024,720896,33816576,46,0.0158579,42.3376,2132.47
10,CUTLASS,gemm,cutlass_tensorop_f16_s1688gemm_f16_256x128_32x2_nn_align8,passed,success,universal,512,256,128,f16:column,f16:column,f16:column,f16:column,1,0,serial,1,1,heuristic,invalid,invalid,false,false,1,tensorop,f32,256,128,32,1,1,1,0,0,0,2,4,2,1,16,8,8,75,1024,458752,33816576,73,0.0156643,27.2751,2158.83
10,CUTLASS,gemm,cutlass_tensorop_f16_s1688gemm_f16_256x128_32x2_nt_align8,passed,success,universal,512,256,128,f16:column,f16:row,f16:column,f16:column,1,0,serial,1,1,heuristic,invalid,invalid,false,false,1,tensorop,f32,256,128,32,1,1,1,0,0,0,2,4,2,1,16,8,8,75,1024,458752,33816576,73,0.0150454,28.397,2247.63
10,CUTLASS,gemm,cutlass_tensorop_f16_s1688gemm_f16_256x128_32x2_tn_align8,passed,success,universal,512,256,128,f16:row,f16:column,f16:column,f16:column,1,0,serial,1,1,heuristic,invalid,invalid,false,false,1,tensorop,f32,256,128,32,1,1,1,0,0,0,2,4,2,1,16,8,8,75,1024,458752,33816576,73,0.0158144,27.0163,2138.34
10,CUTLASS,gemm,cutlass_tensorop_f16_s1688gemm_f16_256x128_32x2_tt_align8,passed,success,universal,512,256,128,f16:row,f16:row,f16:column,f16:column,1,0,serial,1,1,heuristic,invalid,invalid,false,false,1,tensorop,f32,256,128,32,1,1,1,0,0,0,2,4,2,1,16,8,8,75,1024,458752,33816576,73,0.0151958,28.116,2225.38
11,CUTLASS,gemm,cutlass_simt_sgemm_128x128_8x2_nn_align1,passed,success,universal,1024,256,128,f32:column,f32:column,f32:column,f32:column,1,0,serial,1,1,heuristic,invalid,invalid,false,false,1,simt,f32,128,128,8,1,1,1,0,0,0,2,4,2,1,1,1,1,50,1024,1703936,67633152,39,0.0340938,46.5456,1983.74
11,CUTLASS,gemm,cutlass_simt_sgemm_128x128_8x2_nt_align1,passed,success,universal,1024,256,128,f32:column,f32:row,f32:column,f32:column,1,0,serial,1,1,heuristic,invalid,invalid,false,false,1,simt,f32,128,128,8,1,1,1,0,0,0,2,4,2,1,1,1,1,50,1024,1703936,67633152,39,0.03384,46.8946,1998.62
11,CUTLASS,gemm,cutlass_simt_sgemm_128x128_8x2_tn_align1,passed,success,universal,1024,256,128,f32:row,f32:column,f32:column,f32:column,1,0,serial,1,1,heuristic,invalid,invalid,false,false,1,simt,f32,128,128,8,1,1,1,0,0,0,2,4,2,1,1,1,1,50,1024,1703936,67633152,39,0.0342832,46.2884,1972.78
11,CUTLASS,gemm,cutlass_simt_sgemm_128x128_8x2_tt_align1,passed,success,universal,1024,256,128,f32:row,f32:row,f32:column,f32:column,1,0,serial,1,1,heuristic,invalid,invalid,false,false,1,simt,f32,128,128,8,1,1,1,0,0,0,2,4,2,1,1,1,1,50,1024,1703936,67633152,39,0.0343571,46.1888,1968.53
11,CUTLASS,gemm,cutlass_tensorop_s884gemm_f16_256x128_32x2_nn_align8,passed,success,universal,1024,256,128,f16:column,f16:column,f32:column,f32:column,1,0,serial,1,1,heuristic,invalid,invalid,false,false,1,tensorop,f32,256,128,32,1,1,1,0,0,0,2,4,2,1,16,16,4,70,75,1376256,67633152,49,0.0260838,49.1392,2592.91
11,CUTLASS,gemm,cutlass_tensorop_s884gemm_f16_256x128_32x2_nt_align8,passed,success,universal,1024,256,128,f16:column,f16:row,f32:column,f32:column,1,0,serial,1,1,heuristic,invalid,invalid,false,false,1,tensorop,f32,256,128,32,1,1,1,0,0,0,2,4,2,1,16,16,4,70,75,1376256,67633152,49,0.028407,45.1204,2380.86
11,CUTLASS,gemm,cutlass_tensorop_s884gemm_f16_256x128_32x2_tn_align8,passed,success,universal,1024,256,128,f16:row,f16:column,f32:column,f32:column,1,0,serial,1,1,heuristic,invalid,invalid,false,false,1,tensorop,f32,256,128,32,1,1,1,0,0,0,2,4,2,1,16,16,4,70,75,1376256,67633152,49,0.0262861,48.7611,2572.96
11,CUTLASS,gemm,cutlass_tensorop_s884gemm_f16_256x128_32x2_tt_align8,passed,success,universal,1024,256,128,f16:row,f16:row,f32:column,f32:column,1,0,serial,1,1,heuristic,invalid,invalid,false,false,1,tensorop,f32,256,128,32,1,1,1,0,0,0,2,4,2,1,16,16,4,70,75,1376256,67633152,49,0.0258848,49.517,2612.85
11,CUTLASS,gemm,cutlass_tensorop_f16_s884gemm_f16_256x128_32x2_nn_align8,passed,success,universal,1024,256,128,f16:column,f16:column,f16:column,f16:column,1,0,serial,1,1,heuristic,invalid,invalid,false,false,1,tensorop,f32,256,128,32,1,1,1,0,0,0,2,4,2,1,16,16,4,70,75,851968,67633152,79,0.0262749,30.1983,2574.06
